index,Regulator Name,Regulator Type,Regulator Subtype,Regulator HGNC Symbol,Regulator Database,Regulator ID,Regulator Compartment,Regulator Compartment ID,Regulated Name,Regulated Type,Regulated Subtype,Regulated HGNC Symbol,Regulated Database,Regulated ID,Regulated Compartment,Regulated Compartment ID,Sign,Connection Type,Mechanism,Site,Cell Line,Cell Type,Tissue Type,Organism,Score,Source,Statements,Paper IDs,Evidence Score,Match Score,Kind Score,Epistemic Value,Total Score
19,akt,proteinfamilyproteincomplex,,,,akt,,,craf,protein,,,uniprot,p04049,,,positive,d,phosphorylation,,,,,,nan,nan,"thus , active akt could phosphorylate and inactivate craf , leading to decreased erk1/2 signaling , but cells with mutant kras can bypass this regulatory mechanism and maintain high craf activity [ xref_bibr , xref_bibr ] .",pmc3135566,1,10,38,1,48
496,igf-1,protein,,,,p05019,,,pp2a,protein,,,uniprot,p67775,,,negative,i,none,,cellosaurus:cvcl_0041,,,,nan,nan,"furthermore , we found that igf-1 decreased the activity of pp2a , which was prevented by rapamycin ( xref_fig ) . ++++ igf-1 stimulation of mtor represses pp2a , resulting in activation of erk1/2 and this is prevented by rapamycin .",pmc2868031,1,10,38,1,48
252,chk2,protein,,,,o96017,,,e2f1,protein,,,uniprot,q01094,,,positive,d,phosphorylation,,,,,,nan,nan,"atm and chk2 phosphorylate e2f1 on s31 and s364 , respectively , which leads to e2f stabilization [ xref_bibr , xref_bibr ] .",pmc2954851,1,10,38,1,48
522,kras,protein,,,,p01116,,,wnt,proteinfamilyproteincomplex,,,be,wnt,,,positive,i,none,,cellosaurus:cvcl_0025,,,,nan,nan,"64 accordingly , horst et al. 65 showed that forced expression of the kras oncogene in the caco-2 crc cell line leads to nuclear accumulation of beta-catenin and increases wnt activity , whereas blocking the tyrosine kinase receptor egfr , an activator of mapk signaling , has the converse effect . ++++ oncogenic kras signalling promotes the wnt and beta-catenin pathway through lrp6 in colorectal cancer .",pmc4687460,1,10,38,1,48
144,atm,protein,,,,q13315,nucleus,go:0005634,p53,protein,,,uniprot,p04637,nucleus,go:0005634,positive,d,phosphorylation,,,,,,nan,nan,"after dna damage , p53 is phosphorylated by atm , an event that displaces mdm2 and allows p53 to accumulate in the nucleus where it can perform its function as transcription factor . ++++ another mechanism involves the phosphorylation of p53 by atm and chk2 , which stabilizes and activates p53 .",pmc4296918,1,10,38,1,48
141,atm,protein,,,,q13315,,,p53,protein,,,uniprot,p04637,,,positive,d,phosphorylation,,,,,,nan,nan,"atm , atr , and dna-pk phosphorylate p53 on s15 , while chk1 and chk2 phosphorylate p53 on s20 which stabilize p53 by preventing binding to mdm2 [ xref_bibr - xref_bibr ] .",pmc2954851,1,10,38,1,48
140,atm,protein,,,,q13315,,,p53,protein,,,uniprot,p04637,,,negative,d,dephosphorylation,,,,,,nan,nan,"atm dependent dephosphorylation of p53 at s376 and chk1 and chk2 dependent phosphorylation of p53 at s378 , s366 and t387 generate 14-3-3 binding sites in vivo . ++++ atm dependent dephosphorylation of p53 at s376 and chk1 and chk2 dependent phosphorylation of p53 at s378 , s366 and t387 generate 14-3-3 binding sites in vivo . ++++ atm dependent dephosphorylation of p53 at s376 and chk1 and chk2 dependent phosphorylation of p53 at s378 , s366 and t387 generate 14-3-3 binding sites in vivo . ++++ atm dependent dephosphorylation of p53 at s376 and chk1 and chk2 dependent phosphorylation of p53 at s378 , s366 and t387 generate 14-3-3 binding sites in vivo .",pmc2817464,1,10,38,1,48
960,tp53,protein,,,,p04637,other,go:0005925,wnt,proteinfamilyproteincomplex,,,be,wnt,other,go:0005925,negative,i,none,,,,,,nan,nan,tp53 and mirna34 are normally suppressors of wnt and beta catenin signaling [ xref_bibr ] .,pmc4102778,1,10,38,1,48
504,ir,protein,,,,p06213,other,go:0016020,irs,proteinfamily,,,pfam,pf02174,other,go:0016020,positive,d,phosphorylation,,,,,,nan,nan,"ir phosphorylates irs proteins , which are linked to the activation of ras and erk pathway through binding to the grb2 and sos complex ( sos is a guanine nucleotide exchange factor for ras ) , whereas egfr activates the same pathway either by direct binding of grb2-sos or by binding and phosphorylation of shc , which then recruits the grb2 and sos complex .",pmc2683723,1,10,38,1,48
898,src,proteinfamilyproteincomplex,,,,src,,,caspase-7,protein,,,uniprot,p55210,,,positive,d,phosphorylation,,cellosaurus:cvcl_0320,,,,nan,nan,the results confirmed that src could phosphorylate caspase-7 at tyrosine residues ( xref_fig ) .,pmc4040661,1,10,38,1,48
718,pdk1,protein,,,,q15118,other,go:0016020,akt,proteinfamilyproteincomplex,,,be,akt,other,go:0016020,positive,d,phosphorylation,,,,,,nan,nan,pdk1 and the ser/thr kinase akt are recruited to the membrane where pdk1 phosphorylates and activates akt .,pmc2361102,1,10,38,1,48
716,pdk1,protein,,,,q15118,,,mek,proteinfamilyproteincomplex,,,be,mek,,,positive,i,none,,cellosaurus:cvcl_0045,,,,nan,nan,"an alternative pathway of pip 3 -dependent erk activation involves phosphoinositide dependent kinase-1 ( pdk1 ) , a target of pi3k , which can activate mek directly and erk indirectly through the activation of certain pkc isoforms , although it has been reported that pkcs are not involved in egf induced erk activation .",pmc2683723,1,10,38,1,48
127,atm,protein,,,,q13315,,,akt,proteinfamilyproteincomplex,,,be,akt,,,positive,d,phosphorylation,,,,,,nan,nan,"although atm binds to akt directly , there is no apparent direct phosphorylation of akt ser473 by atm , suggesting that other intermediate proteins downstream of atm may be involved in direct phosphorylation of akt in response to insulin or ir .",pmc3317191,1,10,38,1,48
380,erk,proteinfamilyproteincomplex,,,,erk,other,go:0016020,runx2,protein,,,uniprot,q13950,other,go:0016020,positive,d,phosphorylation,,,,,,"nan,nan,nan,nan","nan,nan,nan,nan","erk phosphorylation sites in runx2 ( s43 , s301 , s309 and s510 ) have been identified and functionally characterized [ xref_bibr ] .,erk phosphorylation sites in runx2 ( s43 , s301 , s309 and s510 ) have been identified and functionally characterized [ xref_bibr ] .,erk phosphorylation sites in runx2 ( s43 , s301 , s309 and s510 ) have been identified and functionally characterized [ xref_bibr ] .,erk phosphorylation sites in runx2 ( s43 , s301 , s309 and s510 ) have been identified and functionally characterized [ xref_bibr ] .","pmc4513933,pmc4513933,pmc4513933,pmc4513933",4,1,40,1,44
78,akt,proteinfamilyproteincomplex,,,,akt,nucleus,go:0005634,p27 kip1,protein,,,uniprot,p46527,nucleus,go:0005634,positive,d,phosphorylation,,,,,,"nan,nan,nan","nan,nan,nan","akt directly binds to and phosphorylates p27 kip1 at three residues , ser10 , thr187 , and thr198 [ xref_bibr - xref_bibr ] .,akt directly binds to and phosphorylates p27 kip1 at three residues , ser10 , thr187 , and thr198 [ xref_bibr - xref_bibr ] .,akt directly binds to and phosphorylates p27 kip1 at three residues , ser10 , thr187 , and thr198 [ xref_bibr - xref_bibr ] .","pmc3317191,pmc3317191,pmc3317191",3,1,40,1,43
373,erk,proteinfamilyproteincomplex,,,,erk,other,go:0001725,rhoa,protein,,,uniprot,p61586,other,go:0001725,positive,d,phosphorylation,,,,,,"nan,nan","nan,nan","the results have demonstrated that 88 s and 100 t of rhoa are phosphorylated by erk . ++++ rhoa phosphorylation by erk on 88 s and 100 t increased rhoa activity ( xref_fig ) , which is opposite to the effects of rhoa s188 phosphorylation , as reported previously ( 5 , 6 , 11 ) . ++++ here , we provide evidence that rhoa is phosphorylated by erk on 88 s and 100 t in response to egf stimulation . ++++ in conclusion , erk phosphorylates rhoa on 88 s and 100 t in response to egf , which upregulates rhoa activity .,here , we provide evidence that rhoa is phosphorylated by erk on 88 s and 100 t in response to egf stimulation . ++++ rhoa phosphorylation by erk on 88 s and 100 t increased rhoa activity ( xref_fig ) , which is opposite to the effects of rhoa s188 phosphorylation , as reported previously ( 5 , 6 , 11 ) . ++++ in conclusion , erk phosphorylates rhoa on 88 s and 100 t in response to egf , which upregulates rhoa activity . ++++ the results have demonstrated that 88 s and 100 t of rhoa are phosphorylated by erk .","pmc4729484,pmc4729484",2,1,40,1,42
40,akt,proteinfamilyproteincomplex,,,,akt,,,myt1,protein,,,uniprot,q01538,,,positive,d,phosphorylation,,,cl:cl:0000023,,,"nan,nan","nan,nan","thus , the direct phosphorylation of myt1 by akt reverses the balance between myt1 and cdc25 activities and initiates the activation of cyclin b-cdc2 to cause meiotic g2/m-phase transition .,akt phosphorylates myt1 at ser75 and severely reduces myt1 mediated tyr15 cdk1 phosphorylation resulting in the activation of cyclin b associated cdk1 kinase activity [ xref_bibr ] .","pmc3317191,pmc3317191",2,1,40,1,42
353,erk,proteinfamilyproteincomplex,,,,erk,,,mcl-1,protein,,,uniprot,q07820,,,positive,d,phosphorylation,,,,,,"nan,nan","nan,nan","in addition to gsk3beta , it has been show that erk phosphorylates mcl-1 at t92 and t163 .,in addition to gsk3beta , it has been show that erk phosphorylates mcl-1 at t92 and t163 .","pmc3355968,pmc3355968",2,1,40,1,42
98,akt,proteinfamilyproteincomplex,,,,akt,plasma membrane,go:0005886,twist1,protein,,,uniprot,q15672,plasma membrane,go:0005886,positive,i,phosphorylation,,,,,,"nan,nan","nan,nan","in addition , akt directly phosphorylates twist1 at ser42 to promote twist1 mediated expression of tgfbeta2 , leading to enhanced tgfbeta signaling in breast cancer cells [ xref_bibr ] . ++++ in addition , akt directly phosphorylates twist1 at ser42 to promote twist1 mediated expression of tgfbeta2 , leading to enhanced tgfbeta signaling in breast cancer cells [ xref_bibr ] .,as another illustration of this concept , akt mediated phosphorylation of the emt transcription factor twist1 leads to transcriptional activation of the tgfbeta2 promoter and activated tgfbeta signaling promoting emt and breast cancer metastasis [ xref_bibr ] .","pmc4513933,pmc4513933",2,1,40,1,42
62,akt,proteinfamilyproteincomplex,,,,akt,,,satb1,protein,,,uniprot,q01826,,,positive,d,phosphorylation,,cellosaurus:cvcl_0063,,,,"nan,nan","nan,nan","we next generated the mutant proteins and examined whether akt phosphorylated satb1 at serine 47 in vitro .,we next generated the mutant proteins and examined whether akt phosphorylated satb1 at serine 47 in vitro .","pmc3675137,pmc3675137",2,1,40,1,42
63,akt,proteinfamilyproteincomplex,,,,akt,,,skp2,protein,,,uniprot,q13309,,,positive,d,phosphorylation,,,,,,"nan,nan","nan,nan","interestingly , recent studies revealed that the protein stability of p27 kip1 is controlled by akt dependent phosphorylation of skp2 [ xref_bibr , xref_bibr ] .,akt interacts with and directly phosphorylates skp2 at ser72 , which triggers scf complex formation and e3 ligase activity [ xref_bibr ] .","pmc3317191,pmc3317191",2,1,40,1,42
378,erk,proteinfamilyproteincomplex,,,,erk,other,go:0015629,rhoa,protein,,,uniprot,p61586,other,go:0015629,positive,d,phosphorylation,,,,,,"nan,nan","nan,nan","in the present study , we have shown that rhoa is phosphorylated at additional sites , s88 and t100 , by activated erk ( figs xref_fig - xref_fig ) .,in the present study , we have shown that rhoa is phosphorylated at additional sites , s88 and t100 , by activated erk ( figs xref_fig - xref_fig ) .","pmc4729484,pmc4729484",2,1,40,1,42
606,mtorc1,proteinfamilyproteincomplex,,,,mtorc1,,,4ebp1,protein,,,uniprot,q13541,,,positive,d,phosphorylation,,,,,,"nan,nan","nan,nan","mtorc1 phosphorylates 4ebp1 at multiple sites to promote the dissociation of eif4e from 4ebp1 , relieving the inhibitory effect of 4ebp1 on eif4e dependent translation initiation [ xref_bibr ] .,once activated , mtorc1 phosphorylates p70 s6k and 4ebp1 to promote cap dependent translation and cell growth .","pmc3291999,pmc4216640",2,1,40,1,42
605,mtorc1,proteinfamilyproteincomplex,,,,mtorc1,,,4e-bp1,protein,,,uniprot,q13541,,,positive,d,phosphorylation,,,,,,"nan,nan","nan,nan","4e-bp1 phosphorylation by mtorc1 results in the release of the eukaryotic initiation factor 4e ( eif4e ) , which then associates with eukaryotic initiation factor 4g ( eif4g ) to stimulate translation initiation .,mtorc1 phosphorylates two main substrates , ribosomal protein s6 kinase 1 ( s6k1 ) and eukaryotic initiation factor 4e binding protein 1 ( 4e-bp1 ) .","pmc3837323,pmc4720880",2,1,40,1,42
593,mtor,protein,,,,p42345,,,uvrag,protein,,,uniprot,q9p2y5,,,positive,d,phosphorylation,,uaz:cvcl_9115,,,,"nan,nan","nan,nan","mtor phosphorylates uvrag at serine 550 and serine 571 .,mtor phosphorylates uvrag at serine 550 and serine 571 .","pmc4585463,pmc4585463",2,1,40,1,42
594,mtor,protein,,,,p42345,,,uvrag,protein,,,uniprot,q9p2y5,,,positive,i,phosphorylation,,,,,,"nan,nan","nan,nan","taken together with the in vitro data , this suggests that mtor mediated uvrag phosphorylation at s550 and s571 enhances vps34 activity .,taken together with the in vitro data , this suggests that mtor mediated uvrag phosphorylation at s550 and s571 enhances vps34 activity .","pmc4585463,pmc4585463",2,1,40,1,42
602,mtor,protein,,,,p42345,other,go:0005768,uvrag,protein,,,uniprot,q9p2y5,other,go:0005768,positive,d,phosphorylation,,,,,,"nan,nan","nan,nan","we do note that during the submission of this manuscript , a paper was published describing mtor phosphorylation of uvrag at serine 498 ( s498 ) however , phosphorylation inhibited vps34 activity through enhanced rubicon binding and decreased trafficking of endosomes and autophagosomes to the lysosome .,we do note that during the submission of this manuscript , a paper was published describing mtor phosphorylation of uvrag at serine 498 ( s498 ) however , phosphorylation inhibited vps34 activity through enhanced rubicon binding and decreased trafficking of endosomes and autophagosomes to the lysosome .","pmc4585463,pmc4585463",2,1,40,1,42
690,p53,protein,,,,p04637,,,snail,proteinfamily,,,interpro,ipr029795,,,negative,i,ubiquitination,,,,,,"nan,nan","nan,nan","independently of kinases , wild type p53 but not mutant p53 has been shown to interact with and induce snail and slug ubiquitination and degradation .,mdm2 functions as an ubiquitin ligase for p53 induced snail ubiquitination .","pmc3355968,pmc3355968",2,1,40,1,42
684,p38mapk,proteinfamilyproteincomplex,,,,p38,,,gsk-3beta,protein,,,uniprot,p49841,,,positive,d,phosphorylation,,cellosaurus:cvcl_4461,,,,"nan,nan","nan,nan","p38mapk phosphorylates gsk-3beta at s389 and t390 [ xref_bibr ] .,p38mapk phosphorylates gsk-3beta at s389 and t390 [ xref_bibr ] .","pmc4102778,pmc4102778",2,1,40,1,42
617,mtorc1,proteinfamilyproteincomplex,,,,mtorc1,,,rictor,protein,,,uniprot,q6r327,,,positive,i,phosphorylation,,,,,,"nan,nan","nan,nan","recent findings have also highlighted the existence of a rapamycin sensitive , mtorc1 and p70s6k mediated phosphorylation of rictor on t1135 .,recent findings have also highlighted the existence of a rapamycin sensitive , mtorc1 and p70s6k mediated phosphorylation of rictor on thr 1135 .","pmc3660063,pmc3837323",2,1,40,1,42
811,raf,proteinfamilyproteincomplex,,,,raf,other,go:0009986,cd24,protein,,,uniprot,p25063,other,go:0009986,negative,i,transcription,,,,,,"nan,nan","nan,nan","moreover , activation of either the raf or pi3k pathway is sufficient to downregulate cd24 expression at both the mrna and protein levels . ++++ although inhibition of raf by sorafenib only partially restored cd24 expression , sorafenib should still be considered as a potential therapeutic strategy to alter cd24 expression in cd24 - cells , such as bcscs . ++++ activation of either the raf or the pi3k pathway is sufficient to downregulate cd24 expression . ++++ we next determined if inhibition of both pi3k and raf together could further restore cd24 expression in rasv12 cells at the mrna and surface protein levels . ++++ inhibition of raf partially restores cd24 cell surface protein expression in cells expressing oncogenic ras but not control cells . ++++ we further examined the pathways regulated by ras to show that either the pi3k or raf pathways can repress cd24 expression . ++++ therefore , the raf pathway is the major repressor of cd24 mrna and protein expression , with pi3k also able to substantially inhibit cd24 expression . ++++ therefore , together these data suggest that activation of either the pi3k or the raf pathway is sufficient to decrease cd24 mrna expression but the raf pathway is the major repressor of cd24 expression at both the mrna and protein levels .,surprisingly , inhibition of raf but not mek or pi3k significantly increased cd24 surface expression . ++++ therefore , even though activation of the raf pathway is sufficient to decrease cd24 mrna and protein , inhibition of oncogenic raf and mek signaling does not restore cd24 expression to the level of control cells at the mrna or protein level . ++++ surprisingly , inhibition of the raf pathway , at the level of mek or raf , or the pi3k pathway , at the level of pi3k , either separately or together , was not sufficient to fully restore cd24 expression in rasv12 cells . ++++ in contrast , inhibition of raf with sorafenib did not restore cd24 mrna expression but significantly increased the proportion of rasv12 cells expressing cd24 .","pmc4525067,pmc4525067",2,1,40,1,42
561,mtor,protein,,,,p42345,,,4e-bp1,protein,,,uniprot,q13541,,,positive,d,phosphorylation,,,,,,"nan,nan","nan,nan","in response to stimuli such as growth factors , hormones , nutrients , or increased energy levels , mtor phosphorylates 4e-bp1 primarily at residues ser65 and thr73 .,in response to stimuli such as growth factors , hormones , nutrients , or increased energy levels , mtor phosphorylates 4e-bp1 primarily at residues ser65 and thr73 .","pmc2361102,pmc2361102",2,1,40,1,42
259,chk2,protein,,,,o96017,,,reggamma,protein,,,uniprot,p61289,,,positive,d,phosphorylation,,cellosaurus:cvcl_0042,,,,"nan,nan","nan,nan","moreover , when we overexpressed reggamma wt or reggamma s247a in control or chk2 silenced u2os cells , we detected an increase in p53 acetylation , upon etoposide , only with the ectopic wild-type protein and in chk2 proficient cells , clearly indicating that sirt1 inhibition by dbc1 requires reggamma phosphorylated on s247 by chk2 .,together , these results indicate that dbc1 and reggamma interact in human cells and that chk2 can phosphorylate a fraction of the total pool of reggamma in human cells on ser 247 .","pmc4245943,pmc4245943",2,1,40,1,42
260,chk2,protein,,,,o96017,,,reggamma,protein,,,uniprot,p61289,,,positive,d,phosphorylation,,,,,,"nan,nan","nan,nan","to determine whether chk2 also phosphorylates reggamma in vivo , cell extracts prepared from etoposide treated or untreated samples , with or without the chk2 inhibitor vrx , were examined with the phos-tag western blot technique . ++++ additionally , we found that reggamma , like chk2 and dbc1-thr454 phosphorylation , is required to increase dbc1-sirt1 binding and sirt1 activity inhibition and that reggamma phosphorylation by chk2 is necessary to increase reggamma-dbc1 binding in response to dna damage .,in accordance with this , we found that , upon dna damage chk2 phosphorylates reggamma on ser247 , both in vitro and in vivo , and that this modification promotes p53 acetylation , puma protein induction and apoptosis .","pmc4245943,pmc4245943",2,1,40,1,42
914,src,proteinfamilyproteincomplex,,,,src,,,tks4,protein,,,uniprot,a1x283,,,positive,i,phosphorylation,,cellosaurus:cvcl_0045,,,,"nan,nan","nan,nan","these results are in agreement with those illustrated in xref_fig , a and b and support the hypothesis that src induces the interaction between tks4 and noxa1 by phosphorylating the tyr110 of noxa1 and the tyr508 of tks4 , thus increasing nox1 dependent ros generation . ++++ finally , we examined whether src mediated phosphorylation of tks4 on tyr508 had an effect on nox1 dependent ros generation .,these results are in agreement with those illustrated in xref_fig , a and b and support the hypothesis that src induces the interaction between tks4 and noxa1 by phosphorylating the tyr110 of noxa1 and the tyr508 of tks4 , thus increasing nox1 dependent ros generation .","pmc2993755,pmc2993755",2,1,40,1,42
563,mtor,protein,,,,p42345,,,4e-bp1,protein,,,uniprot,q13541,,,positive,i,phosphorylation,,,,,,nan,nan,"these mtor kinase inhibitors such as torin1 , pp242 and pp30 block p70s6k , 4e-bp1 and akt phosphorylation and thus inhibit both mtorc1 and mtorc2 [ xref_bibr , xref_bibr ] .",pmc3750018,1,1,40,1,41
952,tgf-beta1,protein,,,,p01137,,,survivin,protein,,,uniprot,q4r1j6,,,positive,i,transcription,,cellosaurus:cvcl_0145,,,,nan,nan,"tgf-beta1 induced survivin expression , which in turn stabilized tubulin and aurora b. rt-pcr and western blot analysis revealed that survivin expression increased in arpe-19 cells following tgf-beta1 treatment . ++++ tgf-beta1 can upregulate survivin expression via the pi3k pathway , and this increased level of survivin promotes cell cycle progression and microtubule stability , thereby inducing cells to undergo emt and evade apoptosis .",pmc3730417,1,1,40,1,41
660,p21,protein,,,,p38936,,,cdk4,protein,,,uniprot,p11802,,,positive,i,none,,,,,,nan,nan,"in some circumstances , as in quiescent dog thyrocytes which express high amounts of cyclin d3 [ xref_bibr ] but low levels of p27 and p21 , p27 ( in response to tsh ) or p21 rather than d-type cyclins may have to be up-regulated to facilitate cdk4 activation .",pmc1647274,1,1,40,1,41
137,atm,protein,,,,q13315,,,kap-1,protein,,,uniprot,q13263,,,positive,d,phosphorylation,,,,,,nan,nan,"to relax chromatin atm phosphorylates kap-1 at ser824 , disrupting the complex between kap-1 and the nucleosome remodeler protein ( chd3 ) and allowing chd3 to be removed or to dissociate from heterochromatin .",pmc4296918,1,1,40,1,41
24,akt,proteinfamilyproteincomplex,,,,akt,,,foxo3a,protein,,,uniprot,o43524,,,negative,i,phosphorylation,,,,,,nan,nan,"conversely , when we activated akt in crc cells using constitutively activated akt constructs prior to selenite treatment , we found that , consistent with our hypothesis , constitutively activated akt increased phosphorylation of akt and foxo3a and selenite could no longer reduce phosphorylation of akt and consequently phosphorylation of foxo3a ( xref_fig ) .",pmc3734838,1,1,40,1,41
23,akt,proteinfamilyproteincomplex,,,,akt,,,foxo,proteinfamilyproteincomplex,,,be,foxo,,,negative,i,none,,,,,,nan,nan,it was subsequently shown that attenuation of the pi3k and akt pathway is required to allow transcriptional activation of foxo in g2 [ xref_bibr ] .,pmc2652403,1,1,40,1,41
22,akt,proteinfamilyproteincomplex,,,,akt,,,foxo,proteinfamilyproteincomplex,,,be,foxo,,,negative,i,none,,cellosaurus:cvcl_0152,,,uberon:uberon:0000479,nan,nan,"inhibition of pi3k and akt and mapk and erk pathways causes activation of foxo transcription factor , leading to cell cycle arrest and apoptosis in pancreatic cancer . ++++ akt inhibitor ( akt inh-iv ) and mek1/2 inhibitor ( pd98059 ) synergistically induced foxo transcriptional activity in aspc-1 and panc-1 cells . ++++ inhibition of pi3k and akt and mek and erk pathways synergistically and additively induces foxo transcriptional activity and apoptosis in the presence or absence of sulforaphane . ++++ our results demonstrate that inhibition of pi3k and akt and erk pathways activates foxo transcription factors . ++++ these data suggest that inhibition of pi3k and akt and erk pathways acts together to activate foxo transcription factor and enhances sfn induced foxo transcriptional activity , leading to cell cycle arrest and apoptosis . ++++ the inhibition of pi3k and akt and mek and erk pathways activated foxo transcription factors .",pmc2915986,1,1,40,1,41
142,atm,protein,,,,q13315,,,rpa32,protein,,,uniprot,p15927,,,positive,d,phosphorylation,,,,,,nan,nan,"rpa32 is phosphorylated at t21 and s33 by atm , atr , and dna-pk [ xref_bibr ] .",pmc2954851,1,1,40,1,41
959,tnf-alpha,protein,,,,p01375,,,rig-i,protein,,,uniprot,o95786,,,positive,i,transcription,,,cl:cl:0000169,,,nan,nan,"previous studies indicated that tnf-alpha , a cytokine that regulates innate immune responses , induced the expression of rig-i in endothelial cells .",pmc4923948,1,1,40,1,41
148,atm,protein,,,,q13315,other,go:0005813,h2ax,protein,,,uniprot,p16104,other,go:0005813,positive,d,phosphorylation,,,,,,nan,nan,"the histone variant h2ax is phosphorylated by atm , atr , and dna-pk on s139 upon dna damage and this phosphorylated form is also known as gamma-h2ax [ xref_bibr ] .",pmc2954851,1,1,40,1,41
149,atm,protein,,,,q13315,other,sl-0276,trf2,protein,,,uniprot,p62380,other,sl-0276,positive,d,phosphorylation,,,,,uberon:uberon:0000479,nan,nan,"in the presence of dna damage , atm and chk2 phosphorylate trf2 , reducing its affinity for telomeres , but whereas atm promotes trf2 relocalization from telomeres to the dna lesion , probably to enhance the protection and repair of the dsb , the functional significance of chk2 phosphorylation of trf2 is unclear .",pmc4296918,1,1,40,1,41
151,atm,protein,,,,q13315.t,,,cabin1,protein,,,uniprot,q9y6j0,,,negative,i,ubiquitination,,cellosaurus:cvcl_0045,,,,nan,nan,overexpression of atm or chk2 increased the ubiquitination of cabin1 protein ( xref_fig a and b ) .,pmc3575827,1,1,40,1,41
