index,Regulator Name,Regulator Type,Regulator Subtype,Regulator HGNC Symbol,Regulator Database,Regulator ID,Regulator Compartment,Regulator Compartment ID,Regulated Name,Regulated Type,Regulated Subtype,Regulated HGNC Symbol,Regulated Database,Regulated ID,Regulated Compartment,Regulated Compartment ID,Sign,Connection Type,Mechanism,Site,Cell Line,Cell Type,Tissue Type,Organism,Score,Source,Statements,Paper IDs,Evidence Score,Match Score,Kind Score,Epistemic Value,Total Score
892,src,proteinfamilyproteincomplex,,,,src,cytoplasm,go:0005737,runx3,protein,,,uniprot,q13761,cytoplasm,go:0005737,positive,d,phosphorylation,,cellosaurus:cvcl_0045 ++++ cellosaurus:cvcl_0434,,,,nan,nan,"in vitro kinase assays performed with gst-src and his runx3 proteins showed tyrosine phosphorylation of runx3 by src in an src concentration dependent manner ( xref_fig f ) . ++++ collectively , our results demonstrate that the tyrosine phosphorylation of runx3 by activated src is associated with the cytoplasmic localization of runx3 in gastric and breast cancers . ++++ to determine whether the shifted runx3 band found in lysates from the cancer cell lines might represent tyrosine phosphorylation of runx3 by src kinase , we analyzed cell lysates after the sirna mediated knockdown of src or the overexpression of src . ++++ collectively , our results demonstrate that runx3 is a target of the src kinase and that the tyrosine phosphorylation of runx3 by src is associated with the cytoplasmic localization of runx3 .",pmc2843174,1,1,40,1,41
891,src,proteinfamilyproteincomplex,,,,src,cytoplasm,go:0005737,runx3,protein,,,uniprot,q13761,cytoplasm,go:0005737,positive,d,phosphorylation,,cellosaurus:cvcl_0045,,,,nan,nan,src phosphorylates multiple tyrosine residues on runx3 . ++++ src kinase phosphorylates runx3 at tyrosine residues and localizes the protein in the cytoplasm * .,pmc2843174,1,1,40,1,41
31,akt,proteinfamilyproteincomplex,,,,akt,,,mcl-1,protein,,,uniprot,q07820,,,positive,i,transcription,,,,,,nan,nan,akt and erk have been shown to upregulate mcl-1 transcription .,pmc3355968,1,1,40,1,41
33,akt,proteinfamilyproteincomplex,,,,akt,,,mdmx,protein,,,uniprot,o15151,,,positive,d,phosphorylation,,,,,,nan,nan,"akt also phosphorylates mdmx at ser367 , which generates a 14-3-3 binding site and leads to the stabilization of the mdm2 and mdmx complex [ xref_bibr ] .",pmc3317191,1,1,40,1,41
901,src,proteinfamilyproteincomplex,,,,src,,,caveolin-1,protein,,,uniprot,q03135,,,positive,d,phosphorylation,,cellosaurus:cvcl_s979,cl:cl:0000359,,,nan,nan,"src dependent phosphorylation of caveolin-1 and egfr y845 was shown to occur in ionizing radiation treated human bronchial carcinoma cells , a549 .",pmc3709701,1,1,40,1,41
41,akt,proteinfamilyproteincomplex,,,,akt,,,nf-kappab,proteinfamilyproteincomplex,,,be,nfkappab,,,positive,i,none,,,,,,nan,nan,akt was reported to stimulate nf-kappab predominantly by up-regulating of the transactivation potential of the p65 subunit of nf-kappab [ xref_bibr ] .,pmc2652403,1,1,40,1,41
42,akt,proteinfamilyproteincomplex,,,,akt,,,npm,protein,,,uniprot,p06748,,,positive,d,phosphorylation,,cellosaurus:cvcl_0554,,,,nan,nan,we confirmed that akt specifically phosphorylated npm on ser48 by in-vitro kinase assay .,pmc4171619,1,1,40,1,41
45,akt,proteinfamilyproteincomplex,,,,akt,,,p65,protein,,,uniprot,p21579,,,positive,i,none,,,,,,nan,nan,"furthermore , akt can activate the transcriptional potential of the p65 and rela subunit of nf-kappab [ xref_bibr , xref_bibr ] , providing a potential link between akt kinase activity and nf-kappab activation .",pmc1325242,1,1,40,1,41
47,akt,proteinfamilyproteincomplex,,,,akt,,,pfkfb3,protein,,,uniprot,q16875,,,positive,i,none,,,,,,nan,nan,"pfkfb3 could be upregulated by rasfonin and downregulated by akt inhibition , whereas pfkfb3 deprivation attenuated rasfonin induced autophagic fluxes .",pmc4720880,1,1,40,1,41
56,akt,proteinfamilyproteincomplex,,,,akt,,,rps3,protein,,,uniprot,p23396,,,positive,d,phosphorylation,,,,,,nan,nan,akt physically binds to and phosphorylates rps3 at thr70 .,pmc3317191,1,1,40,1,41
48,akt,proteinfamilyproteincomplex,,,,akt,,,pfkfb3,protein,,,uniprot,q16875,,,positive,i,transcription,,,cl:cl:0000084,,,nan,nan,"37 indeed , here we show that the pharmacologic or genetic inhibition of akt reduced pfkfb3 expression at both mrna and protein level .",pmc4720880,1,1,40,1,41
49,akt,proteinfamilyproteincomplex,,,,akt,,,phb,protein,,,uniprot,p35232,,,positive,i,phosphorylation,,cellosaurus:cvcl_0428,cl:cl:0000010,,uberon:uberon:0000479,nan,nan,"25 in these cells , akt induced phosphorylation of phb occured at thr 258 .",pmc4669803,1,1,40,1,41
906,src,proteinfamilyproteincomplex,,,,src,,,noxa1,protein,,,uniprot,q86ur1,,,positive,d,phosphorylation,,cellosaurus:cvcl_0248 ++++ cellosaurus:cvcl_0045,,,,nan,nan,"in this study , we elucidate the relationship between src phosphorylation of tks4 and noxa1 and the nox1 dependent formation of invadopodia and ecm degradation in dld1 cells . ++++ as shown in xref_fig a , we observed the presence of a doublet corresponding to noxa1 only when this was coexpressed with srcyf , suggesting that noxa1 might be phosphorylated by src under these conditions .",pmc2993755,1,1,40,1,41
50,akt,proteinfamilyproteincomplex,,,,akt,,,phb,protein,,,uniprot,p35232,,,positive,i,phosphorylation,,cellosaurus:cvcl_6881 ++++ cellosaurus:cvcl_0063,cl:cl:0000187,,uberon:uberon:0000104,nan,nan,akt mediates the phosphorylation of phb at thr258 . ++++ our findings demonstrate that akt phosphorylates phb at thr258 and promotes phb mitochondrial translocation to induce bc proliferation and highlights phb as an important regulator during bc tumorigenesis . ++++ a recent study has shown that overexpressed akt phosphorylates phb on thr258 in vitro and that it is also capable of doing so in vitro on overexpressed phb in hek-293t cancer cells .,pmc4669803,1,1,40,1,41
857,s6k1,protein,,,,p23443,,,mcl-1 protein,protein,,,uniprot,q07820,,,positive,i,amount,,,,,,nan,nan,"25 importantly , we showed that knockdown of mtor or s6k1 downregulates the mcl-1 protein level , which is increased in cisplatin resistant cells .",pmc3388235,1,1,40,1,41
855,s6k1,protein,,,,p23443,,,insulin receptor substrate,proteinfamilyproteincomplex,,,be,irs,,,negative,i,none,,,,,,nan,nan,"it was shown that tsc1-tsc2 is required for insulin signaling to pi3k [ xref_bibr , xref_bibr ] by restraining the activity of s6k1 , which when activated inactivates insulin receptor substrate ( irs ) function , via repression of irs-1 gene expression and via direct phosphorylation of irs-1 [ xref_bibr ] .",pmc2652403,1,1,40,1,41
854,s6k1,protein,,,,p23443,,,elongation factor-2,protein,,,uniprot,p13639,,,negative,i,none,,,,,,nan,nan,"s6k1 inactivates eukaryotic elongation factor-2 kinase ( eef2k ) which is a negative regulator of eukaryotic elongation factor 2 ( eef2 ) , by phosphorylating it at s366 , and thus regulates the elongation step of translation [ xref_bibr ] .",pmc4258317,1,1,40,1,41
853,s6k1,protein,,,,p23443,,,eif4b,protein,,,uniprot,p23588,,,positive,d,phosphorylation,,,,,uberon:uberon:0000105,nan,nan,"the translation initiation factor eif4b , which stimulates the activity of eif4a in unwinding duplex rna , is phosphorylated by s6k1 on serine 422 ( raught et al , 2004 ) .",pmc2361102,1,1,40,1,41
51,akt,proteinfamilyproteincomplex,,,,akt,,,pml,protein,,,uniprot,p29590,,,positive,i,none,,,,,,nan,nan,"taken together , these results indicate that akt induces dna damage independent p53 stabilisation via arf- and pml independent nucleolar sequestration of mdm2 .",pmc3325598,1,1,40,1,41
814,raf1,protein,,,,p04049,,,beta-catenin,protein,,,uniprot,p35222,,,positive,i,none,,cellosaurus:cvcl_0025,,,,nan,nan,"likewise , phelps et al. 66 recently reported that kras and raf1 oncogenes promote nuclear accumulation of beta-catenin in apc deficient cells .",pmc4687460,1,1,40,1,41
560,mtor,protein,,,,p42345,,,4e-bp1,protein,,,uniprot,q13541,,,positive,d,phosphorylation,,cellosaurus:cvcl_m034,,,,nan,nan,also it is not clear whether the rapamycin sensitive sites of 4e-bp1 are directly phosphorylated by mtor in vivo ; moreover some studies suggest that another unidentified 4e-bp1 kinase might exist [ xref_bibr ] .,pmc4258317,1,1,40,1,41
810,raf,proteinfamilyproteincomplex,,,,raf,other,go:0009986,cd24,protein,,,uniprot,p25063,other,go:0009986,negative,i,none,,,,,,nan,nan,"thus , inhibition of the pi3k pathway may relieve the akt mediated inhibition of raf and promote raf mediated suppression of cd24 . ++++ therefore , even though activation of the raf pathway is sufficient to decrease cd24 mrna and protein , inhibition of oncogenic raf and mek signaling does not restore cd24 expression to the level of control cells at the mrna or protein level . ++++ furthermore , activation of only the raf pathway was sufficient to downregulate cd24 mrna and protein expression to levels similar to those seen in with rasv12 expression . ++++ moreover , either raf or pi3k could decrease both cd24 mrna and surface expression while ralgds only partially affected surface expression . ++++ therefore , activation of the raf kinase pathway , the pi3k pathway , or the ralgds pathway downstream of ras are sufficient to decrease the cd24 + population . ++++ however , activation of the raf pathway was sufficient to decrease the cd24 + population to the same low level as rasv12 suggesting that the raf pathway is the major regulator of cd24 expression in these cells . ++++ therefore , inhibition of raf significantly increases the proportion of cd24 + cells in the absence of changes at mrna level , but only in cells expressing oncogenic ras . ++++ since we observed that both cd24 mrna and protein is significantly and substantially downregulated by the raf and pi3k pathways we next determined if inhibition of either or both of these pathways could restore cd24 expression in rasv12 cells at the mrna level . ++++ together , these data indicate that even though activation of either the pi3k or raf pathway is sufficient to decrease cd24 mrna and protein expression , inhibition of both pi3k and raf together is not sufficient to restore cd24 surface protein or mrna expression . ++++ moreover , either raf or pi3k could decrease both cd24 mrna and surface expression while ralgds only partially affected surface expression .",pmc4525067,1,1,40,1,41
743,pi3k,proteinfamilyproteincomplex,,,,pi3k,other,go:0016020,ha,protein,,,uniprot,p69208,other,go:0016020,positive,i,none,,cellosaurus:cvcl_7955,,,,nan,nan,"a pharmacological inhibitor of pi3k inhibited the production of ha , and conversely , an activated , plasma membrane targeted form of pi3k was sufficient to enhance ha production [ xref_bibr ] .",pmc2652403,1,1,40,1,41
92,akt,proteinfamilyproteincomplex,,,,akt,other,go:0016363,satb1,protein,,,uniprot,q01826,other,go:0016363,positive,i,amount,,cellosaurus:cvcl_0031,,,,nan,nan,"furthermore , the myristoylated akt increased the amount of satb1 over-expressed in sk-br-3 cells , whereas the dominant negative akt did not ( xref_fig ) .",pmc3675137,1,1,40,1,41
93,akt,proteinfamilyproteincomplex,,,,akt,other,go:0016604 ++++ go:go:0016605,satb1,protein,,,uniprot,q01826,other,go:0016604 ++++ go:go:0016605,positive,i,phosphorylation,,cellosaurus:cvcl_0063 ++++ cellosaurus:cvcl_6910,cl:cl:0000034,,uberon:uberon:0003062,nan,nan,"considering the antagonizing effects of satb1 on pluripotency factors and the fact that akt phosphorylates satb1 and protects it from apoptotic cleavage , we predicted that akt mediated phosphorylation would abolish the functions of oct4 and klf4 . ++++ akt phosphorylates satb1 . ++++ collectively , satb1 phosphorylation by akt is pivotal for its role to antagonize the pluripotency factors at both transcription and protein protein interaction levels . ++++ based on preliminary data , considering the opponent effects of satb1 on the expression of nanog and klf4 , we proposed that akt may phosphorylate the differentiation factor satb1 and the pluripotency factors oct4 and klf4 simultaneously or sequentially to change their abundance or conformation , thereby dictating stem cells to maintain the pluripotency status or enter the differentiation program . ++++ as akt is a potent downstream effector of pi3k signaling pathway , we then ask whether satb1 phosphorylation by akt would rely on pi3k activation . ++++ here , we demonstrate that akt phosphorylates satb1 , a chromatin organizer and global regulator for gene expression , thereby keeping it intact and maintaining its inhibitory effects on the expression of nanog . ++++ as a control , satb1 phosphorylation was increased by constitutively activated akt compared with wild-type akt , whereas it was significantly decreased in the presence of an epitopically expressed kinase dead akt , a dominant negative form lacking kinase activity ( xref_fig ) . ++++ to examine whether satb1 phosphorylation by akt would affect co-localization of satb1 and pml , gfp-satb1 , gfp-satb1s47a or gfp-satb1s47d along with cherry-pml was transfected into hek293a cells . ++++ we then investigated whether akt could phosphorylate satb1 in vivo .",pmc3675137,1,1,40,1,41
924,src,proteinfamilyproteincomplex,,,,src,other,go:0016020,fak,protein,,,uniprot,q05397,other,go:0016020,positive,i,none,,,cl:cl:0000010,,,nan,nan,"although the in vitro findings provide an important insight into the molecular basis of src mediated fak and alphavbeta5 interactions in the vegf pathway , the functional requirement for integrin alphavbeta5 in a vegf mediated vascular response remained unknown . ++++ therefore , to further characterize the mechanism of the src mediated fak and alphavbeta5 interaction , in vitro binding studies were performed using nh 2 - or cooh-terminal domains of fak and various full-length or truncated fusion proteins of beta5 and beta3 cytoplasmic tails .",pmc2173263,1,1,40,1,41
925,src,proteinfamilyproteincomplex,,,,src,other,go:0016020,fak,protein,,,uniprot,q05397,other,go:0016020,positive,i,phosphorylation,,,,,,nan,nan,"there are no obvious motifs within the integrin beta5 cytoplasmic tail , such as a phosphotyrosine binding domain that might account for such an interaction , but evidence presented here suggests that src mediated tyrosine phosphorylation of the fak ct at aa 861 can contribute to the fak and alphavbeta5 association . ++++ however , src induced tyrosine phosphorylation of the fak ct in vitro as detected with phosphotyrosine antibodies to aa 861 and 925 ( xref_fig c ) .",pmc2173263,1,1,40,1,41
99,akt,proteinfamilyproteincomplex,,,,akt.p,,,foxo3a,protein,,,uniprot,o43524,,,negative,i,phosphorylation,,,,,,nan,nan,"conversely , when we activated akt in crc cells using constitutively activated akt constructs prior to selenite treatment , we found that , consistent with our hypothesis , constitutively activated akt increased phosphorylation of akt and foxo3a and selenite could no longer reduce phosphorylation of akt and consequently phosphorylation of foxo3a ( xref_fig ) .",pmc3734838,1,1,40,1,41
100,akt,proteinfamilyproteincomplex,,,,akt.t,,,runx2,protein,,,uniprot,q13950,,,positive,i,transcription,,,cl:cl:0000359,,,nan,nan,"in prostate cancer cells , stable expression of constitutively activated akt ( myr-akt ) induces the expression of runx2 mrna and its target genes , such as pip , pgc , mmp9 and mmp13 [ xref_bibr ] .",pmc4513933,1,1,40,1,41
101,akt1,protein,,,,p31749,,,parp-1,protein,,,uniprot,p09874,,,positive,i,none,,,,,,nan,nan,"as to the apoptosis , akt1 or akt2 silencing only partly decreased the rasfonin activated parp-1 cleavage ( xref_fig ) .",pmc4720880,1,1,40,1,41
745,pi3k,proteinfamilyproteincomplex,,,,pi3k,plasma membrane,go:0005886,gab1,protein,,,uniprot,q13480,plasma membrane,go:0005886,positive,d,phosphorylation,,,,,,nan,nan,"phosphorylated irs and gab1 recruit cytoplasmic proteins pi3k , grb2-sos , shp2 , and rasgap to the plasma membrane , which results in additional pip 3 production and both activatory and inhibitory regulations of ras activity .",pmc2683723,1,1,40,1,41
744,pi3k,proteinfamilyproteincomplex,,,,pi3k,other,go:0016020,plc-gamma,proteinfamilyproteincomplex,,,be,plcg,other,go:0016020,positive,i,none,,,,,,nan,nan,"activation of pi3k caused phospholipase c-gamma ( plc-gamma ) ph domain mediated membrane targeting and plc-gamma activation [ xref_bibr , xref_bibr ] .",pmc2652403,1,1,40,1,41
741,pi3k,proteinfamilyproteincomplex,,,,pi3k,other,go:0001726,actin,proteinfamilyproteincomplex,,,be,actin,other,go:0001726,positive,i,none,,,,,,nan,nan,"pi3k inhibition also disrupted actin structures , suggesting that activation of pi3k alters actin organization , leading to increased motility and invasiveness [ xref_bibr ] .",pmc2652403,1,1,40,1,41
809,rad53,protein,,,,o96017,,,ptc2,protein,,,uniprot,q9y6c5,,,positive,d,phosphorylation,,,,,,nan,nan,"ptc2 and ptc3 were found to bind to the fha1 domain of rad53 and ck2 phosphorylation of ptc2 at t376 was necessary for this interaction [ xref_bibr , xref_bibr ] .",pmc2954851,1,1,40,1,41
740,pi3k,proteinfamilyproteincomplex,,,,pi3k,,,survivin,protein,,,uniprot,q4r1j6,,,positive,i,none,,cellosaurus:cvcl_0145,,,,nan,nan,"inhibition of mek or pi3k blocked the upregulation of survivin following tgf-beta1 treatment , whereas the inhibition of rho did not ( xref_fig ) .",pmc3730417,1,1,40,1,41
739,pi3k,proteinfamilyproteincomplex,,,,pi3k,,,runx2,protein,,,uniprot,q13950,,,positive,i,transcription,,,cl:cl:0000062,,uberon:uberon:0000105,nan,nan,"the pi3k and akt pathway stimulates runx2 expression and activity through direct or indirect mechanisms . ++++ as shown in non transformed and transformed cells , the pi3k and akt pathway directly or indirectly stimulates runx2 expression and activity , while runx2 activates the pi3k and akt pathway by the regulation of its components or mtorc2 .",pmc4513933,1,1,40,1,41
926,src,proteinfamilyproteincomplex,,,,src,plasma membrane,go:0005886,grb2-associated binder 1,protein,,,uniprot,q13480,plasma membrane,go:0005886,positive,i,phosphorylation,,,,,,nan,nan,"likewise , the pi3k and akt pathway is activated by ir via either direct or irs mediated recruitment of pi3k , whereas egfr mediated pi3k activation occurs mainly via a more intricate route that involves egfr- and src induced phosphorylation of the grb2 associated binder 1 ( gab1 ) .",pmc2683723,1,1,40,1,41
734,pi3k,proteinfamilyproteincomplex,,,,pi3k,,,p-erk1/2,proteinfamilyproteincomplex,,,be,erk,,,negative,i,none,,,,,,nan,nan,"indeed , when the mek pathway was inhibited in lm2 cells , early p-akt activity increased , while pi3k inhibition increased p-erk1/2 ( 4 hrs : figure xref_fig ) .",pmc3135566,1,1,40,1,41
733,pi3k,proteinfamilyproteincomplex,,,,pi3k,,,p-erk1/2,proteinfamilyproteincomplex,,,be,erk,,,negative,i,amount,,,,,,nan,nan,"conversely , pi3k inhibition ( by ly294002 ) increased basal p-erk1/2 levels at the expense of p-akt ( 4 hrs time point ; figure xref_fig ) .",pmc3135566,1,1,40,1,41
732,pi3k,proteinfamilyproteincomplex,,,,pi3k,,,mcl-1 protein,protein,,,uniprot,q07820,,,positive,i,none,,,,,,nan,nan,"in addition , both pi3k and akt and mek and erk pathways have also been shown to enhance mcl-1 protein stability .",pmc3355968,1,1,40,1,41
731,pi3k,proteinfamilyproteincomplex,,,,pi3k,,,mcl-1,protein,,,uniprot,q07820,,,negative,i,phosphorylation,,,,,,nan,nan,"indeed , the inhibition of pi3k induces s159 phosphorylation of mcl-1 and subsequent ubiquitination and degradation of mcl-1 , which are blocked by gsk3 inhibition .",pmc3355968,1,1,40,1,41
730,pi3k,proteinfamilyproteincomplex,,,,pi3k,,,kras,protein,,,uniprot,p01116:[genericmutant],,,positive,i,none,,,,,uberon:uberon:0000479,nan,nan,"since combined mek and pi3k inhibition slowed mutant kras driven lung tumor growth in vivo [ xref_bibr ] , we determined whether selective inhibition of mek and pi3k affected macrophage stimulated proliferation in these kras mutant lung tumor cell lines .",pmc3135566,1,1,40,1,41
729,pi3k,proteinfamilyproteincomplex,,,,pi3k,,,erk1/2,proteinfamilyproteincomplex,,,be,erk,,,negative,i,phosphorylation,,,,,,nan,nan,"pi3k inhibition stimulated erk1/2 phosphorylation from 4-24 hrs , and increased akt phosphorylation throughout the treatment time-course .",pmc3135566,1,1,40,1,41
91,akt,proteinfamilyproteincomplex,,,,akt,other,go:0016020,phb2,protein,,,uniprot,q99623,other,go:0016020,positive,i,phosphorylation,,,cl:cl:0000187,,,nan,nan,"47 interestingly , it has been reported that akt mediated phosphorylation of phb2 at ser91 is required for mouse embryonic fibroblast cell apoptotic resistance , 48 whereas phosphorylation of phb2 at the same site by active camk iv de-represses the transcriptional inhibitory effect of phb2 on myocyte enhancer factor-2 activity .",pmc4669803,1,1,40,1,41
923,src,proteinfamilyproteincomplex,,,,src,other,go:0015629,fat4,protein,,,uniprot,q6v0i7,other,go:0015629,negative,i,transcription,,cellosaurus:cvcl_0598 ++++ cellosaurus:cvcl_8467 ++++ cellosaurus:cvcl_0062,cl:cl:0002327,,,nan,nan,"in this model , we found that fat4 mrna expression was repressed by src activation in mcf-10a cells ( xref_fig ) . ++++ thus , these results indicate that src represses fat4 mrna expression through the mek and erk pathway . ++++ here , we show that transient src activation represses fat4 mrna expression and leads to tumor transformation in mcf-10a cells , which are immortalized normal human mammary epithelial cells . ++++ thus , to determine whether src downregulates fat4 mrna expression by altering actin structures , we examined the effect of the rock inhibitor y-27632 on fat4 mrna expression . ++++ fat4 gene expression is repressed during human breast cell transformation by the src oncogene . ++++ we also investigated whether the mek and erk pathway is involved in src reduced fat4 mrna expression by rt-qpcr analysis ; the results suggest that src mediated inhibition of fat4 mrna expression is repressed in mcf-10a cells by u0126 or pd0325901 , a mek inhibitor ( xref_fig and xref_supplementary . ) ++++ thus , these results indicate that src induces tumorigenesis and suppresses fat4 mrna expression in mcf-10a cells . ++++ therefore , we propose that src suppresses fat4 mrna expression through actin depolymerization by cofilin1 . ++++ in this study , we show that transient activation of the src oncoprotein represses fat4 mrna expression through actin depolymerization in the immortalized normal human mammary epithelial cell line mcf-10a .",pmc4334522,1,1,40,1,41
89,akt,proteinfamilyproteincomplex,,,,akt,other,go:0005829,caspase,proteinfamilyproteincomplex,,,be,caspase,other,go:0005829,negative,i,none,,,,,,nan,nan,"akt , but not bcl-2 , inhibits caspase activation induced by cytochrome c in a cell-free system .",pmc2185587,1,1,40,1,41
763,pp2a,protein,,,,p67775,cytoplasm,go:0005737,dna-pkcs,protein,,,uniprot,p78527,cytoplasm,go:0005737,negative,d,dephosphorylation,,,,,,nan,nan,pp2a dephosphorylation of dna-pkcs and ku increased the association between the dna-pk proteins and this promoted dna repair [ xref_bibr ] . ++++ pp2a dephosphorylated dna-pkcs as well as ku70 and ku80 leading to increased dna-pk activity [ xref_bibr ] .,pmc2954851,1,1,40,1,41
807,rac,protein,,,,p31749,,,pak,proteinfamilyproteincomplex,,,be,pak,,,positive,i,none,,cellosaurus:cvcl_0045,,,,nan,nan,"subsequently , rac activates pak , which in turn stimulates raf by s338 phosphorylation and mek by s298 phosphorylation .",pmc2683723,1,1,40,1,41
806,rac,protein,,,,p31749,,,actin,proteinfamilyproteincomplex,,,be,actin,,,positive,i,none,,cellosaurus:cvcl_8262,,,,nan,nan,"instead , in mek inhibited cells phospho-mlc was restricted to the retracting end of the cell ( xref_fig ) , which is indicative for the ' mesenchymal ' mode of invasion , where rho and rock activities are high in the rear of the cells and rac driven actin assembly occurs at the leading edge .",pmc3378628,1,1,40,1,41
792,pten,protein,,,,p60484,,,pkb/akt,proteinfamilyproteincomplex,,,be,akt,,,negative,i,none,,cellosaurus:cvcl_5951 ++++ cellosaurus:cvcl_0035,cl:cl:0000127,,,nan,nan,"pten antagonized the activation of pkb and akt by growth factors , by activated pi3k and by pdk1 , but did not antagonize the phospholipid independent activation of pkb and akt lacking the ph domain [ xref_bibr ] . ++++ transfection of pten into the pten negative decreased the activation of akt and the downstream p70 ( s6k ) and reversed the resistance to doxorubicin in these cells , indicating that changes in pten status and akt activation modulate the cellular response to doxorubicin [ xref_bibr ] .",pmc2652403,1,1,40,1,41
915,src,proteinfamilyproteincomplex,,,,src,,,tks4,protein,,,uniprot,a1x283,,,positive,i,phosphorylation,,cellosaurus:cvcl_0248,,,,nan,nan,"to test whether src mediated phosphorylation of tks4 affects its binding to noxa1 , we generated the same tks4 unphosphorylable single mutants ( tks4-y25f , tks4-y373f , and tks4-y508f ) and tested them in coimmunoprecipitation experiments along with flag tagged noxa1 . ++++ in this study , we elucidate the relationship between src phosphorylation of tks4 and noxa1 and the nox1 dependent formation of invadopodia and ecm degradation in dld1 cells .",pmc2993755,1,1,40,1,41
916,src,proteinfamilyproteincomplex,,,,src,nucleus,go:0005634,ing1,protein,,,uniprot,q9uk53,nucleus,go:0005634,negative,i,none,,,,,,nan,nan,"this was further supported by the results of cell fractionation experiments in which the activated and wt forms of src eliminated ing1 from the nucleus to a greater degree than kinase-dead src ( xref_fig and xref_fig ) . ++++ this indicated that src reduced the stability of ing1 significantly and suggested that src induced ing1 destabilization was largely kinase dependent . ++++ src decreases the stability and level of ing1 . ++++ functionally , src antagonizes the ability of ing1 to induce apoptosis , most likely through relocalization of ing1 and down regulation of ing1 levels .",pmc3621671,1,1,40,1,41
