index,Regulator Name,Regulator Type,Regulator Subtype,Regulator HGNC Symbol,Regulator Database,Regulator ID,Regulator Compartment,Regulator Compartment ID,Regulated Name,Regulated Type,Regulated Subtype,Regulated HGNC Symbol,Regulated Database,Regulated ID,Regulated Compartment,Regulated Compartment ID,Sign,Connection Type,Mechanism,Site,Cell Line,Cell Type,Tissue Type,Organism,Score,Source,Statements,Paper IDs,Evidence Score,Match Score,Kind Score,Epistemic Value,Total Score
1583,mtor,protein,,,,p42345,other,go:0016020,akt,protein family|protein complex,,,be,akt,other,go:0016020,positive,d,phosphorylation,,,,,,"nan,nan","nan,nan","akt is then phosphorylated at thr 308 within its catalytic domain by phosphatidylinositol dependent kinase 1 ( pdk1 ) and at ser 473 within its c-terminus regulatory domain by mtor complex 2 ( mtorc2 , see later on ) , resulting in full activation of akt kinase ( xref_fig ) .,akt is then phosphorylated at thr 308 within its catalytic domain by phosphatidylinositol dependent kinase 1 ( pdk1 ) and at ser 473 within its c-terminus regulatory domain by mtor complex 2 ( mtorc2 , see later on ) , resulting in full activation of akt kinase ( xref_fig ) .","pmc3837323,pmc3837323",2,10,11,1,31
1591,mtorc1,protein family|protein complex,,,,mtorc1,,,akt,protein family|protein complex,,,be,akt,,,negative,i,none,,,,,,"nan,nan","nan,nan","assuming that equilibrium exists between these two complexes , when the mtorc1 complex is formed , it could antagonize the formation of the mtorc2 complex and reduce akt activity [ xref_bibr , xref_bibr ] . ++++ inhibition of mtorc1 signaling by rapamycin and rapalogs removes the previously mentioned negative feedback loop and activates akt through pi3k . ++++ mtorc1 inhibits akt via a negative feedback loop which involves , at least in part , p70s6k [ xref_bibr ] .,mtorc1 also inhibits akt via a negative feedback loop which involves p70s6k and potentially other molecules [ xref_bibr ] .","pmc3660063,pmc4102778",2,10,11,1,31
147,akt,protein family|protein complex,,,,akt,,,tsc2,protein,,,uniprot,p49815,,,positive,d,phosphorylation,,,,,,"nan,nan","nan,nan","in cells that express activated akt , akt may phosphorylate tsc2 resulting in its inactivation . ++++ tsc2 phosphorylation by akt represses gap activity of the tsc1 and tsc2 complex , allowing rheb to accumulate in a gtp bound state .,tsc2 phosphorylation by akt represses gap activity of the tsc1 and tsc2 complex , allowing rheb to accumulate in a gtp bound state .","pmc3660063,pmc4102778",2,10,10,1,30
1387,mammalian target of rapamycin,protein,,,,p42345,,,akt-1,protein,,,uniprot,p31749,,,positive,d,phosphorylation,,,,,uberon:uberon:0003714,nan,nan,akt-1 is also phosphorylated at s473 by the mammalian target of rapamycin ( mtor ) complex referred to as ( rapamycin-insensitive companion of mtor and mlst8 complex ) mtorc2 [ xref_bibr - xref_bibr ] .,pmc3660063,1,10,11,1,21
2121,rac1,protein,,,,p63000,,,pi3k,protein family|protein complex,,,be,pi3k,,,positive,i,none,,,,,,nan,nan,h-ras and rac1 activate pi3k by targeting the gtpase responsive domain [ xref_bibr ] .,pmc2652403,1,10,11,1,21
1512,mtor,protein,,,,p42345,,,akt,protein family|protein complex,,,be,akt,,,negative,i,phosphorylation,,cellosaurus:cvcl_0062,,,,nan,nan,"consistent with a previous study , 36 we observed that constitutively active akt1 reduced mtor phosphorylation , likely reflecting the increase in apoptotic cell death , as mtor knockdown increased both akt phosphorylation and parp-1 cleavage upon stimulation with rasfonin .",pmc4720880,1,10,11,1,21
417,c-raf,protein,,,,p04049,,,ras,protein family,,,pfam,pf00071,,,positive,i,none,,cellosaurus:cvcl_0045,,,,nan,nan,"however , in hek293 cells , we found that the inhibition of c-raf by gw-5074 eliminated mek and erk activities ( xref_supplementary ) , which supports the conclusion that major insulin-egf crosstalk mechanisms to amplify erk signaling are localized upstream of ras and at the ras and raf level .",pmc2683723,1,10,11,1,21
1513,mtor,protein,,,,p42345,,,akt,protein family|protein complex,,,be,akt,,,negative,i,phosphorylation,,uaz:cvcl_9115,,,,nan,nan,"from these data , we conclude that pp242 's effect on t308-p is dependent on its inhibition of akt phosphorylation by mtor at s473 .",pmc2637922,1,10,11,1,21
1423,mek,protein family|protein complex,,,,mek,,,erk,protein family|protein complex,,,be,erk,,,negative,i,none,,,cl:cl:0002322,,,nan,nan,"quantitative rt-pcr demonstrated that inhibition of pi3k significantly increased oct4a expression ( 3.6 +/- 0.4-fold ) , and inhibition of gsk-3 to activate wnt signaling increased both oct4a ( 3.6 +/- 0.5-fold ) and nanog ( 2.2 +/- 0.2-fold ) expression , whereas inhibition of mek to suppress erk signaling had no significant effect ( xref_fig a ) .",pmc3537888,1,10,10,1,20
1424,mek,protein family|protein complex,,,,mek,,,erk,protein family|protein complex,,,be,erk,,,negative,i,none,,,,,,nan,nan,"therefore , inhibition of mek mediated erk activation is very appealing in cancer therapy . ++++ inhibition of mek mediated erk activation , therefore , compromises checkpoint activation . ++++ therefore , inhibition of mek mediated erk activation may be an effective option in cancer therapy .",pmc3330700,1,10,10,1,20
1566,mtor,protein,,,,p42345,,,s6k1,protein,,,uniprot,p23443,,,negative,i,phosphorylation,,cellosaurus:cvcl_n813,,,,nan,nan,"mtor enhances translation initiation in part by phosphorylating two major targets , the eif4e binding proteins ( 4e-bps ) and the ribosomal protein s6 kinases ( s6k1 and s6k2 ) that cooperate to regulate translation initiation rates .",pmc2361102,1,10,10,1,20
1569,mtor,protein,,,,p42345,,,s6k2,protein,,,uniprot,q9ubs0,,,negative,i,phosphorylation,,cellosaurus:cvcl_n813,,,,nan,nan,"mtor enhances translation initiation in part by phosphorylating two major targets , the eif4e binding proteins ( 4e-bps ) and the ribosomal protein s6 kinases ( s6k1 and s6k2 ) that cooperate to regulate translation initiation rates .",pmc2361102,1,10,10,1,20
82,akt,protein family|protein complex,,,,akt,,,mdm2,protein,,,uniprot,q00987,,,negative,i,none,,,cl:cl:0000066,,,nan,nan,"thus , oncogenic akt is able to functionally inactivate p53 by regulating mdm2 and mdmx stability .",pmc3317191,1,10,10,1,20
1313,insulin receptor,protein,,,,p06213,,,irs,protein family,,,pfam,pf02174,,,negative,i,phosphorylation,,,,,,nan,nan,"this negative regulation of akt activity by mtorc1 is dependent on p70s6k mediated phosphorylation of insulin receptor substrate ( irs ) 1 adapter protein , downstream of insulin receptor and/or insulin like growth factor-1 receptor [ xref_bibr , xref_bibr , xref_bibr ] , as irs1 phosphorylation on ser 307 and ser 636/639 by p70s6k targets the adapter protein to proteosomal degradation [ xref_bibr ] .",pmc3837323,1,10,10,1,20
1719,p21,protein,,,,p38936,,,p21,protein,,,uniprot,p38936,,,positive,d,phosphorylation,,,,,,nan,nan,"in vivo , both s130 phosphorylation of p21 and t172 phosphorylation of p21 bound cdk4 were inhibited not only in response to cdk7 inhibition , but also in response to increased p21 expression and inhibition of cdk2 ( by roscovitine and cr8 ) and cdk4/6 ( by pd0332991 ) .",pmc3667761,1,10,10,1,20
2004,pp2a,protein,,,,p67775,,,akt,protein family|protein complex,,,be,akt,,,positive,i,dephosphorylation,,,cl:cl:0000055,,,nan,nan,"pp2a downregulates akt activity directly , by dephosphorylating it at t308 and accumulating evidence indicates that pp2a acts as a tumor suppressor [ xref_bibr ] .",pmc3660063,1,10,10,1,20
2026,pras40,protein,,,,q96b36,,,mtorc1,protein family|protein complex,,,be,mtorc1,,,negative,i,none,,cellosaurus:cvcl_0045,,,,nan,nan,"importantly , we also found that pras40 inhibited mtorc1 autophosphorylation but not mtorc2 autophosphorylation ( xref_fig ) , suggesting that the weak phosphorylation of pras40 by mtorc1 might be due to pras40 mediated inhibition of mtorc1 . ++++ to explain the apparent discrepancy with our inability to induce apoptosis with rapamycin , pras40 may have to inhibit both mtorc1 and a second , unknown rapamycin insensitive target ( or only this second target ) to perform its pro apoptotic function . ++++ this observation extends two recent studies showing that pras40 inhibits mtorc1 toward its substrate s6k xref_bibr , xref_bibr . ++++ our finding that pras40 inhibits mtorc1 kinase activity toward 4e-bp and pras40 is in agreement with the observation of sancak et al. . ++++ xref_bibr that pras40 inhibits mtorc1 toward s6k1 . ++++ to investigate whether pras40 inhibits mtorc1 kinase activity , we performed in vitro kinase assays with the known mtorc1 substrate 4e-bp and increasing concentrations of purified pras40 .",pmc2075366,1,10,10,1,20
2027,pras40,protein,,,,q96b36,,,mtorc1,protein family|protein complex,,,be,mtorc1,,,negative,i,none,,,,,,nan,nan,"when pras40 is phosphorylated by akt , it can not suppress mtorc1 signalling [ xref_bibr , xref_bibr , xref_bibr , xref_bibr , xref_bibr - xref_bibr ] .",pmc4102778,1,10,10,1,20
2235,s6,protein family,,,,ipr000529,,,irs-1,protein,,,uniprot,p35568,,,positive,d,phosphorylation,,,,,,nan,nan,"thus , s6 kinases directly phosphorylate irs-1 at ser302 , and the resulting reduction of binding to insulin receptors is likely to play a major role in the inability of irs-1 to signal to pi3k .",pmc2172316,1,10,10,1,20
2251,s6k1,protein,,,,p23443,,,irs-1,protein,,,uniprot,p35568,,,positive,d,phosphorylation,,,,,,nan,nan,"the results show that only in irs-1 108-516 in which serines 302 , 307 , and 310 are mutated ( xref_fig a , site 2 ) is irs-1 not phosphorylated in vitro by s6k1 ( xref_fig c , left panels ) .",pmc2172316,1,10,10,1,20
1606,mtorc1,protein family|protein complex,,,,mtorc1,,,pras40,protein,,,uniprot,q96b36,,,negative,i,phosphorylation,,,,,,nan,nan,"moreover , pras40 is a substrate of mtorc1 itself , and it has been demonstrated that mtorc1 mediated phosphorylation of pras40 relieves its inhibition on mtorc1 [ xref_bibr ] .",pmc3837323,1,10,10,1,20
943,fadd-dn,protein,,,,q13158,,,caspase-3,protein,,,uniprot,p42574,,,negative,i,none,,,cl:cl:0000312,,,nan,nan,"fadd-dn suppressed sm induced dna fragmentation as well as caspase-3 , -6 , and -8 processing and/or activity .",pmc2206000,1,10,10,1,20
1008,frap,protein,,,,p42345,,,hif-1alpha,protein,,,uniprot,q16665,,,negative,i,transcription,,,,,,nan,nan,"these data indicated that pharmacological agents that target pi3k , akt , or mtor and frap in tumor cells inhibit hif-1alpha expression and that such inhibition may contribute to therapeutic efficacy .",pmc2652403,1,10,10,1,20
190,akt,protein family|protein complex,,,,akt,other,go:0016020,tsc2,protein,,,uniprot,p49815,other,go:0016020,positive,d,phosphorylation,,,,,,nan,nan,"tsc2 is also phosphorylated by akt leading to its inactivation and consequently to increased mtor activity . ++++ in turn , akt phosphorylates the tuberous sclerosis complex , tsc1 and tsc2 ( hamartin and tuberin ) that serves as a gtpase activating protein ( gap ) for the small g protein , ras homolog enriched in brain ( rheb ) . ++++ in turn , akt phosphorylates the tuberous sclerosis complex , tsc1 and tsc2 ( hamartin and tuberin ) that serves as a gtpase activating protein ( gap ) for the small g protein , ras homolog enriched in brain ( rheb ) .",pmc2361102,1,10,10,1,20
90,akt,protein family|protein complex,,,,akt,,,mtorc1,protein family|protein complex,,,be,mtorc1,,,negative,i,none,,,,,uberon:uberon:0000104,nan,nan,"akt also phosphorylates pras40 , an inhibitor of mtorc1 , and by doing so , it prevents the ability of pras40 to suppress mtorc1 signalling .",pmc3660063,1,10,10,1,20
122,akt,protein family|protein complex,,,,akt,,,pras40,protein,,,uniprot,q96b36,,,negative,i,none,,,,,uberon:uberon:0000104,nan,nan,"akt also phosphorylates pras40 , an inhibitor of mtorc1 , and by doing so , it prevents the ability of pras40 to suppress mtorc1 signalling .",pmc3660063,1,10,10,1,20
148,akt,protein family|protein complex,,,,akt,,,tsc2,protein,,,uniprot,p49815,,,positive,i,phosphorylation,,,,,,nan,nan,"in response to growth factors , akt directly phosphorylates tsc2 on several distinct residues [ xref_bibr ] that prevents the formation of tsc1 and tsc2 complex , thus allowing gtpase rheb to convert back into the gtp bound active state [ xref_bibr ] which leads to mtorc1 activation [ xref_bibr , xref_bibr ] .",pmc4258317,1,10,10,1,20
150,akt,protein family|protein complex,,,,akt,,,tuberin,protein,,,uniprot,p49815,,,positive,d,phosphorylation,,,,,,nan,nan,these results confirmed that tuberin is a direct physiological substrate of akt and that phosphorylation of tuberin by pi3k and akt is a major mechanism controlling hamartin-tuberin function [ xref_bibr ] .,pmc2652403,1,10,10,1,20
151,akt,protein family|protein complex,,,,akt,,,tuberin,protein,,,uniprot,p49815,,,positive,i,none,,,,,,nan,nan,"akt triggers a network that positively regulates g1/s cell cycle progression through inactivation of gsk3beta , leading to increased cyclin d1 , and inhibition of forkhead family transcription factors and the tumor suppressor tuberin ( tsc2 ) , leading to reduction of p27 ( kip1 ) [ xref_bibr ] .",pmc2652403,1,10,10,1,20
179,akt,protein family|protein complex,,,,akt,other,go:0005730 ++++ go:go:0005737,mdm2,protein,,,uniprot,q00987,other,go:0005730 ++++ go:go:0005737,negative,i,none,,cellosaurus:cvcl_0554,,,,nan,nan,"akt promotes the inhibition of mdm2 through a nucleoplasmic npm and arf complex . ++++ this in turn promotes arf mediated inhibition of mdm2 in the nucleoplasm . ++++ since inhibition of akt promotes arf localization to the nucleolus and enhanced mdm2 activity , we wished to address what effect increased mdm2 activity has on endogenous p53 .",pmc4171619,1,10,10,1,20
189,akt,protein family|protein complex,,,,akt,other,go:0016020,tsc1,protein,,,uniprot,q92574,other,go:0016020,positive,d,phosphorylation,,,,,,nan,nan,"in turn , akt phosphorylates the tuberous sclerosis complex , tsc1 and tsc2 ( hamartin and tuberin ) that serves as a gtpase activating protein ( gap ) for the small g protein , ras homolog enriched in brain ( rheb ) . ++++ in turn , akt phosphorylates the tuberous sclerosis complex , tsc1 and tsc2 ( hamartin and tuberin ) that serves as a gtpase activating protein ( gap ) for the small g protein , ras homolog enriched in brain ( rheb ) .",pmc2361102,1,10,10,1,20
215,akt,protein family|protein complex,,,,akt.t,,,tuberin,protein,,,uniprot,p49815,,,positive,i,phosphorylation,,,,,,nan,nan,expression of constitutively active pi3k or active akt induced tuberin phosphorylation .,pmc2652403,1,10,10,1,20
87,akt,protein family|protein complex,,,,akt,,,mtor,protein,,,uniprot,p42345,,,negative,i,phosphorylation,,,,,,nan,nan,"moreover , activated akt decreased the phosphorylation of mtor ( xref_fig ) .",pmc4720880,1,10,10,1,20
220,akt1,protein,,,,p31749,,,mtor,protein,,,uniprot,p42345,,,negative,i,phosphorylation,,cellosaurus:cvcl_0062,,,,nan,nan,"consistent with a previous study , 36 we observed that constitutively active akt1 reduced mtor phosphorylation , likely reflecting the increase in apoptotic cell death , as mtor knockdown increased both akt phosphorylation and parp-1 cleavage upon stimulation with rasfonin .",pmc4720880,1,10,10,1,20
288,arf,protein,,,,q8n726,other,go:0005654 ++++ go:go:0005730,mdm2,protein,,,uniprot,q00987,other,go:0005654 ++++ go:go:0005730,positive,i,none,,cellosaurus:cvcl_0554,,,,nan,nan,"the npm mediated sequestration of arf in the nucleolus has been proposed to increase mdm2 activity in the nucleoplasm [ xref_bibr ] and furthermore , relocalization of arf from the nucleolus to the nucleoplasm is associated with the increased formation of arf and mdm2 complexes [ xref_bibr ] . ++++ arf has been reported to promote p53 stability by sequestering mdm2 to the nucleolus [ xref_bibr , xref_bibr ] , whereas others have reported that nucleoplasmic arf suppresses mdm2 activity [ xref_bibr - xref_bibr , xref_bibr ] .",pmc4171619,1,10,10,1,20
305,atm,protein,,,,q13315,,,chk1,protein,,,uniprot,o14757,,,negative,d,dephosphorylation,,,,,,nan,nan,"atm dependent dephosphorylation of p53 at s376 and chk1 and chk2 dependent phosphorylation of p53 at s378 , s366 and t387 generate 14-3-3 binding sites in vivo .",pmc2817464,1,10,10,1,20
308,atm,protein,,,,q13315,,,chk2,protein,,,uniprot,o96017,,,negative,d,dephosphorylation,,,,,,nan,nan,"atm dependent dephosphorylation of p53 at s376 and chk1 and chk2 dependent phosphorylation of p53 at s378 , s366 and t387 generate 14-3-3 binding sites in vivo . ++++ atm dependent dephosphorylation of p53 at s376 and chk1 and chk2 dependent phosphorylation of p53 at s378 , s366 and t387 generate 14-3-3 binding sites in vivo . ++++ atm dependent dephosphorylation of p53 at s376 and chk1 and chk2 dependent phosphorylation of p53 at s378 , s366 and t387 generate 14-3-3 binding sites in vivo .",pmc2817464,1,10,10,1,20
593,chk2,protein,,,,o96017,other,sl-0276,p53,protein,,,uniprot,p04637,other,sl-0276,negative,i,none,,uaz:cvcl_9115,cl:cl:0000646,,,nan,nan,chk2 deficiency reduces p53 induction and increases proliferation of the skin of k5cre trf1 delta and delta chk2 -/- newborns .,pmc4331747,1,10,10,1,20
762,egfr,protein,,,,p00533,other,go:0009986,egf,protein,,,uniprot,p01133,other,go:0009986,negative,i,none,,,,,,nan,nan,"while the egfr monoclonal antibody 528 ( mab 528 ) that binds to the extracellular ligand binding domain of the egfr markedly reduced the ability of egf to autophosphorylate the egfr , rapamycin- mediated phosphorylation of the egfr was not altered ( xref_supplementary ) .",pmc2653860,1,10,10,1,20
763,egfr,protein,,,,p00533,other,go:0016020,egfr,protein,,,uniprot,p00533,other,go:0016020,negative,i,phosphorylation,,cellosaurus:cvcl_0037,cl:cl:0000359,,,nan,nan,"in a431 cells , in which egfr is overexpressed , depletion of cholesterol with methyl-beta-cyclodextrin causes site specific phosphorylation of egfr , including y845 [ xref_bibr ] .",pmc3709701,1,10,10,1,20
2255,s6k1,protein,,,,p23443,other,go:0015629,insulin receptor substrate 1,protein,,,uniprot,p35568,other,go:0015629,positive,d,phosphorylation,,,,,,nan,nan,the insulin receptor substrate 1 ( irs1 ) is directly phosphorylated by s6k1 at multiple sites which impairs its function and leads to inhibitory effects on the insulin-pi3k-akt pathway .,pmc4258317,1,10,10,1,20
