index,Regulator Name,Regulator Type,Regulator Subtype,Regulator HGNC Symbol,Regulator Database,Regulator ID,Regulator Compartment,Regulator Compartment ID,Regulated Name,Regulated Type,Regulated Subtype,Regulated HGNC Symbol,Regulated Database,Regulated ID,Regulated Compartment,Regulated Compartment ID,Sign,Connection Type,Mechanism,Site,Cell Line,Cell Type,Tissue Type,Organism,Score,Source,Statements,Paper IDs,Evidence Score,Match Score,Kind Score,Epistemic Value,Total Score
200,cbp,protein,,,,q92793,,,ctd,proteinfamily,,,pfam,pf12815,,,positive,d,acetylation,,,,,,"nan,nan","nan,nan","p53 ctd is acetylated at k370 , k372 , k381 and k382 by p300 and cbp and these acetylations have been shown to decrease the non specific dna binding of p53 ctd in vitro .,p53 ctd is acetylated at k370 , k372 , k381 and k382 by p300 and cbp and these acetylations have been shown to decrease the non specific dna binding of p53 ctd in vitro .","pmc2817464,pmc2817464",2,0.1,39,1,39.2
785,protein kinase a,proteinfamilyproteincomplex,,,,pka,plasma membrane,go:0005886,noxa1,protein,,,uniprot,q86ur1,plasma membrane,go:0005886,negative,i,phosphorylation,,,cl:cl:0011108,,,"nan,nan","nan,nan","on the other hand , our group has shown that protein kinase a ( pka ) inhibits nox1 activity in colon epithelial cells by phosphorylating noxa1 at two distinct sites , ser172 and ser461 . ++++ on the other hand , our group has shown that protein kinase a ( pka ) inhibits nox1 activity in colon epithelial cells by phosphorylating noxa1 at two distinct sites , ser172 and ser461 .,on the other hand , our group has shown that protein kinase a ( pka ) inhibits nox1 activity in colon epithelial cells by phosphorylating noxa1 at two distinct sites , ser172 and ser461 . ++++ on the other hand , our group has shown that protein kinase a ( pka ) inhibits nox1 activity in colon epithelial cells by phosphorylating noxa1 at two distinct sites , ser172 and ser461 .","pmc2993755,pmc2993755",2,0.1,39,1,39.2
280,ck2,proteinfamilyproteincomplex,,,,ck2,,,ptc2,protein,,,uniprot,q9y6c5,,,positive,d,phosphorylation,,,,,,"nan,nan","nan,nan","ptc2 and ptc3 were found to bind to the fha1 domain of rad53 and ck2 phosphorylation of ptc2 at t376 was necessary for this interaction [ xref_bibr , xref_bibr ] .,ptc2 and ptc3 were found to bind to the fha1 domain of rad53 and ck2 phosphorylation of ptc2 at t376 was necessary for this interaction [ xref_bibr , xref_bibr ] .","pmc2954851,pmc2954851",2,0.1,39,1,39.2
752,pkcdelta,protein,,,,p83099,,,hur,protein,,,uniprot,q15717,,,positive,d,phosphorylation,,,,,,"nan,nan","nan,nan","moreover , pkcdelta can phosphorylate directly hur at s221 and s318 ( see below ) , triggering the cytoplasmic translocation of hur [ xref_bibr ] .,moreover , pkcdelta can phosphorylate directly hur at s221 and s318 ( see below ) , triggering the cytoplasmic translocation of hur [ xref_bibr ] .","pmc2925474,pmc2925474",2,0.1,39,1,39.2
847,"rsk1*1, epidermal growth factor*1+",proteinprotein,,,,"q15418, p01133",,,gsk-3beta,protein,,,uniprot,p49841,,,positive,i,phosphorylation,,cellosaurus:cvcl_4461,,,,"nan,nan","nan,nan","epidermal growth factor ( egf ) , platelet derived growth factor ( pdgf ) and other growth factors also induce the phosphorylation of gsk-3beta ( s9 ) and gsk-3alpha ( s21 ) by the activated raf/mek/erk/p90 rsk1 signaling pathway [ xref_bibr ] . ++++ epidermal growth factor ( egf ) , platelet derived growth factor ( pdgf ) and other growth factors also induce the phosphorylation of gsk-3beta ( s9 ) and gsk-3alpha ( s21 ) by the activated raf/mek/erk/p90 rsk1 signaling pathway [ xref_bibr ] .,epidermal growth factor ( egf ) , platelet derived growth factor ( pdgf ) and other growth factors also induce the phosphorylation of gsk-3beta ( s9 ) and gsk-3alpha ( s21 ) by the activated raf/mek/erk/p90 rsk1 signaling pathway [ xref_bibr ] . ++++ epidermal growth factor ( egf ) , platelet derived growth factor ( pdgf ) and other growth factors also induce the phosphorylation of gsk-3beta ( s9 ) and gsk-3alpha ( s21 ) by the activated raf/mek/erk/p90 rsk1 signaling pathway [ xref_bibr ] .","pmc4102778,pmc4102778",2,0.1,39,1,39.2
672,p300,protein,,,,q09472,,,ctd,proteinfamily,,,pfam,pf12815,,,positive,d,acetylation,,,,,,"nan,nan","nan,nan","p53 ctd is acetylated at k370 , k372 , k381 and k382 by p300 and cbp and these acetylations have been shown to decrease the non specific dna binding of p53 ctd in vitro .,p53 ctd is acetylated at k370 , k372 , k381 and k382 by p300 and cbp and these acetylations have been shown to decrease the non specific dna binding of p53 ctd in vitro .","pmc2817464,pmc2817464",2,0.1,39,1,39.2
283,cki,protein,,,,p35790,,,beta-catenin,protein,,,uniprot,p35222,,,positive,d,phosphorylation,,,,,,"nan,nan","nan,nan","cki phosphorylates beta-catenin on s45 when wnt signaling is extinguished .,when beta-catenin is mutated at certain nucleotides it can act as an oncogene , as the beta-catenin proteins can not be phosphorylated by gsk-3 or cki ( depending on the residue ) .","pmc4102778,pmc4102778",2,0.1,39,1,39.2
276,ck1,protein,,,,p04264,,,lrp6,protein,,,uniprot,o75581,,,positive,d,phosphorylation,,,,,,"nan,nan","nan,nan","in addition , ck1 also phosphorylates lrp6 at the second ser residue in the pppspxs motif xref_bibr , xref_bibr .,in presence of wnt , lrp6 is phosphorylated within the ppps/tp motifs by gsk3beta and multiple ck1 members , providing docking sites to bind axin1 and gsk3 , thereby sequestering both proteins away from the beta-catenin destruction complex .","pmc2654145,pmc4687460",2,0.1,39,1,39.2
275,ck1,protein,,,,p04264,,,beta-catenin,protein,,,uniprot,p35222,,,positive,d,phosphorylation,,,,,,"nan,nan","nan,nan","this inhibitory effect of phosphorylated pppspxs motifs is direct and specific for gsk3 phosphorylation of beta-catenin at ser33/ser37/thr41 but not for ck1 phosphorylation of beta-catenin at ser45 , and is independent of axin function . ++++ ck1 phosphorylates beta-catenin at ser45 , which is the priming site for beta-catenin ser33/ser37/thr41 phosphorylation by gsk3 xref_bibr .,therefore we have reconstituted an in vitro kinase assay for axin dependent beta-catenin amino-terminal phosphorylation by ck1 and gsk3 using purified proteins .","pmc2654145,pmc2654145",2,0.1,39,1,39.2
846,"rsk1*1, epidermal growth factor*1+",proteinprotein,,,,"q15418, p01133",,,gsk-3alpha,protein,,,uniprot,p49840,,,positive,i,phosphorylation,,cellosaurus:cvcl_4461,,,,"nan,nan","nan,nan","epidermal growth factor ( egf ) , platelet derived growth factor ( pdgf ) and other growth factors also induce the phosphorylation of gsk-3beta ( s9 ) and gsk-3alpha ( s21 ) by the activated raf/mek/erk/p90 rsk1 signaling pathway [ xref_bibr ] . ++++ epidermal growth factor ( egf ) , platelet derived growth factor ( pdgf ) and other growth factors also induce the phosphorylation of gsk-3beta ( s9 ) and gsk-3alpha ( s21 ) by the activated raf/mek/erk/p90 rsk1 signaling pathway [ xref_bibr ] .,epidermal growth factor ( egf ) , platelet derived growth factor ( pdgf ) and other growth factors also induce the phosphorylation of gsk-3beta ( s9 ) and gsk-3alpha ( s21 ) by the activated raf/mek/erk/p90 rsk1 signaling pathway [ xref_bibr ] . ++++ epidermal growth factor ( egf ) , platelet derived growth factor ( pdgf ) and other growth factors also induce the phosphorylation of gsk-3beta ( s9 ) and gsk-3alpha ( s21 ) by the activated raf/mek/erk/p90 rsk1 signaling pathway [ xref_bibr ] .","pmc4102778,pmc4102778",2,0.1,39,1,39.2
526,lrp6,protein,,,,o75581,,,beta-catenin,protein,,,uniprot,p35222,,,negative,i,phosphorylation,,,,,,"nan,nan","nan,nan","cselenyi et al reported that the lrp6 intracellular domain specifically inhibits gsk3 phosphorylation of beta-catenin , but not of tau xref_bibr .,however , while cselenyi et al. suggested that lrp6 specifically inhibits gsk3 phosphorylation of beta-catenin but not of other substrates xref_bibr , our data suggest that the phosphorylated pppspxs peptide behaves as a general gsk3 inhibitor .","pmc2654145,pmc2654145",2,0.1,39,1,39.2
527,lrp6,protein,,,,o75581,,,gsk3,proteinfamilyproteincomplex,,,be,gsk3,,,negative,i,phosphorylation,,,,,,"nan,nan","nan,nan","however , while cselenyi et al. suggested that lrp6 specifically inhibits gsk3 phosphorylation of beta-catenin but not of other substrates xref_bibr , our data suggest that the phosphorylated pppspxs peptide behaves as a general gsk3 inhibitor .,cselenyi et al reported that the lrp6 intracellular domain specifically inhibits gsk3 phosphorylation of beta-catenin , but not of tau xref_bibr .","pmc2654145,pmc2654145",2,0.1,39,1,39.2
835,rhoa,protein,,,,p61586,,,elk-1,protein,,,uniprot,p19419,,,positive,i,none,,,,,,nan,nan,"the sre was preferentially activated by c-raf , a component of the erk cascade , while the dse promoter responded better to rhoa , which triggers an elk-1 independent pathway involving the srf co-activator mal and mkl -1 ( xref_fig d ) .",pmc2377423,1,0.1,39,1,39.1
838,rig-i,protein,,,,o95786,,,p27,protein,,,uniprot,p40305,,,positive,i,amount,,cellosaurus:cvcl_8262,cl:cl:0000169,,,nan,nan,"in our experiments , accumulated rig-i increased the protein level of p27 , but there was no change at the mrna level , suggesting post-translational regulation . ++++ meanwhile , western blotting showed that rig-i transfection induced a decrease in cyclin e protein levels and increased p27 levels ( xref_fig , c , p < 0.05 ) , whereas other protein levels were unaffected ( p > 0.05 ) .",pmc4923948,1,0.1,39,1,39.1
831,rheb,protein,,,,q15382,,,mtorc2,proteinfamilyproteincomplex,,,be,mtorc2,,,negative,i,none,,,,,,nan,nan,rheb activates mtorc1 but inhibits mtorc2 while tsc1/2 inhibits rheb and mtorc1 but activates mtorc2 most likely by overcoming the negative feedback loop [ xref_bibr ] .,pmc4258317,1,0.1,39,1,39.1
843,rock1,protein,,,,q13464,other,go:0005829,rhoe,protein,,,uniprot,p61587,other,go:0005829,positive,d,phosphorylation,,,,,,nan,nan,rhoe is phosphorylated on serine 11 by rock1 and this phosphorylation induces the cytosolic relocation and increased stability of rhoe [ xref_bibr ] .,pmc4729484,1,0.1,39,1,39.1
887,smurf2,protein,,,,q9hau4,,,runx2,protein,,,uniprot,q13950,,,negative,i,none,,,cl:cl:0000062,,,nan,nan,"in addition , akt enhances ubiquitin and proteasome mediated degradation of smurf2 , counteracting the smurf2 induced degradation of runx2 .",pmc4513933,1,0.1,39,1,39.1
886,smrt,protein,,,,q9y618,,,wip1,protein,,,uniprot,o15297,,,negative,i,none,,cellosaurus:cvcl_0042,,,,nan,nan,"smrt represses the phosphatase wip1 , influencing the dynamics of chk2 activation . ++++ because the wip1 dependent feedback has been reported to cause oscillatory behavior in chk2 activation xref_bibr , xref_bibr , and because in genetic oscillators the intensity of the feedback loop dictates the oscillatory behavior of the system xref_bibr - xref_bibr , we sought to examine the possibility that the smrt dependent repression of wip1 might be responsible for influencing the dynamics of chk2 activation after dna damage . ++++ as shown in xref_fig , smrt limited cddp dependent activation of fos and ppm1d and exhibited a repressive function on smad7 , srpk2 , bcl2l11 and max , as their inhibition by cddp was lost in the cells transfected with smrt sirna . ++++ as expected , wip1 protein levels were augmented by doxorubicin treatment and increased by sirna against smrt , even in the absence of dna damage , indicating basal repression of ppm1d by smrt ( xref_fig ) .",pmc3656868,1,0.1,39,1,39.1
888,snail,proteinfamily,,,,ipr029795,,,e-cadherin,protein,,,uniprot,p12830,,,negative,i,transcription,,,cl:cl:0000034,,uberon:uberon:0000468,nan,nan,"like other emt regulators , snail suppresses e-cadherin expression by binding to its promoter .",pmc3355968,1,0.1,39,1,39.1
828,reggamma,protein,,,,p61289,,,dbc1,protein,,,uniprot,o60477,,,negative,i,none,,cellosaurus:cvcl_0042,,,,nan,nan,"to further investigate the mechanism underlying reggamma mediated dbc1 dependent sirt1 inhibition , we analyzed dbc1 and sirt1 complex in reggamma silenced cells .",pmc4245943,1,0.1,39,1,39.1
842,rock1,protein,,,,q13464,other,go:0001725,rhoa,protein,,,uniprot,p61586,other,go:0001725,positive,i,phosphorylation,,cellosaurus:cvcl_0480,,,,nan,nan,we further showed that rhoa phosphorylation on 88 s and 100 t increase rock1 activity and the phosphorylation of rock1 substrate nypt1 ( xref_fig ) .,pmc4729484,1,0.1,39,1,39.1
196,cape,protein,,,,o95347,,,p90rsk,proteinfamilyproteincomplex,,,be,p90rsk,,,negative,i,none,,,,,,nan,nan,"the observation that cape inhibited the activation of nf-kappa b , p90rsk , and p53 leaves 3 possible explanations as to the mode of nf-kappa b inhibition by cape .",pmc2206000,1,0.1,39,1,39.1
382,"erk*1, raf*1+",proteinfamilyproteincomplexproteinfamilyproteincomplex,,,,"erk, raf.t",,,elk-1,protein,,,uniprot,p19419,,,positive,i,phosphorylation,,,,,,nan,nan,"expression of 22w raf stimulated erk phosphorylation of elk-1 at serine 383 in adherent cells , but this effect was markedly reduced under suspension conditions ( xref_fig a ) .",pmc2169466,1,0.1,39,1,39.1
839,rig-i,protein,,,,o95786,,,skp2,protein,,,uniprot,q13309,,,negative,i,none,,,,,,nan,nan,"correspondingly , skp2 was downregulated by elevated rig-i and glucolipotoxicity stimulated p27 stability was abrogated when skp2 was overexpressed ( xref_fig ) .",pmc4923948,1,0.1,39,1,39.1
868,shp2,protein,,,,q06124,,,gab1,protein,,,uniprot,q13480,,,negative,i,none,,,,,,nan,nan,"intriguingly , although tyrosine phosphatase shp2 negatively regulates irs , gab1 and pi3k and akt signaling , it positively influences erk activity , which is partly explained by dephosphorylation of the specific sites involved in rasgap binding .",pmc2683723,1,0.1,39,1,39.1
860,satb1,protein,,,,q01826,,,2017-10-04 00:00:00,protein,,,uniprot,q01860,,,negative,i,none,,,cl:cl:0000034,,uberon:uberon:0000105,nan,nan,"our data favors a model that akt facilitates the differentiation process through coordinated regulation of satb1 versus oct4 and klf4 , i.e. by boosting satb1 function yet attenuating oct4 and klf4 activity .",pmc3675137,1,0.1,39,1,39.1
861,satb1,protein,,,,q01826,,,klf4,protein,,,uniprot,o43474,,,negative,i,none,,,cl:cl:0000034,,uberon:uberon:0000105,nan,nan,"our data favors a model that akt facilitates the differentiation process through coordinated regulation of satb1 versus oct4 and klf4 , i.e. by boosting satb1 function yet attenuating oct4 and klf4 activity .",pmc3675137,1,0.1,39,1,39.1
862,satb1,protein,,,,q01826,other,go:0000805,klf4,protein,,,uniprot,o43474,other,go:0000805,negative,i,transcription,,,cl:cl:0002322,,uberon:uberon:0003062,nan,nan,"satb1 , a chromatin organizer and global gene regulator , represses expression of nanog and klf4 in escs xref_bibr . ++++ it is known that satb1 transcriptionally represses the expression of klf4 and nanog , we therefore hypothesized that akt signaling is probably involved in regulation of stemness through phosphorylation of satb1 , oct4 and klf4 and by enhancing the antagonistic role of satb1 on nanog and klf4 . ++++ satb1 transcriptionally represses expressions of nanog and klf4 through direct binding on their mar elements and stimulates expressions of differentiation genes nestin and bcl2 during ra induced differentiation of escs xref_bibr .",pmc3675137,1,0.1,39,1,39.1
863,satb1,protein,,,,q01826,other,go:0000805,nanog,protein,,,uniprot,q9h9s0,other,go:0000805,negative,i,transcription,,cellosaurus:cvcl_0b87,cl:cl:0002322,,uberon:uberon:0003062,nan,nan,"satb1 , a chromatin organizer and global gene regulator , represses expression of nanog and klf4 in escs xref_bibr . ++++ it is known that satb1 transcriptionally represses the expression of klf4 and nanog , we therefore hypothesized that akt signaling is probably involved in regulation of stemness through phosphorylation of satb1 , oct4 and klf4 and by enhancing the antagonistic role of satb1 on nanog and klf4 . ++++ satb1 transcriptionally represses expressions of nanog and klf4 through direct binding on their mar elements and stimulates expressions of differentiation genes nestin and bcl2 during ra induced differentiation of escs xref_bibr .",pmc3675137,1,0.1,39,1,39.1
880,smrt,protein,,,,q9y618,,,caspase,proteinfamilyproteincomplex,,,be,caspase,,,positive,i,none,,cellosaurus:cvcl_0042,,,,nan,nan,"indeed , co-transfection with chk2 sirna attenuated the caspase activation caused by smrt knock-down , after treatment with doxorubicin ( xref_fig , compare lanes 6 and 2 ) . ++++ the co-repressor smrt delays dna damage induced caspase activation by repressing pro apoptotic genes and modulating the dynamics of checkpoint kinase 2 activation . ++++ we next investigated the role of ppm1d repression in the initial caspase activation induced by smrt knock-down in the presence of dna damage .",pmc3656868,1,0.1,39,1,39.1
864,scf,protein,,,,p21583,,,p27,protein,,,uniprot,p40305,,,positive,i,none,,cellosaurus:cvcl_e508,cl:cl:0000988,,,nan,nan,"in addition , an ubiquitin e3 ligase , the scf ( skp2 ) complex , mediates p27 ( kip1 ) ubiquitin dependent proteolysis .",pmc2652403,1,0.1,39,1,39.1
865,"sfn*1, foxo*1+",proteinproteinfamilyproteincomplex,,,,"p31947, foxo:[genericmutant]",,,foxo,proteinfamilyproteincomplex,,,be,foxo,,,positive,i,none,,,,,,nan,nan,"phosphorylation deficient mutants of foxo proteins enhanced foxo transcriptional activity , and further enhanced sfn induced foxo activity . ++++ phosphorylation deficient mutants of foxo proteins enhanced foxo transcriptional activity , and further enhanced sfn induced foxo activity and apoptosis .",pmc2915986,1,0.1,39,1,39.1
878,smo,protein,,,,q99835,nucleus,go:0005634,suppressor of fused,proteinfamily,,,interpro,ipr007768,nucleus,go:0005634,negative,i,none,,,,,,nan,nan,smo then promotes the dissociation of a suppressor of fused ( sufu )-glioma-associated oncogene homologue ( gli ) complex .,pmc4102778,1,0.1,39,1,39.1
877,skp2,protein,,,,q13309.t,,,p27 kip1,protein,,,uniprot,p46527,,,negative,i,transcription,,uaz:cvcl_9115,cl:cl:2000042,,,nan,nan,"interestingly , downregulation of galectin-3 reduces skp2 expression and only induces p27 kip1 expression .",pmc4211374,1,0.1,39,1,39.1
876,skp2,protein,,,,q13309.t,,,p27 kip1,protein,,,uniprot,p46527,,,negative,i,transcription,,cellosaurus:cvcl_0102,,,,nan,nan,increased p27 kip1 expression resulting from galectin-3 depletion was significantly diminished by skp2 overexpression ( xref_fig ) . ++++ overexpression of galectin-3 or skp2 induces a decrease in p27 kip1 protein expression .,pmc4211374,1,0.1,39,1,39.1
875,skp2,protein,,,,q13309,,,p27 kip1,protein,,,uniprot,p46527,,,negative,i,transcription,,cellosaurus:cvcl_0102,,,,nan,nan,"when galectin-3 was overexpressed in the galectin-3-null snu-638 cells , the expression of skp2 and p27 kip1 was found to increase and decrease , respectively ; additional skp2 depletion enhanced the p27 kip1 expression ( xref_fig ) .",pmc4211374,1,0.1,39,1,39.1
874,skp2,protein,,,,q13309,,,p27 kip1,protein,,,uniprot,p46527,,,negative,i,none,,,,,,nan,nan,"increased skp2 decreases the stability of p27 kip1 , thereby promoting cell cycle progression and inhibiting premature senescence ( xref_fig ) .",pmc4211374,1,0.1,39,1,39.1
873,skp2,protein,,,,q13309,,,p27,protein,,,uniprot,p40305,,,positive,i,none,,cellosaurus:cvcl_e508,cl:cl:0000988,,,nan,nan,"in addition , an ubiquitin e3 ligase , the scf ( skp2 ) complex , mediates p27 ( kip1 ) ubiquitin dependent proteolysis .",pmc2652403,1,0.1,39,1,39.1
872,skp2,protein,,,,q13309,cytoplasm,go:0005737,foxo1,protein,,,uniprot,q12778,cytoplasm,go:0005737,negative,d,ubiquitination,,,,,,nan,nan,"specifically , foxo1 phosphorylated by akt translocates to the cytosol where it is ubiquitinated by skp2 and subjected to proteasome dependent degradation .",pmc3355968,1,0.1,39,1,39.1
866,sgk,protein,,,,o00141,other,go:0001725,foxo,proteinfamilyproteincomplex,,,be,foxo,other,go:0001725,positive,d,phosphorylation,,uaz:cvcl_9115,cl:cl:0002372,,,nan,nan,"because sgk can phosphorylate foxo and its activity is completely inhibited by disruption of mtorc2 , it was suggested that the loss of foxo phosphorylation in sin1 -/- mefs indicates that foxo is primarily phosphorylated by sgk rather than akt [ xref_bibr ] . ++++ because sgk can phosphorylate foxo and its activity is completely inhibited by disruption of mtorc2 , it was suggested that the loss of foxo phosphorylation in sin1 -/- mefs indicates that foxo is primarily phosphorylated by sgk rather than akt [ xref_bibr ] .",pmc2637922,1,0.1,39,1,39.1
840,rig-i,protein,,,,o95786,,,skp2,protein,,,uniprot,q13309,,,negative,i,transcription,,,cl:cl:0000169,,,nan,nan,"elevated rig-i downregulated the transcription of skp2 , and increased the stability and abundance of p27 protein in a stat3 dependent manner , which was associated with inhibition of beta cell growth elicited by src .",pmc4923948,1,0.1,39,1,39.1
299,cytochrome c,protein,,,,p99999,mitochondria,go:0005739,parp,proteinfamilyproteincomplex,,,be,parp,mitochondria,go:0005739,positive,i,none,,,cl:cl:0002319,,uberon:uberon:0000105,nan,nan,"second , addition of cytochrome c failed to induce caspase-9 activation , caspase-3 processing , or parp cleavage in extracts from cells expressing active akt .",pmc2185587,1,0.1,39,1,39.1
889,snail,proteinfamily,,,,ipr029795.p,,,e-cadherin,protein,,,uniprot,p12830,,,positive,i,transcription,,,,,,nan,nan,phosphorylation of snail by gsk-3 can result in the cytoplasmic translocation of snail and lead to increased e-cadherin expression in oral cancer [ xref_bibr ] .,pmc4102778,1,0.1,39,1,39.1
957,tlr,proteinfamilyproteincomplex,,,,tlr,,,ap-1,proteinfamilyproteincomplex,,,be,ap1,,,positive,i,none,,cellosaurus:cvcl_0063,uaz:uaz01530,,,nan,nan,"expression of the kinase dead , dominant negative cdk4 r159n mutant inhibited tlr induced ap-1 reporter gene activity in a dose dependent manner ( xref_fig ) .",pmc3084876,1,0.1,39,1,39.1
273,ck1,protein,,,,p04264,cytoplasm,go:0005737,axin,protein,,,uniprot,o15169,cytoplasm,go:0005737,positive,d,phosphorylation,,,,,,nan,nan,"therefore we have reconstituted an in vitro kinase assay for axin dependent beta-catenin amino-terminal phosphorylation by ck1 and gsk3 using purified proteins . ++++ this may be analogous to parallel mechanisms that promote gsk3 phosphorylation of beta-catenin in the absence of wnt stimulation , such as by gsk3 and ck1 phosphorylation of axin and apc xref_bibr .",pmc2654145,1,0.1,39,1,39.1
965,trim24,protein,,,,o15164,,,sox2,protein,,,uniprot,p48431,,,negative,i,none,,cellosaurus:cvcl_6910,,,,nan,nan,"although wwp2 and trim24 , two e3 ubiquitin ligases , seemed to promote degradation of oct4 and sox2 , both of them did not affect the level of klf4 ( xref_supplementary ) .",pmc3675137,1,0.1,39,1,39.1
964,trim24,protein,,,,o15164,,,2017-10-04 00:00:00,protein,,,uniprot,q01860,,,negative,i,none,,cellosaurus:cvcl_6910,,,,nan,nan,"although wwp2 and trim24 , two e3 ubiquitin ligases , seemed to promote degradation of oct4 and sox2 , both of them did not affect the level of klf4 ( xref_supplementary ) .",pmc3675137,1,0.1,39,1,39.1
274,ck1,protein,,,,p04264,,,axin,protein,,,uniprot,o15169,,,positive,d,phosphorylation,,,,,uberon:uberon:0005569,nan,nan,"in the destruction complex , gsk3 and ck1 phosphorylate not only betacat but also axin and other sites on apc .",pmc4568445,1,0.1,39,1,39.1
961,tpa,protein,,,,p00750,,,phospho-elk-1,protein,,,uniprot,p19419,,,positive,i,amount,,,,,,nan,nan,"tpa stimulation transiently increased the level of phospho-elk-1 at the egr-1 promoter ( xref_fig a , lanes 9-12 ) , which correlated with an increase in med1 recruitment ( lanes 13-16 ) .",pmc2377423,1,0.1,39,1,39.1
277,ck1,protein,,,,p04264,nucleus,go:0005634,beta-catenin,protein,,,uniprot,p35222,nucleus,go:0005634,positive,d,phosphorylation,,,,,,nan,nan,"in the absence of stimulation , ck1 phosphorylates beta-catenin at s45 which primes beta-catenin for subsequent phosphorylation by gsk-3 at s41 , s37 and s33 [ xref_bibr , xref_bibr , xref_bibr - xref_bibr ] .",pmc4102778,1,0.1,39,1,39.1
278,ck1,protein,,,,p04264,nucleus,go:0005634,gli3,protein,,,uniprot,p10071,nucleus,go:0005634,positive,d,phosphorylation,,,,,,nan,nan,"gli3 can be phosphorylated by pka , gsk-3 and ck1 which results in gli3 becoming a transcriptional repressor .",pmc4102778,1,0.1,39,1,39.1
202,ccar2,protein,,,,q8n163,,,hdac3,protein,,,uniprot,o15379,,,negative,i,none,,,,,,nan,nan,"besides sirt1 , ccar2 inhibits the activity of the histone modifying enzymes suv39h1 and hdac3 [ xref_bibr , xref_bibr ] , thus playing an important role in chromatin structure regulation .",pmc4627348,1,0.1,39,1,39.1
279,ck2,proteinfamilyproteincomplex,,,,ck2,,,nic1,protein,,,uniprot,o82752,,,positive,d,phosphorylation,,,,,,nan,nan,"capobianco group recently provided evidence that prior or during nic1 , csl , and maml1 complex association , nic1 is phosphorylated by ck2 allowing the accessibility to a subsequent phosphorylation site [ xref_bibr ] .",pmc3877363,1,0.1,39,1,39.1
954,tgfbeta1,proteinfamily,,,,ipr003939,other,go:0016020,pai-1,protein,,,uniprot,p05121,other,go:0016020,positive,i,transcription,,cellosaurus:cvcl_0035,cl:cl:0000359,,,nan,nan,"knockdown of egfr results in the decrease in tgfbeta1 induced expression of pai-1 , a major tgfbeta1 target that is required for the anti-apoptotic mechanism . ++++ tgfbeta1 induced expression of pai-1 in vascular smooth muscle cells , r22 , has also been shown to require the src phosphorylation of y845 of egfr [ xref_bibr ] .",pmc3709701,1,0.1,39,1,39.1
281,ck2,proteinfamilyproteincomplex,,,,ck2,other,go:0005777,sqstm1,protein,,,uniprot,q13501,other,go:0005777,positive,d,phosphorylation,,,,,,nan,nan,phosphorylation of sqstm1 by csnk2 and ck2 ( casein kinase 2 ) has recently been shown to increase the affinity of sqstm1 for polyubiquitin chains resulting in increased autophagic degradation of ubiquitinated proteins .,pmc4091167,1,0.1,39,1,39.1
