index,Regulator Name,Regulator Type,Regulator Subtype,Regulator HGNC Symbol,Regulator Database,Regulator ID,Regulator Compartment,Regulator Compartment ID,Regulated Name,Regulated Type,Regulated Subtype,Regulated HGNC Symbol,Regulated Database,Regulated ID,Regulated Compartment,Regulated Compartment ID,Sign,Connection Type,Mechanism,Site,Cell Line,Cell Type,Tissue Type,Organism,Score,Source,Statements,Paper IDs,Evidence Score,Match Score,Kind Score,Epistemic Value,Total Score
38734,fibronectin,protein,,,,p02751,,,lkb1,protein,,,uniprot,q15831,,,positive,i,none,,,,,,nan,nan,"in non small cell lung carcinoma ( nsclc ) cells , fibronectin is found to inhibit both the mrna and protein of lkb1 and lkb1-amp-activated protein kinase ( ampk ) signaling [ xref_bibr ] .",pmc4200829,1,10,5,1,15
37211,fadd,protein,,,,q13158,,,apoptosis,biologicalprocess,,,go,go:0006915,,,positive,i,none,,,,,,nan,nan,fadd like il-1beta-converting enzyme inhibitory protein ( flip ) is a potent inhibitor of caspase-8-mediated apoptosis involved in nf-kappab activation .,pmc4736404,1,10,5,1,15
37129,fa,proteinfamily,,,,pf08736,,,pi3k,proteinfamilyproteincomplex,,,be,pi3k,,,positive,i,phosphorylation,,,,,,nan,nan,"fa also attenuated the phosphorylation of pi3k and akt , which are downstream regulatory proteins of fgfr1 , indicating its ability to block the crucial oncogenic pathway . ++++ through further research on the fa mediated signal pathway after inhibition of fgfr1 activity , we showed that fa markedly inhibited the phosphorylation of pi3k and akt in huvec .",pmc4632735,1,10,5,1,15
37128,fa,proteinfamily,,,,pf08736,,,pi3k,proteinfamilyproteincomplex,,,be,pi3k,,,positive,i,none,,,,,,nan,nan,fa inhibits activation of pi3k and akt signaling induced by fgf1 in huvec .,pmc4632735,1,10,5,1,15
37108,fa,proteinfamily,,,,pf08736,,,er,protein,,,uniprot,p03372,,,positive,i,none,,,,,,nan,nan,"inhibition of fa desaturation following the ablation of stearoyl-coa desaturase-1 caused er stress , cell cycle inhibition , and apoptosis of cancer cells .",pmc4012137,1,10,5,1,15
37099,fa,proteinfamily,,,,pf08736,,,apoptosis,biologicalprocess,,,go,go:0006915,,,positive,i,none,,,,,,nan,nan,"inhibition of fa desaturation following the ablation of stearoyl-coa desaturase-1 caused er stress , cell cycle inhibition , and apoptosis of cancer cells .",pmc4012137,1,10,5,1,15
37096,fa,proteinfamily,,,,pf08736,,,akt,proteinfamilyproteincomplex,,,be,akt,,,positive,i,phosphorylation,,,,,,nan,nan,"fa also attenuated the phosphorylation of pi3k and akt , which are downstream regulatory proteins of fgfr1 , indicating its ability to block the crucial oncogenic pathway . ++++ through further research on the fa mediated signal pathway after inhibition of fgfr1 activity , we showed that fa markedly inhibited the phosphorylation of pi3k and akt in huvec .",pmc4632735,1,10,5,1,15
37095,fa,proteinfamily,,,,pf08736,,,akt,proteinfamilyproteincomplex,,,be,akt,,,positive,i,none,,,,,,nan,nan,fa inhibits activation of pi3k and akt signaling induced by fgf1 in huvec .,pmc4632735,1,10,5,1,15
35769,erk2,protein,,,,p28482,,,apoptosis,biologicalprocess,,,go,go:0006915,,,positive,i,none,,,,,,nan,nan,3.5 erk2 regulates hypertrophy by nuclear induction of anp expression and antagonizes apoptosis .,pmc4046245,1,10,5,1,15
35431,erk,proteinfamilyproteincomplex,,,,erk,nucleus,go:0005634,p38,proteinfamilyproteincomplex,,,be,p38,nucleus,go:0005634,positive,i,none,,,,,,nan,nan,"this mechanism is linked , on one hand , with the inhibition of jnk and p38 pathway but not erk , and on the other hand , with the overexpression of pten , which negatively regulates activation of pi-3k-akt pathway .",pmc3269678,1,10,5,1,15
35428,erk,proteinfamilyproteincomplex,,,,erk,nucleus,go:0005634,jnk,proteinfamilyproteincomplex,,,be,jnk,nucleus,go:0005634,positive,i,none,,,,,,nan,nan,"this mechanism is linked , on one hand , with the inhibition of jnk and p38 pathway but not erk , and on the other hand , with the overexpression of pten , which negatively regulates activation of pi-3k-akt pathway .",pmc3269678,1,10,5,1,15
35363,erk,proteinfamilyproteincomplex,,,,erk,,,ras,proteinfamily,,,pfam,pf00071,,,positive,i,none,,,,,,nan,nan,"in braf mutated melanomas , ras is negatively regulated by erk dependent feedback : braf mutated cells have hyperactive erk signaling and elevated erk dependent transcriptional output , including negative-feedback components .",pmc4279367,1,10,5,1,15
35357,erk,proteinfamilyproteincomplex,,,,erk,,,raf,proteinfamilyproteincomplex,,,be,raf,,,positive,i,none,,,,,,nan,nan,raf kinase activity is negatively regulated by active erk via hyperphosphorylation of raf .,pmc3681492,1,10,5,1,15
35352,erk,proteinfamilyproteincomplex,,,,erk,,,proliferation,biologicalprocess,,,go,go:0008283,,,positive,i,none,,,,,,nan,nan,"critically , in our study , we show that both the mek and erk and akt pathways needed to be targeted to mediate effective inhibition of proliferation of cells derived from this patient 's tumour , suggesting that loss of pten did contribute to intrinsic resistance to braf inhibition in this patient .",pmc3999800,1,10,5,1,15
35343,erk,proteinfamilyproteincomplex,,,,erk,,,phosphatase and tensin homolog,protein,,,uniprot,p60484,,,negative,i,none,,,,,,nan,nan,"for example , bcl2 associated agonist of cell death ( bad ) functions as a shared target of akt and erk signaling in phosphatase and tensin homolog ( pten ) deficient tumor cells [ xref_bibr ] .",pmc4891105,1,10,5,1,15
35307,erk,proteinfamilyproteincomplex,,,,erk,,,mtorc1,proteinfamilyproteincomplex,,,be,mtorc1,,,positive,i,none,,,,,,nan,nan,"while acute activation of mek and erk leads to inhibition of either mtorc1 or mtorc2 and moderate increase in beclin 1 expression resulting in cytoprotective autophagy , sustained activation of mek and erk causes inhibition of both mtorc1 and mtorc2 , marked increase in beclin 1 and cytodestructive autophagy [ xref_bibr ] .",pmc3757434,1,10,5,1,15
35111,erk,proteinfamilyproteincomplex,,,,erk,,,apoptosis,biologicalprocess,,,go,go:0006915,,,positive,i,none,,,,,,nan,nan,inhibition of erk can suppress cell growth and results in induction of apoptosis in the cells [ xref_bibr ] .,pmc3826136,1,10,5,1,15
30641,e2f1,protein,,,,q01094,,,apoptosis,biologicalprocess,,,go,go:0006915,,,positive,i,none,,,,,,nan,nan,"compelling evidence indicates that dna damage signaling induces stabilization of e2f1 , which in turn blocks apoptosis induced by cellular stress .",pmc4705687,1,10,5,1,15
30619,e2f-1,protein,,,,q01094,,,apoptosis,biologicalprocess,,,go,go:0006915,,,positive,i,none,,,,,,nan,nan,"recently , silencing e2f-1 effectively inhibited gastric cancer progression by reducing cell proliferation and increasing apoptosis xref_bibr suggesting an oncogenic function .",pmc2929203,1,10,5,1,15
29203,dn-fadd,protein,,,,q13158,,,apoptosis,biologicalprocess,,,go,go:0006915,,,positive,i,none,,,,,,nan,nan,"similar to our previous findings ( xref_fig ) , crma expression suppressed imd , whereas dn-fadd , dn-caspase-9 , and bcl xl were unable to block this form of apoptosis ( xref_fig d ) .",pmc2150834,1,10,5,1,15
22830,co,chemical,,,,104729,,,apoptosis,biologicalprocess,,,go,go:0006915,,,negative,i,none,,,,,,nan,nan,"thus , the iron co complex n69 ( 61 in figure xref_fig ) significantly induced apoptosis in tumor cells but did not trigger unspecific necrotic effects ( see also compound 2 in figure xref_fig ) .",pmc3018145,1,10,5,1,15
5667,ampk,proteinfamilyproteincomplex,,,,ampk,,,mt,protein,,,uniprot,q8ivs2,,,negative,i,none,,,,,,nan,nan,"zadra et al. showed that the ampk activator mt 63-78 was a potent inhibitor of prostate cancer cell growth in androgen sensitive and castration resistant models , resulting in mitotic arrest and apoptosis [ xref_bibr ] .",pmc4826172,1,10,5,1,15
5530,ampk,proteinfamilyproteincomplex,,,,ampk,,,akt,proteinfamilyproteincomplex,,,be,akt,,,positive,i,phosphorylation,,,,,,nan,nan,"at the same time , ampk is able to inhibit akt phosphorylation enabling a compensatory pathway that reinforces mtor inhibition , due to the ability of akt to phosphorylate and block tsc2 xref_bibr , xref_bibr - xref_bibr .",pmc3652812,1,10,5,1,15
4274,akt2,protein,,,,p31751,,,p38,proteinfamilyproteincomplex,,,be,p38,,,positive,i,phosphorylation,,,,,,nan,nan,"akt2 has been shown to negatively regulate the p38 mapk pathway by binding to and phosphorylating one of the p38 family members ask1 , resulting in the inhibition of this pathway and rendering the cells resistant to cisplatin [ xref_bibr ] .",pmc2929606,1,10,5,1,15
4264,akt2,protein,,,,p31751,,,ask1,protein,,,uniprot,q99683,,,positive,i,phosphorylation,,,,,,nan,nan,"akt2 has been shown to negatively regulate the p38 mapk pathway by binding to and phosphorylating one of the p38 family members ask1 , resulting in the inhibition of this pathway and rendering the cells resistant to cisplatin [ xref_bibr ] .",pmc2929606,1,10,5,1,15
4203,akt1,protein,,,,p31749,,,caspase-9,protein,,,uniprot,p55211,,,positive,i,none,,,,,,nan,nan,"xref_bibr , xref_bibr whether this constitutes an off-target mechanism of resistance or rather reflects the inhibition of caspase-9 by akt1 transduced signals 196 ( hence representing a post-target effect ) remains to be clarified .",pmc4047912,1,10,5,1,15
3682,akt,proteinfamilyproteincomplex,,,,akt,,,smad,proteinfamilyproteincomplex,,,be,smad,,,positive,i,none,,,,,,nan,nan,"interestingly , the pi3k and akt pathway may antagonize smad mediated effects and protect cells from tgf-beta-induced apoptosis and growth inhibition [ xref_bibr , xref_bibr ] .",pmc3732602,1,10,5,1,15
3664,akt,proteinfamilyproteincomplex,,,,akt,,,s6,proteinfamily,,,interpro,ipr000529,,,positive,i,phosphorylation,,,,,,nan,nan,"even more intriguingly , although perifosine blocked akt activation , it only inhibited , but not blocked s6 phosphorylation .",pmc4047270,1,10,5,1,15
3642,akt,proteinfamilyproteincomplex,,,,akt,,,raf,proteinfamilyproteincomplex,,,be,raf,,,positive,i,none,,,,,,nan,nan,highly activated akt suppresses raf kinase activity by phosphorylation of s259 .,pmc3936289,1,10,5,1,15
3633,akt,proteinfamilyproteincomplex,,,,akt,,,pten,protein,,,uniprot,p60484,,,negative,i,none,,,,,,nan,nan,"we previously showed that glycogen synthase kinase ( gsk )-3beta facilitates ifn-gamma-activated stat1 by inhibiting shp2 [ xref_bibr ] , and aberrant pi3k and a decrease in pten increase akt activation and gsk-3beta inactivation to cause shp2 activated ifn-gamma resistance in gastric cancer ags cells [ xref_bibr ] .",pmc4924776,1,10,5,1,15
3596,akt,proteinfamilyproteincomplex,,,,akt,,,pi3k,proteinfamilyproteincomplex,,,be,pi3k,,,positive,i,none,,,,,,nan,nan,"another akt antagonist in pi3k and akt signalling is gsk3 , which is negatively regulated by akt [ xref_bibr ] .",pmc3281803,1,10,5,1,15
3585,akt,proteinfamilyproteincomplex,,,,akt,,,phosphatase and tensin homolog,protein,,,uniprot,p60484,,,negative,i,none,,,,,,nan,nan,"for example , bcl2 associated agonist of cell death ( bad ) functions as a shared target of akt and erk signaling in phosphatase and tensin homolog ( pten ) deficient tumor cells [ xref_bibr ] .",pmc4891105,1,10,5,1,15
3566,akt,proteinfamilyproteincomplex,,,,akt,,,p53,protein,,,uniprot,p04637:[genericmutant],,,positive,i,none,,,,,,nan,nan,"addition of the specific p53 inhibitor pifithrin-alpha-hydrobromide ( pft ) to ovarian cancer cell culture reverses the dominant negative akt mediated sensitization of the chemoresistant , p53 wild-type cells , and the chemoresistant p53 mutant in which wild-type p53 was reconstituted [ xref_bibr ] .",pmc270001,1,10,5,1,15
3565,akt,proteinfamilyproteincomplex,,,,akt,,,p53,protein,,,uniprot,p04637,,,positive,i,ubiquitination,,,,,,nan,nan,"mdm2 activation by akt enhances p53 ubiquitination and degradation , thus promoting cell survival .",pmc3587337,1,10,5,1,15
3552,akt,proteinfamilyproteincomplex,,,,akt,,,p21,protein,,,uniprot,p38936,,,positive,i,none,,,,,,nan,nan,"indeed , upon fgf-bp knockdown we observed akt suppression and activation of p21 ( see above ) , sapk and jnk , caspases-3/7 and mediators of apoptosis , the cell death enhancing bh3-only domain proteins bad and bax .",pmc3281803,1,10,5,1,15
3444,akt,proteinfamilyproteincomplex,,,,akt,,,jnk,proteinfamilyproteincomplex,,,be,jnk,,,positive,i,none,,,,,,nan,nan,"for example , the activation of akt can suppress the apoptotic effects of activated jnk ( kim et al , 2002 ) or , alternatively , jnk may modulate other signalling pathways that mediate cell survival , such as nf-kappab ( sanchez-perez et al , 2002 ) .",pmc2409594,1,10,5,1,15
3442,akt,proteinfamilyproteincomplex,,,,akt,,,irs1,protein,,,uniprot,p35568,,,negative,i,phosphorylation,,,,,,nan,nan,"on the other hand , akt directly phosphorylates irs1 at ser 629 to strengthen its activity , thus creating a positive feedback from akt to irs1 [ xref_bibr ] . ++++ on the other hand , akt directly phosphorylates irs1 at ser 629 to strengthen its activity , thus creating a positive feedback from akt to irs1 [ xref_bibr ] .",pmc4227251,1,10,5,1,15
3209,akt,proteinfamilyproteincomplex,,,,akt,,,cdkn2a,protein,,,uniprot,p42771,,,positive,i,none,,,,,,nan,nan,"this subtype may benefit of treatment with inhibitors of pi3k , akt , and mtor ( xref_bibr ) ; impairment of the p16 cdkn2a -cdk4-rb pathway , with inactivation of p16 cdkn2a and/or amplification of cdk4 .",pmc4530319,1,10,5,1,15
3177,akt,proteinfamilyproteincomplex,,,,akt,,,bcl-2,protein,,,uniprot,p10415,,,positive,i,none,,,,,,nan,nan,"akt can inactivate the pro apoptotic protein bcl-2 antagonist of cell death ( bad ) and activate the e3 ubiquitin protein ligase mdm2 , which results in apoptosis suppression and cell survival promotion xref_bibr .",pmc4829549,1,10,5,1,15
3155,akt,proteinfamilyproteincomplex,,,,akt,,,ask1,protein,,,uniprot,q99683,,,positive,i,none,,,,,,nan,nan,"for example , akt negatively regulates ask1 activity by direct phosphorylation of ask1 on ser83 , xref_bibr , xref_bibr ) while calcium/calmodulin dependent protein kinase type ii ( camkii ) likely activates the ask1-p38 pathway in response to calcium influx through phosphorylation of an unidentified residue in ask1 .",pmc3491083,1,10,5,1,15
5669,ampk,proteinfamilyproteincomplex,,,,ampk,,,mtor,protein,,,uniprot,p42345,,,negative,i,none,,,,,,nan,nan,"hence , our data suggest the interaction between ampk activation and suppression of mtor via phosphorylation of raptor at serine 792 upon induction of arsi mediated autophagy .",pmc4155805,1,10,5,1,15
5724,ampk,proteinfamilyproteincomplex,,,,ampk,,,raptor,protein,,,uniprot,q8n122,,,negative,i,none,,,,,,nan,nan,"ampk increases the activity of forkhead box o3 ( foxo3 ) , p53 , cyclin dependent kinase inhibitor 1b ( p27 ) , tsc2 , and raptor in response to cellular stressors like acidosis , hypoxia , and nutrient deprivation [ xref_bibr ] .",pmc4463690,1,10,5,1,15
5823,ampk,proteinfamilyproteincomplex,,,,ampk.p,,,akt,proteinfamilyproteincomplex,,,be,akt,,,positive,i,phosphorylation,,,,,,nan,nan,"as shown in figure xref_fig a , treatment of ags and b16f10 cells with 50 mug/ml sse significantly increased ampk phosphorylation and reduced akt and mtor phosphorylation .",pmc3849547,1,10,5,1,15
13607,braf,protein,,,,p15056,,,egfr,protein,,,uniprot,p00533,,,positive,i,none,,,,,,nan,nan,the strong synergistic effect between inhibition of braf and egfr is explained by a powerful feedback activation of egfr caused by braf inhibition [ xref_bibr ] .,pmc3681569,1,10,5,1,15
21329,chk2,protein,,,,o96017,,,e2f1,protein,,,uniprot,q01094,,,negative,i,phosphorylation,,,,,,nan,nan,"xref_bibr interestingly , chk2 mediated phosphorylation increases the affinity of e2f1 for prb , with the resulting rb and e2f1 complex enhancing transcription of apoptotic target genes .",pmc4905241,1,10,5,1,15
20320,cdkn2a,protein,,,,p42771,,,ccnd1,protein,,,uniprot,p24385,,,positive,i,none,,,,,,nan,nan,"in physiological conditions , the system p16 cdkn2a inhibits protein kinase cyclin dependent kinase 4 ( cdk4 )/cyclin d1 ( ccnd1 ) , which in turn affects the cell-cycle progression depending on the rb ( retinoblastoma susceptibility ) protein ( xref_bibr ) .",pmc4530319,1,10,5,1,15
18242,ccnd1,protein,,,,p24385,,,apoptosis,biologicalprocess,,,go,go:0006915,,,positive,i,none,,,,,,nan,nan,"antisense mediated knockdown of ccnd1 triggers apoptosis in vitro and shrinkage of xenografts in mice xref_bibr , suggesting that cyclin d plays a role in melanoma tumorigenesis and so may be a good target for therapeutic intervention .",pmc3068163,1,10,5,1,15
13697,braf,protein,,,,p15056,,,proliferation,biologicalprocess,,,go,go:0008283,,,positive,i,none,,,,,,nan,nan,"the investigators [ xref_bibr ] also examined leukemia cell line models with or without an nras mutation to demonstrate that braf and mek co-treatment could inhibit proliferation of nras mutant leukemic cells , and that , unlike braf inhibition alone , which promoted erk activation , co-treatment resulted in effective suppression of erk activation .",pmc4062054,1,10,5,1,15
13689,braf,protein,,,,p15056,,,pi,proteinfamilyproteincomplex,,,be,pi3k,,,positive,i,none,,,,,,nan,nan,"significant numbers of mutations have been identified in melanoma patients in these pathways including nras ( 15-30 % ) , braf ( 50-70 % ) , akt3 ( 60 % ) and pten ( 5-20 % ) , which inhibits pi ( 3 ) k signaling .",pmc3837335,1,10,5,1,15
13638,braf,protein,,,,p15056,,,lkb1,protein,,,uniprot,q15831,,,positive,i,none,,,,,,nan,nan,"the aberrant activation of braf by v600e mutation and its downstream target ribosomal s6 kinase 2 ( rsk2 ) inactivates lkb1 protein function in melanoma cells through the phosphorylation of lkb1 at ser324 and ser428 xref_bibr , xref_bibr .",pmc3845579,1,10,5,1,15
13625,braf,protein,,,,p15056,,,fn,protein,,,uniprot,p02751,,,positive,i,transcription,,,,,,nan,nan,braf inhibition increased fn expression at the mrna level as measured by rt-qpcr ( xref_fig ) .,pmc4679729,1,10,5,1,15
13622,braf,protein,,,,p15056,,,erk,proteinfamilyproteincomplex,,,be,erk,,,positive,i,none,,,,,,nan,nan,"the investigators [ xref_bibr ] also examined leukemia cell line models with or without an nras mutation to demonstrate that braf and mek co-treatment could inhibit proliferation of nras mutant leukemic cells , and that , unlike braf inhibition alone , which promoted erk activation , co-treatment resulted in effective suppression of erk activation .",pmc4062054,1,10,5,1,15
13566,braf,protein,,,,p15056,,,ampk,proteinfamilyproteincomplex,,,be,ampk,,,positive,i,none,,,,,,nan,nan,in this manuscript we tested the hypothesis that combination of braf oncogene inhibition and metabolic modulation of ampk would be more effective than either manipulation alone in arresting melanoma cell proliferation .,pmc3152784,1,10,5,1,15
7833,ar,protein,,,,p10275,,,egfr,protein,,,uniprot,p00533,,,positive,i,phosphorylation,,,,,,nan,nan,"furthermore , we showed that , independent of ar , resveratrol directly inhibits egfr and her2 phosphorylation , with rapid consequent inhibition of downstream akt signaling .",pmc2957324,1,10,5,1,15
10040,b-raf,protein,,,,p15056,,,erk,proteinfamilyproteincomplex,,,be,erk,,,positive,i,phosphorylation,,,,,,nan,nan,"furthermore , it was reported that b-raf is expressed in trophoblastic cells and ablation of b-raf abrogated erk phosphorylation xref_bibr .",pmc3462743,1,10,5,1,15
8420,ask,protein,,,,q99683,,,apoptosis,biologicalprocess,,,go,go:0006915,,,positive,i,none,,,,,,nan,nan,"in addition and potentiating the onset of apoptotic cell death , ask induces a drastic reduction in the levels of survivin , a member of the inhibitor of apoptosis ( iap ) family , which is up-regulated in virtually all human cancers ( xref_bibr xref_bibr xref_bibr ) .",pmc4175353,1,10,5,1,15
7985,arf,protein,,,,q8n726,,,proliferation,biologicalprocess,,,go,go:0008283,,,negative,i,none,,,,,,nan,nan,"t-box transcription factor 2 ( tbx2 ) is highly expressed in melanoma cell lines and represses p19 arf and p21 cip1 , both of which are implicated as effectors of senescence , promotes proliferation , and suppresses senescence in melanoma [ xref_bibr , xref_bibr ] .",pmc3199194,1,10,5,1,15
7975,arf,protein,,,,q8n726,,,mdm2,protein,,,uniprot,q00987,,,positive,i,none,,,,,,nan,nan,"arf inhibits the e3 ubiquitin ligase mdm2 and hdm2 , which catalyzes the proteasomal degradation of p53 ( xref_bibr ) . ++++ arf inhibits the e3 ubiquitin ligase mdm2 and hdm2 , which catalyzes the proteasomal degradation of p53 ( xref_bibr ) .",pmc4176343,1,10,5,1,15
7865,ar,protein,,,,p10275,,,tert,protein,,,uniprot,o14746,,,positive,i,none,,,,,,nan,nan,"despite its key topological role in the repression module , activation of ar did not suppress tert .",pmc3923661,1,10,5,1,15
7863,ar,protein,,,,p10275,,,tert,protein,,,uniprot,o14746,,,negative,i,none,,,,,,nan,nan,"additionally , the model identified the only factor , ar , which was able to reverse myc dependent tert suppression by rnai in these experiments .",pmc3923661,1,10,5,1,15
7855,ar,protein,,,,p10275,,,pten,protein,,,uniprot,p60484,,,negative,i,transcription,,,,,,nan,nan,"wang et al. [ xref_bibr ] hypothesized that ar halts pten transcription in the prostate in contrast to the breast , in which ar promotes pten transcription .",pmc4359241,1,10,5,1,15
7837,ar,protein,,,,p10275,,,her2,protein,,,uniprot,p04626,,,positive,i,phosphorylation,,,,,,nan,nan,"furthermore , we showed that , independent of ar , resveratrol directly inhibits egfr and her2 phosphorylation , with rapid consequent inhibition of downstream akt signaling .",pmc2957324,1,10,5,1,15
42764,glucose,chemical,,,,hmdb06564,,,autophagy,biologicalprocess,,,go,go:0006914,,,negative,i,none,,,,,,nan,nan,"- is the primary ros involved in autophagy induced by glucose , glutamine , pyruvate or serum deprivation .",pmc4326572,1,10,5,1,15
34928,erbb2,protein,,,,p04626,,,erk,proteinfamilyproteincomplex,,,be,erk,,,positive,i,none,,,,,,nan,nan,"as expected , lapatinib treatment of erbb2 expressing cells reduced erk and akt activation under normoxic conditions .",pmc4385829,1,10,5,1,15
42794,glucose,chemical,,,,hmdb06564,,,egfr,protein,,,uniprot,p00533,,,negative,i,transcription,,,,,,nan,nan,high glucose promotes pancreatic cancer cellular proliferation by inducing egf expression and transactivation of the egfr xref_bibr .,pmc4753157,1,10,5,1,15
58650,jnk,proteinfamilyproteincomplex,,,,jnk,,,autophagy,biologicalprocess,,,go,go:0006914,,,positive,i,none,,,,,,nan,nan,"xref_bibr inhibition of nf-kb , mapk , jnk , p38 , or the induction of erk ( another regulator of autophagy ) has been used to modulate autophagy in different cancer models to alter responses to the various therapies , including chemo and radiation therapy .",pmc4573074,1,10,5,1,15
64492,mapk,proteinfamilyproteincomplex,,,,erk,,,er,protein,,,uniprot,p03372,,,positive,i,none,,,,,,nan,nan,"although both of the receptors stimulate downstream egf signaling , the receptor specific signatures revealed that the mapk pathway is activated by either egfr or her2 , rather than both , and that egfr is the main driver of mapk signaling in er negative breast cancers .",pmc2694555,1,10,5,1,15
64414,mapk,proteinfamilyproteincomplex,,,,erk,,,apoptosis,biologicalprocess,,,go,go:0006915,,,positive,i,none,,,,,,nan,nan,"specifically , inhibitors of mapk pathway trigger the apoptosis cascade , but are insufficient to kill melanoma cells , revealing an intrinsic resistance ; this might be mediated by low levels of bh3-only proteins and/or high levels of bcl-2-like prosurvival proteins ( xref_bibr , xref_bibr ) .",pmc4121406,1,10,5,1,15
64402,mapk,proteinfamilyproteincomplex,,,,erk,,,akt,proteinfamilyproteincomplex,,,be,akt,,,positive,i,none,,,,,,nan,nan,"in dysplasia , however and unlike adenocarcinomas , we could not evidence perturbations in other signalling pathways such as mapk , jak and stat , wnt , pi3k and akt and notch .",pmc2754338,1,10,5,1,15
64241,mammalian target of rapamycin,protein,,,,p42345,,,apoptosis,biologicalprocess,,,go,go:0006915,,,negative,i,none,,,,,,nan,nan,"in line with the mode of action of afatinib , this was accompanied by decreased phosphorylation levels of her2 and various signalling molecules from the erk and akt and mammalian target of rapamycin ( mtor ) pathway , reduced cellular proliferation ( ki-67 ) and increased apoptosis . ++++ in line with the mode of action of afatinib , this was accompanied by decreased phosphorylation levels of her2 and various signalling molecules from the erk and akt and mammalian target of rapamycin ( mtor ) pathway , reduced cellular proliferation ( ki-67 ) and increased apoptosis .",pmc4019832,1,10,5,1,15
61928,lkb1,protein,,,,q15831,,,proliferation,biologicalprocess,,,go,go:0008283,,,positive,i,none,,,,,,nan,nan,loss of lkb1 regulation often coincident with kras activation allows for unchecked growth and the metabolic capacity to accommodate the proliferation .,pmc2528145,1,10,5,1,15
61919,lkb1,protein,,,,q15831,,,mtorc1,proteinfamilyproteincomplex,,,be,mtorc1,,,negative,i,none,,,,,,nan,nan,"although lkb1 deletion alone is not sufficient to cause lung cancer , it elevates mtorc1 and src activity , which enhances lung cancer induced by k-ras activation or pten deletion [ xref_bibr - xref_bibr ] .",pmc4490316,1,10,5,1,15
58711,jnk,proteinfamilyproteincomplex,,,,jnk,,,erk,proteinfamilyproteincomplex,,,be,erk,,,positive,i,none,,,,,,nan,nan,"on the other hand , activation of jnk and concurrent inhibition of the erk pathway have recently been associated with apoptosis ( xia et al. 1995 ) , the induction of which is suggested to be determined by the duration of jnk activity ( chen et al. 1996 ) .",pmc2169445,1,10,5,1,15
58642,jnk,proteinfamilyproteincomplex,,,,jnk,,,apoptosis,biologicalprocess,,,go,go:0006915,,,positive,i,none,,,,,,nan,nan,jnk activation suppressed the apoptosis of gastric cancer cells in one study [ xref_bibr ] .,pmc4895928,1,10,5,1,15
