index,Regulator Name,Regulator Type,Regulator Subtype,Regulator HGNC Symbol,Regulator Database,Regulator ID,Regulator Compartment,Regulator Compartment ID,Regulated Name,Regulated Type,Regulated Subtype,Regulated HGNC Symbol,Regulated Database,Regulated ID,Regulated Compartment,Regulated Compartment ID,Sign,Connection Type,Mechanism,Site,Cell Line,Cell Type,Tissue Type,Organism,Score,Source,Statements,Paper IDs,Evidence Score,Match Score,Kind Score,Epistemic Value,Total Score
81405,p53,protein,,,,p04637,,,ccnd1,protein,,,uniprot,p24385,,,negative,i,transcription,,,,,,nan,nan,"among oncosuppressor mirnas , the mir-15/16 family members inhibit cell cycle progression by targeting ccnd1/2/3 , ccne1 and cdk4 , while the p53 regulated mir-34 family inhibits the expression of ccnd1 and ccne2 , along with cdk4 and cdk6 .",pmc4724947,1,10,5,1,15
81403,p53,protein,,,,p04637,,,caspase-9,protein,,,uniprot,p55211,,,negative,i,none,,,,,,nan,nan,"the addition of proteasome inhibitors to daci treatment regimens enhances the sensitivity of mm cells to daci to induce mitochondrial dysfunction , caspase-9 , caspase-8 , and caspase-3 activation , and poly ( adp-ribose ) polymerase degradation , which is associated with nf-kappab inactivation , c-jun nh 2 -terminal kinase activation , p53 induction , caspase dependent cleavage of p21 cip1 , p27 kip1 , and bcl-2 , and cyclin d1 downregulation [ xref_bibr ] .",pmc4663284,1,10,5,1,15
118196,tuberin,protein,,,,p49815,,,pkc,protein,,,uniprot,p34722,,,positive,i,transcription,,,,,,nan,nan,these data suggest that tuberin blocks the protein expression of pkc and controls expression of all nox isoforms .,pmc4982584,1,10,5,1,15
94342,raf,proteinfamilyproteincomplex,,,,raf,,,pkb,protein,,,uniprot,p31749,,,positive,i,none,,,,,,nan,nan,"one explanation is that activation of ras and raf signaling pathways and the mtor signaling cascade , may limit the efficacy of akt and pkb targeted therapy ( carol et al. , xref_bibr ) , and suggests that the feedback phosphorylation of akt and activation of the pi3k and akt pathway may be a mechanism for resistance .",pmc3668267,1,10,5,1,15
80922,p38,proteinfamilyproteincomplex,,,,p38,,,apoptosis,biologicalprocess,,,go,go:0006915,,,positive,i,none,,,,,,nan,nan,"the inhibition of jnk decreased apoptosis , whereas inhibition of p38 increased apoptosis . ++++ in contrast , p38 activation through integrin alpha4 and alpha5 might suppress apoptosis .",pmc3629429,1,10,5,1,15
72946,mtorc1,proteinfamilyproteincomplex,,,,mtorc1,,,p53,protein,,,uniprot,p04637,,,negative,i,none,,,,,,nan,nan,heterozygous tsc2 vu242 mutation enhanced mtorc1 signaling activity and tumor incidence in p53 zdf1 and zdf1 zebrafish .,pmc3701212,1,10,5,1,15
75741,nf-kb,protein,,,,p19838,,,autophagy,biologicalprocess,,,go,go:0006914,,,positive,i,none,,,,,,nan,nan,"xref_bibr inhibition of nf-kb , mapk , jnk , p38 , or the induction of erk ( another regulator of autophagy ) has been used to modulate autophagy in different cancer models to alter responses to the various therapies , including chemo and radiation therapy .",pmc4573074,1,10,5,1,15
75740,nf-kb,protein,,,,p19838,,,apoptosis,biologicalprocess,,,go,go:0006915,,,positive,i,none,,,,,,nan,nan,"it can be lost in cancers , which provides an oncotarget : transcription factor nf-kb , linked to inflammation through tnfa , suppresses apoptosis of stressed cancer cells .",pmc3248140,1,10,5,1,15
73567,myc,protein,,,,p01106,,,proliferation,biologicalprocess,,,go,go:0008283,,,positive,i,none,,,,,,nan,nan,myc abrogates p27 function in proliferation arrest .,pmc4148092,1,10,5,1,15
73559,myc,protein,,,,p01106,,,p21,protein,,,uniprot,p38936,,,positive,i,none,,,,,,nan,nan,"conversely , the reason why myc primarily induces apoptosis may be because it directly or indirectly represses the p21 and p16 cdk inhibitors as well as several anti-apoptotic genes [ xref_bibr , xref_bibr , xref_bibr , xref_bibr , xref_bibr ] , thereby possibly favoring apoptosis over senescence .",pmc2881513,1,10,5,1,15
95280,ras,proteinfamily,,,,pf00071,,,epidermal growth factor receptor,protein,,,uniprot,p00533,,,positive,i,none,,,,,,nan,nan,src and ras oncogenes inhibit apoptosis of gallbladder carcinoma ( gbc ) cells by activating the epidermal growth factor receptor ( egfr ) signaling pathway [ xref_bibr ] .,pmc4662481,1,10,5,1,15
72973,mtorc1,proteinfamilyproteincomplex,,,,mtorc1,,,ras,proteinfamily,,,pfam,pf00071,,,negative,i,none,,,,,,nan,nan,"xref_bibr of note , the increased mtorc1 activation in akt and ras tumor cells was found to be the consequence , at least partly , of the ras and mapk mediated phosphorylation and inactivation at the serine 664 residue of the tuberous sclerosis 2 ( tsc2 ) protein , an mtorc1 suppressor . ++++ next , we determined whether pharmacological inhibition of mtorc1 could inhibit atk and ras driven hepatocarcinogenesis .",pmc3737302,1,10,5,1,15
72948,mtorc1,proteinfamilyproteincomplex,,,,mtorc1,,,p53,protein,,,uniprot,p04637:[genericmutant],,,negative,i,none,,,,,,nan,nan,"these results suggest that mtorc1 activation in p53 mutant tissues might facilitate tumor formation and/or growth . ++++ given the increased mtorc1 signaling in p53 mutant zebrafish tumors , we hypothesized that further augmentation of mtorc1 signaling might enhance tumor formation , cell growth or tumor severity .",pmc3701212,1,10,5,1,15
121289,vegf-a,protein,,,,p15692,,,bcl-2,protein,,,uniprot,p10415,,,positive,i,amount,,,,,,nan,nan,"vegf-a sirnas ( # 1 and # 2 ) decreased the protein level of vegf-a ( 63.8 and 91.4 % ) and bcl-2 ( 88.1 and 60.8 % ) , respectively , by western blot analysis .",pmc4929777,1,10,5,1,15
77817,nrf2,protein,,,,q16236,,,ros,chemical,,,chebi,chebi:26523,,,negative,i,none,,,,,,nan,nan,"to investigate whether nrf2 down-regulation contributes to increased ros , we induced nrf2 in tmsc by tbhq , a chemical that stabilizes nrf2 protein by impairing its proteasomal degradation [ xref_bibr , xref_bibr ] .",pmc4015761,1,10,5,1,15
121290,vegf-a,protein,,,,p15692,,,bcl-2,protein,,,uniprot,p10415,,,positive,i,transcription,,,,,,nan,nan,immunofluorescence microscopy revealed that vegf-a sirnas decreased the expression of bcl-2 and the two molecules co-localized with each other ( arrowheads ) .,pmc4929777,1,10,5,1,15
121305,vegf-a,protein,,,,p15692,,,hif-1alpha,protein,,,uniprot,q16665,,,positive,i,none,,,,,,nan,nan,"both vegf-a neutralizing antibody and bevacizumab , abrogate hypoxic induction of hif-1alpha only at 24 h. to identify the specific receptor used by autocrine vegf-a in hypoxia , hs29-4t cells were treated with vegf-r1 and vegf-r2 neutralizing antibodies for 24 h .",pmc3483303,1,10,5,1,15
121462,vegfa,protein,,,,p15692,,,apoptosis,biologicalprocess,,,go,go:0006915,,,positive,i,none,,,,,,nan,nan,inhibition of vegfa production in tumor cells has previously been reported to induce apoptosis in-vitro [ xref_bibr ] and a reduction in levels of vegfa also suggests a potential anti-angiogenic effect of sine compound treatment in vivo .,pmc4647283,1,10,5,1,15
72874,mtorc1,proteinfamilyproteincomplex,,,,mtorc1,,,apoptosis,biologicalprocess,,,go,go:0006915,,,negative,i,none,,,,,,nan,nan,"in agreement with these observations , treatment of mice with thc decreased mtorc1 activity , stimulated autophagy and apoptosis , and reduced tumor growth in xenografts generated with p8 +/+ cells but not in those generated with p8 -/- cells ( in which trb3 is not up-regulated in response to thc [ xref_bibr ] ) , further confirming that the p8/trb3 pathway plays an essential role in the activation of autophagy and cell death by cannabinoids also in vivo .",pmc2817393,1,10,5,1,15
72870,mtorc1,proteinfamilyproteincomplex,,,,mtorc1,,,ampk,proteinfamilyproteincomplex,,,be,ampk,,,negative,i,none,,,,,,nan,nan,"secondary to these effects , ampk activation was found in cancer cells treated with metformin , restraining mtorc1 signaling and limiting growth of renal cell cancer xenografts [ xref_bibr ] .",pmc4944519,1,10,5,1,15
72572,mtor,protein,,,,p42345,,,ros,chemical,,,chebi,chebi:26523,,,negative,i,none,,,,,,nan,nan,mtor kinase inhibitors may be able to inhibit ros mediated rapalog resistance as they inhibit mtor independently of fkbp-12 [ xref_bibr ] .,pmc3717945,1,10,5,1,15
121604,vegfr1,protein,,,,p17948,,,proliferation,biologicalprocess,,,go,go:0008283,,,positive,i,none,,,,,,nan,nan,"heightened vegfr1 expression in these tumors also was apparent at the protein level and targeted inhibition of vegfr1 increased proliferation of hemangiosarcoma cells derived from tumors of golden retrievers , but not from other breeds .",pmc2680013,1,10,5,1,15
76035,nfkb1,protein,,,,p19838,,,apoptosis,biologicalprocess,,,go,go:0006915,,,positive,i,none,,,,,,nan,nan,"xref_bibr however , although inhibition of nfkb1 or mapk1/3 activation enhanced er stress induced apoptosis , xref_bibr neither of them appeared to play a part in ripk1 mediated protection of melanoma cells , as knockdown of ripk1 did not alter the activation levels of nfkb1 or mapk1/3 in melanoma cells when er stress was induced .",pmc4590596,1,10,5,1,15
79427,os,chemical,,,,23937,,,pten,protein,,,uniprot,p60484,,,negative,i,transcription,,,,,,nan,nan,"treatment of os cells with 5-azac induced expression of pten , an inhibitor of the pi3k and akt pathway , while studies in pancreatic cancer demonstrate that 5-azac treatment reduces proliferation of pancreatic cancer cells through inhibition of wnt and beta-catenin signaling and its downstream target c-myc [ xref_bibr , xref_bibr ] .",pmc4419490,1,10,5,1,15
118197,tuberin,protein,,,,p49815,,,ros,chemical,,,chebi,chebi:26523,,,positive,i,none,,,,,,nan,nan,these data suggest that tuberin blocks generation of ros through inhibiting the activity of pkc and mtor .,pmc4982584,1,10,5,1,15
118407,tumor suppressor p53,protein,,,,p04637,,,autophagy,biologicalprocess,,,go,go:0006914,,,positive,i,none,,,,,,nan,nan,the tumor suppressor p53 protein can modulate autophagy by its cellular localization [ xref_bibr ] .,pmc4962028,1,10,5,1,15
80452,p21,protein,,,,p38936,,,proliferation,biologicalprocess,,,go,go:0008283,,,positive,i,none,,,,,,nan,nan,"decreased proliferation is mirrored by alterations in cell cycle distribution and upregulation of p21 , which is relevant for mediating fgf-bp effects .",pmc3281803,1,10,5,1,15
106300,src,proteinfamilyproteincomplex,,,,src,,,p53,protein,,,uniprot,p04637,,,positive,i,transcription,,,,,,nan,nan,"xref_bibr , xref_bibr reciprocally , constitutively active src ( srcy527f ) suppresses p53 and caldesmon expression , but enhances stat3 expression , resulting in the formation of podosomes and rosettes , and invasive phenotypes .",pmc4198344,1,10,5,1,15
80354,p2,proteinfamily,,,,pf07194,,,tp53,protein,,,uniprot,p04637,,,negative,i,none,,,,,,nan,nan,"p53 isoforms obtained from the p1 and p2 promoters of the tp53 gene can be classically or alternatively spliced at their c-terminus to produce the alpha , beta or gamma isoforms .",pmc3872270,1,10,5,1,15
80347,p2,proteinfamily,,,,pf07194,,,mdm2,protein,,,uniprot,q00987,,,negative,i,none,,,,,,nan,nan,"a major function of mdm2 is its role as a key negative feed-back regulator of p53 activity ( bond et al. , xref_bibr ) , p53 activates mdm2 expression via binding to corresponding p53 response elements ( p53res ) in the p2 promoter of the mdm2 gene .",pmc4042062,1,10,5,1,15
80335,p2,proteinfamily,,,,pf07194,,,bcl-2,protein,,,uniprot,p10415,,,negative,i,none,,,,,,nan,nan,young and korsmeyer demonstrated that a series of 20 base deletions between the p1 and p2 promoter of bcl-2 decreased transcription .,pmc4077254,1,10,5,1,15
80331,p2,proteinfamily,,,,pf07194,cytoplasm,go:0005737,ras,proteinfamily,,,pfam,pf00071,cytoplasm,go:0005737,negative,i,none,,,,,,nan,nan,"indeed , when we measured by immunoblotting the level of total protein ras in b78-h1 cells treated with 1 or 5mum p2 , p4 and c14 ( in the absence of light ) , we found that the protein was significantly reduced by 5mum c14 , but not by p2 and p4 .",pmc4021972,1,10,5,1,15
95225,ras,proteinfamily,,,,pf00071,,,beclin-1,protein,,,uniprot,q14457,,,positive,i,none,,,,,,nan,nan,calpain triggered degradation of beclin 1 has been reported by yoo bh et al. who demonstrated that calpain activity is required for ras dependent down-regulation of beclin-1 xref_bibr .,pmc3320619,1,10,5,1,15
80147,p14 arf,protein,,,,q8n726,,,apoptosis,biologicalprocess,,,go,go:0006915,,,positive,i,none,,,,,,nan,nan,"this apoptosis pathway is disrupted in the majority of human cancers by downregulation or loss of p14 arf , upregulation of mdm2 , or mutation of p53 [ xref_bibr , xref_bibr ] .",pmc1291396,1,10,5,1,15
79986,p1,protein,,,,p14222,,,bcl-2,protein,,,uniprot,p10415,,,negative,i,none,,,,,,nan,nan,young and korsmeyer demonstrated that a series of 20 base deletions between the p1 and p2 promoter of bcl-2 decreased transcription .,pmc4077254,1,10,5,1,15
80116,p13,protein,,,,q9t1t5,,,er,protein,,,uniprot,p03372,,,negative,i,none,,,,,,nan,nan,our hypothesis is that the sequence of epigenetic events for establishing and maintaining a silence state of er gene alpha during the breast cancer progression is mediated by prb2 and p13 in association with specific proteins that modify the dna structure through specific mechanisms .,pmc3210013,1,10,5,1,15
120705,vegf,protein,,,,p15692,,,akt,proteinfamilyproteincomplex,,,be,akt,,,positive,i,phosphorylation,,,,,,nan,nan,"in addition , in vitro deletion of fak in ecs resulted in reduced vegf stimulated akt phosphorylation and correlating reduced cellular proliferation as well as increased cell death .",pmc3377344,1,10,5,1,15
120760,vegf,protein,,,,p15692,,,apoptosis,biologicalprocess,,,go,go:0006915,,,positive,i,none,,,,,,nan,nan,"these factors inhibit tumor cell apoptosis and promote tumor proliferation , while normal mscs do not take on these properties .",pmc4691158,1,10,5,1,15
80065,p110delta,protein,,,,o00329,,,akt,proteinfamilyproteincomplex,,,be,akt,,,positive,i,phosphorylation,,,,,,nan,nan,the p110delta specific inhibitor ic486068 abrogated radiation induced phosphorylation of akt .,pmc2652403,1,10,5,1,15
120946,vegf,protein,,,,p15692,,,p38,proteinfamilyproteincomplex,,,be,p38,,,positive,i,none,,,,,,nan,nan,"when investigating the possible underlying mechanisms for the observed impairments , we found that vegf induced p38 signaling was greatly inhibited in ecs of cd146 ec-ko mice .",pmc4026419,1,10,5,1,15
80000,p1,protein,,,,p14222,,,tp53,protein,,,uniprot,p04637,,,negative,i,none,,,,,,nan,nan,"p53 isoforms obtained from the p1 and p2 promoters of the tp53 gene can be classically or alternatively spliced at their c-terminus to produce the alpha , beta or gamma isoforms .",pmc3872270,1,10,5,1,15
79987,p1,protein,,,,p14222,,,caspase 3,protein,,,uniprot,p42574,,,negative,i,none,,,,,,nan,nan,"indeed , p1 shows the highest level of loss of mitochondrial membrane potential and strongly enhances the caspase 3 activity ( xref_fig ) .",pmc4941645,1,10,5,1,15
81598,p53,protein,,,,p04637,,,mek2,protein,,,uniprot,p36507,,,negative,i,none,,,,,,nan,nan,"introduction of transcriptionally deficient , dominant negative p53 allele to cells with sirna blocked mek2 abrogated the resensitization effect , thereby indicating that it requires p53 dependent transcription upon cellular insult [ xref_bibr ] .",pmc4872998,1,10,5,1,15
106227,src,proteinfamilyproteincomplex,,,,src,,,epidermal growth factor receptor,protein,,,uniprot,p00533,,,positive,i,none,,,,,,nan,nan,src and ras oncogenes inhibit apoptosis of gallbladder carcinoma ( gbc ) cells by activating the epidermal growth factor receptor ( egfr ) signaling pathway [ xref_bibr ] .,pmc4662481,1,10,5,1,15
95216,ras,proteinfamily,,,,pf00071,,,apoptosis,biologicalprocess,,,go,go:0006915,,,positive,i,none,,,,,,nan,nan,src and ras oncogenes inhibit apoptosis of gallbladder carcinoma ( gbc ) cells by activating the epidermal growth factor receptor ( egfr ) signaling pathway [ xref_bibr ] .,pmc4662481,1,10,5,1,15
81652,p53,protein,,,,p04637,,,myc,protein,,,uniprot,p01106,,,positive,i,none,,,,,,nan,nan,"p53 functions as a transcription factor inducing mdm2 , bax or igf-bp3 , and represses myc , fos or bcl2 .",pmc2376115,1,10,5,1,15
90838,prb,protein,,,,p06400,,,apoptosis,biologicalprocess,,,go,go:0006915,,,negative,i,none,,,,,,nan,nan,cleavages of prb by caspase 3 and 7 were previously reported to trigger apoptosis but were thought to promote e2f-1 transcriptional activity by inducing the release of e2f-1 from prb .,pmc3875667,1,10,5,1,15
90819,pras40,protein,,,,q96b36,,,proliferation,biologicalprocess,,,go,go:0008283,,,negative,i,none,,,,,,nan,nan,"xref_bibr - xref_bibr owing to its reported role as a negative regulator of mtorc1 , pras40 may be expected to suppress cell growth and proliferation .",pmc4216640,1,10,5,1,15
99197,ros,chemical,,,,chebi:26523,,,hif1alpha,protein,,,uniprot,q16665,,,positive,i,none,,,,,,nan,nan,"in addition , intracellular ros reduction induced by mir-373 up-regulation or txnip silencing promotes the emt phenotype , migration and invasion by activating the hif1alpha and twist pathway .",pmc4741723,1,10,5,1,15
90697,ppp2r2a,protein,,,,p63151,,,alk5,protein,,,uniprot,p36897,,,negative,i,amount,,,,,,nan,nan,"balpha ( ppp2r2a ) enhances tgf-beta/activin/nodal signal by regulating the basal levels of alk5 , whereas bdelta ( ppp2r2d ) negatively modulates these signals by limiting the receptor activity xref_bibr .",pmc4000109,1,10,5,1,15
90219,pp2a,protein,,,,p67775,,,proliferation,biologicalprocess,,,go,go:0008283,,,negative,i,none,,,,,,nan,nan,"restoration of pp2a activity then promotes the induction of apoptosis and inhibition of proliferation [ xref_bibr , xref_bibr ] .",pmc4491676,1,10,5,1,15
90208,pp2a,protein,,,,p67775,,,p53,protein,,,uniprot,p04637,,,negative,i,none,,,,,,nan,nan,"in glioblastoma models , pharmacological inhibition of pp2a decreases p53 abundance and activates akt-1 and plk-1 [ xref_bibr ] .",pmc4491676,1,10,5,1,15
90158,pp2a,protein,,,,p67775,,,apoptosis,biologicalprocess,,,go,go:0006915,,,negative,i,none,,,,,,nan,nan,"information on pp2a is also conflicting as there are situations whereby inactivation of pp2a induces apoptosis in many cancer cells . ++++ this was first noted in drosophila [ xref_bibr ] and in mammalian cell models where inactivation of pp2a induces apoptosis in a number of cancer cell types including cancers of the pancreas , testes , liver and in leukaemic cells [ xref_bibr , xref_bibr , xref_bibr , xref_bibr , xref_bibr ] . ++++ restoration of pp2a activity then promotes the induction of apoptosis and inhibition of proliferation [ xref_bibr , xref_bibr ] .",pmc4491676,1,10,5,1,15
99251,ros,chemical,,,,chebi:26523,,,mtor,protein,,,uniprot,p42345,,,positive,i,none,,,,,,nan,nan,"it does so via ros dependent direct downregulation of akt and mtor signalling , subsequently promoting increased autophagy in the aforementioned cells .",pmc3929888,1,10,5,1,15
88224,pkc,protein,,,,p34722,,,apoptosis,biologicalprocess,,,go,go:0006915,,,positive,i,none,,,,,,nan,nan,"su5416 , other vegfr-2 tkis , and inhibitors of pi3k , akt , and pkc induced apoptosis , inhibited long-term proliferation , reduced telomerase activity , and induced premature senescence and cell-cycle arrest in oecs as well as in human umbilical vein endothelial cells .",pmc3021575,1,10,5,1,15
99321,ros,chemical,,,,chebi:26523,,,proliferation,biologicalprocess,,,go,go:0008283,,,negative,i,none,,,,,,nan,nan,ros signaling by nadph oxidase 5 modulates the proliferation and survival of prostate carcinoma cells .,pmc4949723,1,10,5,1,15
87230,pi3k,proteinfamilyproteincomplex,,,,pi3k,,,smad,proteinfamilyproteincomplex,,,be,smad,,,positive,i,none,,,,,,nan,nan,"interestingly , the pi3k and akt pathway may antagonize smad mediated effects and protect cells from tgf-beta-induced apoptosis and growth inhibition [ xref_bibr , xref_bibr ] .",pmc3732602,1,10,5,1,15
87223,pi3k,proteinfamilyproteincomplex,,,,pi3k,,,s6,proteinfamily,,,interpro,ipr000529,,,positive,i,none,,,,,,nan,nan,the importance of the pi3k and mtor pathways in the regulation of s6k activity was revealed by the ability of inhibitors of those pathways to block the activity of s6 kinases .,pmc3335255,1,10,5,1,15
87205,pi3k,proteinfamilyproteincomplex,,,,pi3k,,,raf,proteinfamilyproteincomplex,,,be,raf,,,positive,i,none,,,,,,nan,nan,"consequently , inhibition of pi3k signaling can activate raf as demonstrated for everolimus in gep-nets xref_bibr .",pmc3936289,1,10,5,1,15
87200,pi3k,proteinfamilyproteincomplex,,,,pi3k,,,pten,protein,,,uniprot,p60484,,,negative,i,none,,,,,,nan,nan,translation efficiency is also targeted by pi3k signaling and modulated by mutation in tumor suppressors pten and tsc .,pmc3339828,1,10,5,1,15
100552,s6,proteinfamily,,,,ipr000529,,,akt,proteinfamilyproteincomplex,,,be,akt,,,negative,i,none,,,,,,nan,nan,"ap-gal4 misexpression of an activated version of the drosophila homolog of the akt target s6 kinase 1 ( ds6kstde xref_bibr ) resulted in a bending downward of the wing blade ( xref_fig ) , an overgrowth phenotype that was effectively suppressed by trbl co-expression ( xref_fig ) , consistent with combinatorial , opposing interaction between these genes .",pmc4198113,1,10,5,1,15
87199,pi3k,proteinfamilyproteincomplex,,,,pi3k,,,pten,protein,,,uniprot,p60484,,,negative,i,decreaseamount,,,,,,nan,nan,"it is likely that loss of pten alone is not sufficient to confer resistance to brafi , but only when it is concurrent with other alterations .",pmc4279367,1,10,5,1,15
87197,pi3k,proteinfamilyproteincomplex,,,,pi3k,,,proliferation,biologicalprocess,,,go,go:0008283,,,positive,i,none,,,,,,nan,nan,all the pi3k and mtor inhibitors were more cytotoxic to the melphalan resistant cells and abolished the selective proliferation advantage of the resistant cells observed with 2.5 mum melphalan alone ( xref_fig ) .,pmc4358942,1,10,5,1,15
90847,prb,protein,,,,p06400,,,e2f1,protein,,,uniprot,q01094,,,positive,i,none,,,,,,nan,nan,"xref_bibr these studies therefore highlight a complex interplay between e2f1 and prb under dna damage conditions , which deviates from the simplistic cell cycle regulated prb mediated repression of e2f1 .",pmc4905241,1,10,5,1,15
90977,prkaa1,protein,,,,q13131,,,myc,protein,,,uniprot,p01106,,,positive,i,none,,,,,,nan,nan,"deletion of prkaa1 , the gene that encodes ampkalpha1 , accelerates development of myc induced lymphoma [ xref_bibr ] . ++++ deletion of prkaa1 , the gene that encodes ampkalpha1 , accelerates development of myc induced lymphoma [ xref_bibr ] .",pmc4490316,1,10,5,1,15
92493,pten,protein,,,,p60484,cytoplasm,go:0005737,apoptosis,biologicalprocess,,,go,go:0006915,cytoplasm,go:0005737,negative,i,none,,,,,,nan,nan,pten is able to induce apoptosis through the akt and pi3k pathway [ xref_bibr ] and is epigenetically silenced in several cancers [ xref_bibr ] .,pmc3929073,1,10,5,1,15
93764,ra,proteinfamily,,,,pf00788,,,p53,protein,,,uniprot,p04637,,,positive,i,none,,,,,,nan,nan,"in addition , all-trans-retinoic acid ( ra ) and retinoids inhibit the nuclear accumulation of p53 without substantially affecting its steady-state level .",pmc3960186,1,10,5,1,15
94320,raf,proteinfamilyproteincomplex,,,,raf,,,mapk,proteinfamilyproteincomplex,,,be,erk,,,positive,i,none,,,,,,nan,nan,several investigators have shown that vemurafenib and other inhibitors of raf kinases can potentiate the activity of the mapk pathway in cells with wild-type braf [ xref_bibr - xref_bibr ] .,pmc3391993,1,10,5,1,15
94302,raf,proteinfamilyproteincomplex,,,,raf,,,erbb3,protein,,,uniprot,p21860,,,positive,i,transcription,,,,,,nan,nan,"the raf inhibitor plx4720 in melanoma enhanced erbb3 expression through the transcription factor , foxd3 [ xref_bibr ] , whereas inhibition of raf in thyroid cancers with vemurafenib ( plx4032 ) induced erbb3 transcription via decreased promoter occupancy by the transcriptional repressors c-terminal binding protein 1 and 2 ( ctbp1/2 ) [ xref_bibr ] .",pmc4022415,1,10,5,1,15
94277,raf,proteinfamilyproteincomplex,,,,raf,,,braf,protein,,,uniprot,p15056,,,positive,i,none,,,,,,nan,nan,"all patients were braf v600 -positive and treated with raf kinase inhibitors , vemurafenib or dabrafenib xref_bibr .",pmc4046110,1,10,5,1,15
94270,raf,proteinfamilyproteincomplex,,,,raf,,,b-raf,protein,,,uniprot,p15056,,,positive,i,none,,,,,,nan,nan,"ro5126766 is a first-in-class dual raf and mek inhibitor which allosterically inhibits b-raf , raf-1 and mek .",pmc3717945,1,10,5,1,15
94268,raf,proteinfamilyproteincomplex,,,,raf,,,apoptosis,biologicalprocess,,,go,go:0006915,,,positive,i,none,,,,,,nan,nan,"disruption of the raf to rb interaction induces apoptosis in melanoma xref_bibr , xref_bibr .",pmc3868523,1,10,5,1,15
94264,raf,proteinfamilyproteincomplex,,,,raf,,,akt,proteinfamilyproteincomplex,,,be,akt,,,positive,i,none,,,,,,nan,nan,"one explanation is that activation of ras and raf signaling pathways and the mtor signaling cascade , may limit the efficacy of akt and pkb targeted therapy ( carol et al. , xref_bibr ) , and suggests that the feedback phosphorylation of akt and activation of the pi3k and akt pathway may be a mechanism for resistance .",pmc3668267,1,10,5,1,15
94004,rac1,protein,,,,p63000,,,ec,protein,,,uniprot,q16769,,,positive,i,none,,,,,,nan,nan,"it has been shown that cdc42 depletion impairs intercalation in pc3 cells and also that cdc42 , rac1 and rhoa impair ec junction opening .",pmc4836205,1,10,5,1,15
92800,pten,protein,,,,p60484:[genericmutant],,,mtor,protein,,,uniprot,p42345,,,negative,i,none,,,,,,nan,nan,"the mtor pathway is also frequently upregulated in cancer by oncogenic pik3ca and pten mutations 79 , which may also contribute to hsf1 activity .",pmc4411196,1,10,5,1,15
