index,Regulator Name,Regulator Type,Regulator Subtype,Regulator HGNC Symbol,Regulator Database,Regulator ID,Regulator Compartment,Regulator Compartment ID,Regulated Name,Regulated Type,Regulated Subtype,Regulated HGNC Symbol,Regulated Database,Regulated ID,Regulated Compartment,Regulated Compartment ID,Sign,Connection Type,Mechanism,Site,Cell Line,Cell Type,Tissue Type,Organism,Score,Source,Statements,Paper IDs,Evidence Score,Match Score,Kind Score,Epistemic Value,Total Score
18065,glucose,chemical,,,chebi,chebi:17234,,,hk2,protein,,hgnc:4923,hgnc,4923,,,negative,i,inhibition,,,,,,0.65,nan,"indeed, it occurs in the absence of glucose and it is enhanced by 5-thio glucose, which blocks hk ii by competing for glucose at the active site of the enzyme xref_bibr.",pmc4274314,1,10,5,1,15
16727,fn1,protein,,hgnc:3778,hgnc,3778,,,tnf,protein,,hgnc:11892,hgnc,11892,,,positive,i,activation,,,,,,0.65,nan,"the a domain of fibronectin (keratinocyte derived) may act on the tlr 4 pathway in apcs (langerhans cells) to cause maturation, tnf-alpha and il-12 secretion, and antigen presentation to autoreactive t cells [xref_bibr].",pmc2933899,1,10,5,1,15
13893,egfr,protein,,hgnc:3236,hgnc,3236,,,ereg,protein,,hgnc:3443,hgnc,3443,,,positive,i,activation,,,,,,0.65,nan,"this suggests that in hacat cells, ereg may be induced by a machr and egfr dependent pathway that does not involve map kinases.",pmc4394542,1,10,5,1,15
13936,egfr,protein,,hgnc:3236,hgnc,3236,,,mtor,protein,,hgnc:3942,hgnc,3942,,,positive,i,activation,,,,,,0.65,nan,"xref_bibr members of the egfr family (eg, egfr, human epidermal growth factor 2), igf, and vegf receptors stimulate mtor activity through the small guanosine triphosphatase (gtpase) ras homolog enriched in brain.",pmc3412949,1,10,5,1,15
13962,egfr,protein,,hgnc:3236,hgnc,3236,,,pten,protein,,hgnc:9588,hgnc,9588,,,,i,autophosphorylation,,,,,,0.65,nan,"the kinase domain of egfr is characterized by 15 lung cancer psnvs (fdr p =4.9 × 10 −8 from activedriver), including the well-studied l858r mutation that affects egfr autophosphorylation and is used as a clinical marker for therapeutic outcome ( xref ).",pmc3564258,1,10,5,1,15
16710,fn1,protein,,hgnc:3778,hgnc,3778,,,il1b,protein,,hgnc:5992,hgnc,5992,,,positive,i,activation,,,,,,0.65,nan,"xref_bibr at the level of macrophages, exosome associated fibronectin induces il-1beta production xref_bibr and microvesicles released by late stage mouse melanoma cells were found to exert a dose dependent suppression of mhc class ii expression in these cells.",pmc3494626,1,10,5,1,15
16717,fn1,protein,,hgnc:3778,hgnc,3778,,,mmp3,protein,,hgnc:7173,hgnc,7173,,,positive,i,increaseamount,,,,,,0.65,nan,"werb and colleagues [xref_bibr] demonstrated that only fibronectin derived fragments, but not intact fibronectin, increased the expression of mmp-1 and mmp-3.",pmc3308078,1,10,5,1,15
18051,glucose,chemical,,,chebi,chebi:17234,,,egfr,protein,,hgnc:3236,hgnc,3236,,,negative,i,inhibition,,,,,,0.65,nan,"more specifically, they identified that glucose deprivation reduces the inhibiting effects of lapatinib by up-regulating constituent genes and thus providing an egfr and erbb2 independent mechanism of glucose uptake and cell survival [xref_bibr].",pmc4307189,1,10,5,1,15
21787,igf1,protein,,hgnc:5464,hgnc,5464,,,igf1,protein,,hgnc:5464,hgnc,5464,,,positive,i,increaseamount,,,,,,0.65,nan,"gh regulates igf-1 levels and increases muscle strength [xref_bibr, xref_bibr], whereas gh enhances lipolysis, igf-1 stimulates protein synthesis, myoblast differentiation, and muscle growth [xref_bibr].",pmc3698426,1,10,3,1,13
20019,hmgb1,protein,,hgnc:4983,hgnc,4983,,,hmgb1,protein,,hgnc:4983,hgnc,4983,,,positive,i,activation,,,,,,0.65,nan,"these data are consistent with the observations that higher hmgb1 expression was associated with greater mitotic index in human melanoma patient samples, supporting a critical role of hmgb1 in supporting melanoma cell proliferation.",pmc4171638,1,10,3,1,13
44336,stat1,protein,,hgnc:11362,hgnc,11362,,,stat1,protein,,hgnc:11362,hgnc,11362,,,positive,i,activation,,,,,,0.65,nan,"moreover, this model does not take into consideration some currently accepted regulatory mechanisms affecting stat1 : dna binding activity, such as stat1 simulation and transcriptional activity of unphosphorylated stat1.",pmc3772111,1,10,3,1,13
23062,il6,protein,,hgnc:6018,hgnc,6018,,,stat3,protein,,hgnc:11364,hgnc,11364,,,positive,i,increaseamount,,,,,,0.65,nan,"il-6 is secreted from the cells, activates the il-6 receptor and thus enhances the levels of p-stat3.",pmc4095943,1,10,3,1,13
20020,hmgb1,protein,,hgnc:4983,hgnc,4983,,,hmgb1,protein,,hgnc:4983,hgnc,4983,,,positive,i,increaseamount,,,,,,0.65,nan,"hmgb1 induced the expression of hmgb1 receptors such as tlr2, tlr4, and rage in huvecs, and dab inhibited the expressions of hmgb1 receptors (xref_fig d).",pmc4915240,1,10,3,1,13
22997,il6,protein,,hgnc:6018,hgnc,6018,,,il6,protein,,hgnc:6018,hgnc,6018,,,positive,i,activation,,,,,,0.65,nan,xref_bibr the immediate post-exercise phase is characterized by increases in catabolic signals such as il6 and interleukin 6 and protein turnover.,pmc4502786,1,10,3,1,13
47736,tnf,protein,,hgnc:11892,hgnc,11892,,,tnf,protein,,hgnc:11892,hgnc,11892,,,positive,i,increaseamount,,,,,,0.65,nan,"in the replication defective adenovirus tnferade, tnf alpha was driven by a radiation inducible promoter to achieve high local tnf levels without detectable levels in the blood and the associated toxicities of systemic tnf [xref_bibr].",pmc4652981,1,10,3,1,13
1031,abl1,protein,,hgnc:76,hgnc,76,,,stat3,protein,,hgnc:11364,hgnc,11364,,,positive,i,activation,,,,,,0.9419,nan,"since silencing stat3 also reduced invasion (xref_fig), we tested whether c-abl and arg promote invasion in a stat3 dependent manner.",pmc3235241,1,10,3,1,13
13885,egfr,protein,,hgnc:3236,hgnc,3236,,,egfr,protein,,hgnc:3236,hgnc,3236,,,positive,i,increaseamount,,,,,,0.86,nan,combined pafr and egfr targeting synergistically diminished the expression of pafr and egfr phosphorylation and downstream signaling.,pmc4028110,1,10,3,1,13
