index,Regulator Name,Regulator Type,Regulator Subtype,Regulator HGNC Symbol,Regulator Database,Regulator ID,Regulator Compartment,Regulator Compartment ID,Regulated Name,Regulated Type,Regulated Subtype,Regulated HGNC Symbol,Regulated Database,Regulated ID,Regulated Compartment,Regulated Compartment ID,Sign,Connection Type,Mechanism,Site,Cell Line,Cell Type,Tissue Type,Organism,Score,Source,Statements,Paper IDs,Evidence Score,Match Score,Kind Score,Epistemic Value,Total Score
30478,mtor,protein,,hgnc:3942,hgnc,3942,,,rps6kb1,protein,,hgnc:10436,hgnc,10436,,,positive,i,activation,,,,,,"0.99289794,0.65,0.65,0.65,0.65,0.8775000000000001,0.65,0.65,0.65,0.65","nan,nan,nan,nan,nan,nan,nan,nan,nan,nan","as
shown in xref ,
increasing amounts of the mutant (eif3f 1–221) disrupted the
activation of s6k1 by mtor as evidenced by the decrease in both the s6k1 and
rps6 phosphorylation and an increase in hypophosphorylated form of s6k1 bound to
eif3f.,mtor activates the downstream p70s6 ser/thr kinase that phosphorylates ribosomal protein s6, required for biosynthesis of the cell's translational apparatus, a critical component of cell growth and proliferation xref .,activated mtor regulates a plethora of cellular activities including gene transcription, translation, cell growth and proliferation, apoptosis, and autophagy.1, 2, 3 for example, mtor phosphorylates and thereby activates p70 s6 kinase (p70s6k), which is a positive regulator of cell size and mrna translation.4 also, eukaryotic translation initiation factor 4e binding protein 1 (4ebp1) becomes directly phosphorylated by mtor, and dissociated from eukaryotic translation initiation factors, allowing ribosome entry into 5 '-cap site of mrnas.,mtor activates s6k1 and ebp1.,the activation of s6k1 and 4e-bp1 by mtor induces mrna translation and a subsequent increase in protein synthesis that is essential for cell growth and proliferation
[ xref , xref ].,the akt activates many downstream factors, including mtor, which in turn activates 4ebp1 and p70s6k1.,although p70s6k can also be activated by mtor independent pathways such as pdk-1, mapk and sapk (stress activated protein kinase), the mtorc1 mediated phosphorylation at t389 is required for its complete activation xref_bibr.,concomitantly, mtor mediates the activation of p70s6k, which in turn phosphorylates the 40s ribosomal protein s6 kinase at ser235 and ser236, leading to the promotion of mrna translation.,rps6 is phosphorylated by p70s6k, which in turn is activated by mtor ( xref ).,a recent study has shown that mtor activation of ps6k increases protein levels of survivin, an inhibitor of apoptosis protein (iap).","pmc2813880,pmc4229093,pmc4714661,pmc3116122,pmc3637810,pmc2868050,pmc3936289,pmc2266860,pmc2361810,pmc3089921",10,10,7,1,107
49016,tsc2,protein,,hgnc:12363,hgnc,12363,,,mtor,protein,,hgnc:3942,hgnc,3942,,,negative,i,inhibition,,,,,,"0.65,0.65,0.65,0.65,0.65,0.8775000000000001,0.65,0.65","nan,nan,nan,nan,nan,nan,nan,nan","rapid advances in our knowledge of tsc were catalyzed by the discovery that hamartin-tuberin normally inhibits the mechanistic target of rapamycin (mtor; previously known as mammalian target of rapamycin) serine/threonine kinase ( xref ).,indeed, myc inhibits the mtor repressor tsc2, thereby increasing mtor activity to facilitate translation through s6k and 4e-bp phosphorylation [xref_bibr].,in the absence of an upstream wnt signal, gsk3 phosphorylates tsc2, which normally acts to inhibit cell growth by activating the gtpase activity of rheb, causing inhibition of mtor.,abrogation of redd1 mediated suppression of mtor by tsc2 rnai protected fasn inhibitor sensitive ovarian cancer cells (ovca 420 cells) from orlistat induced death.,tsc2 is able to form a complex with tsc1 and inhibits mtor activity, which is usually assessed in terms of the phosphorylation status of the downstream substrate 4e-bp1 xref_bibr, xref_bibr.,tsc2 (16p13.3) inhibits mtor protein and regulates cell growth.,to validate whether rheb was involved in prl-3-mediated tsc2 suppression and activation of mtor, we used a rheb activation assay to directly study the levels of active rheb (rheb-gtp) in prl-3-overexpressing cells.,the protein tsc2 negatively regulates the mtor pathway by binding and blocking the gtpase activity of rheb, a positive regulator of mtorc1 activity [xref_bibr].","pmc3701212,pmc4980327,pmc3757404,pmc4340825,pmc3652812,pmc3916197,pmc4657013,pmc3899955",8,10,5,1,85
21791,igf1,protein,,hgnc:5464,hgnc,5464,,,igf1r,protein,,hgnc:5465,hgnc,5465,,,positive,i,activation,,,,,,"0.65,0.65,0.65,0.65,0.8775000000000001,0.8775000000000001","nan,nan,nan,nan,nan,nan","igf-1 might be a ligand of trop2, allowing it to activate downstream mediators (pip 2 and ca 2+) and modulate igf1r signaling.,igf-1 induces igf-1r modification by small ubiquitin like modifier protein-1 (sumo-1) and its translocation to the nucleus [xref_bibr].,igf-ir is activated by igf-i, increasing the level of pi3k activation, increasing akt phosphorylation, sustaining igf-ir expression, and increasing cellular motility and metastasis.,while we provide evidence that the hybrid-r is phosphorylated at the plasma membrane, we have not yet established whether igf-1 mediates nuclear trafficking of the igf-1r or whether this receptor traffics to the nucleus independent of ligand.,the igf-1r is activated by igf-i and igf-ii, resulting in phosphorylation of tyrosines in its kinase domain and the adaptor proteins insulin receptor substrate(irs) family and src homology and collagen domain proteins(shc), which then transduces signals via the akt and mapk pathways[ xref , xref ].,igf-r overexpression has been observed in several os cell lines, and is reliant on activation of igf-1r by igf- 1 to stimulate os cell growth and metastatic dormancy in in vivo and in vitro [xref_bibr, xref_bibr].","pmc4426947,pmc4092852,pmc165010,pmc3411736,pmc4058027,pmc4848962",6,10,3,1,63
13884,egfr,protein,,hgnc:3236,hgnc,3236,,,egfr,protein,,hgnc:3236,hgnc,3236,,,positive,i,activation,,,,,,"0.65,0.65,0.65,0.65,0.65,0.65","nan,nan,nan,nan,nan,nan","additionally, the highly oncogenic egfrviii mutant activates c-met and egfr wild-type can antagonize c-met activation [ xref ].,a plausible explanation can be found in the observation comes that the egfrviii cells promote the survival and proliferation of wild-type egfr cells through the paracrine secretion of soluble factors, such as il-6 and lif, or by generating a favorable microenvironment through the il-8 mediated angiogenesis [xref_bibr, xref_bibr].,in gbms, a low-frequency egfrviii containing subpopulation of cancer cells was found to enhance the activation of the wild-type egfr in adjacent cancer cells to facilitate the growth of the major clones through an interleukin 6 and leukemia inhibitory factor paracrine mechanism 91.,in addition, upon activation by egfr, brk directly phosphorylated y845 in the egfr kinase domain, thereby further potentiating egfr kinase activity.,in a normal tissue, the ligand egf binds to the egfr inducing the dimerization of one or several members of the egf receptor family (erbb 1-4).,overexpression of mir-7, a well-known regulator of egfr expression [xref_bibr], was shown to enhance the effect of an egfr tki, erlotinib, in a head and neck cancer model system [xref_bibr].","pmc4092852,pmc3980595,pmc4648179,pmc3326223,pmc3516830,pmc4555078",6,10,3,1,63
30890,myc,protein,,hgnc:7553,hgnc,7553,,,tert,protein,,hgnc:11730,hgnc,11730,,,positive,i,increaseamount,,,,,,"0.86,0.86,0.65,0.86,0.65","nan,nan,nan,nan,nan","c-myc induces htert transcription and telomerase activity in normal cells of the epithelium mammary glands and primary human fibroblasts xref_bibr.,for example, while c-myc has been shown to activate htert transcription in cancer cells and some normal cells xref_bibr, moderate overexpression of c-myc by itself is not sufficient for activation of endogenous htert genes in normal human mammary epithelial cells xref_bibr; in the latter case, additional genomic alterations were needed for telomerase activation and cellular immortalization.,although sp1 and c-myc cooperatively activate htert expression (kyo et al, 2000), it is possible that tmz or e2 directly or indirectly suppresses the transactivation function of sp1 itself.,as expected from its well known role in endogenous tert regulation, myc knockdown alone substantially reduced tert mrna levels to 40.6% of the non specific control transfectants.,since myc upregulates expression of wrn and htert and stimulates the activity of cdk2 [xref_bibr, xref_bibr, xref_bibr], it is conceivable that these proteins are part of an auto-protective loop that myc uses to suppress senescence, perhaps at multiple levels.","pmc3347505,pmc4600408,pmc2394478,pmc3923661,pmc2881513",5,10,5,1,55
44315,stat1,protein,,hgnc:11362,hgnc,11362,,,ifng,protein,,hgnc:5438,hgnc,5438,,,positive,i,activation,,,,,,"0.65,0.65,0.65,0.65","nan,nan,nan,nan","ifn-gamma production by stat1 -/- ctl was also preserved (unpublished data).,however, in some tissues the lack of stat2 causes a significant drop of stat1 levels, thus producing at least partial absence of ifn-gamma responsiveness.,in cd4 + t cells, stat1 appears to be critical for the activation of t-bet and ifn-gamma, suggesting an ifn-gamma-dependent positive feedback loop, that is, ifn-gamma-dependent stat1 mediated induction of ifn-gamma [xref_bibr, xref_bibr].,ipilimumab may also rescue tumor impaired ifn-gamma pathways in cd4 + t cells [xref_bibr], since a number of genes associated with ifn-gamma signals such as stat1, isg15, gbp1, and eif2ak2 were up-regulated by ipilimumab (data not shown).","pmc3182064,pmc3670275,pmc2862320,pmc3527361",4,10,5,1,45
30889,myc,protein,,hgnc:7553,hgnc,7553,,,tert,protein,,hgnc:11730,hgnc,11730,,,positive,i,activation,,,,,,"0.65,0.9955263,0.65,0.9419","nan,nan,nan,nan","the e-boxes are not only important for htert promoter activation by c-myc, but also bind to mad1 and usf1 to mediate htert repression.,previous studies, using transiently transfected promoter fragments, have shown that the two proximal e-boxes were critical in c-myc mediated htert activation.,ectopic expression of c-myc activates telomerase in hmec [xref_bibr, xref_bibr] and, conversely, htert overexpression selects for c-myc overexpression that may be anticipated to thereby contribute to genomic instability [xref_bibr, xref_bibr].,loss of myc caused complete tert suppression in our model, substantially rescued only by co-suppression of ar.","pmc4915101,pmc4176324,pmc138683,pmc3923661",4,10,5,1,45
46467,tgfb1,protein,,hgnc:11766,hgnc,11766,,,fn1,protein,,hgnc:3778,hgnc,3778,,,positive,i,activation,,,,,,"0.65,0.923,0.65,0.65","nan,nan,nan,nan","as expected [xref_bibr, xref_bibr], tgf-beta1 upregulated fn mrna and protein in control ovarian cancer cells as well.,vim and fn was decreased by il-17a and il-13, but increased by tgf-beta1.,xref_bibr il-4 and tgf-beta1 are potent chemoattractants for fibroblasts and stimulate fibroblast proliferation and collagen and fibronectin synthesis.,addition of tgfbeta1 enhances the effects of fn on emt and our results suggest that interactions with fn, but not with mg, prime cells to respond to growth factor stimulation.","pmc4808028,pmc4554915,pmc3218751,pmc3934944",4,10,5,1,45
30452,mtor,protein,,hgnc:3942,hgnc,3942,,,mtor,protein,,hgnc:3942,hgnc,3942,,,positive,i,activation,,,,,,"0.65,0.65,0.65","nan,nan,nan","the treatment of metastatic rcc (mrcc) has considerably changed over the last 5 years due to the antitumor efficacy of two groups of targeted agents, namely agents that inhibit vascular endothelial growth factor (vegf)-signaling pathways and those that inhibit mammalian target of rapamycin (mtor) [xref_bibr].,subsequently, it was reported [xref_bibr] that dim could inactivate both mammalian target of rapamycin (mtor) and akt activity in pdgf-d-over-expressing prostate cancer cells, pc3.,flcn forms a complex with novel folliculin interacting proteins 1 and 2 (fnip1 and fnip2), and 5 '-amp-activated protein kinase (ampk), a kinase that negatively regulates mammalian target of rapamycin (mtor) xref_bibr, xref_bibr.","pmc3305518,pmc3759180,pmc3012117",3,10,7,1,37
30472,mtor,protein,,hgnc:3942,hgnc,3942,,,rps6,protein,,hgnc:10429,hgnc,10429,,,positive,i,activation,,,,,,"0.65,0.65,0.65","nan,nan,nan","activated mtor regulates a plethora of cellular activities including gene transcription, translation, cell growth and proliferation, apoptosis, and autophagy.1, 2, 3 for example, mtor phosphorylates and thereby activates p70 s6 kinase (p70s6k), which is a positive regulator of cell size and mrna translation.4 also, eukaryotic translation initiation factor 4e binding protein 1 (4ebp1) becomes directly phosphorylated by mtor, and dissociated from eukaryotic translation initiation factors, allowing ribosome entry into 5 '-cap site of mrnas.,trb3 also inhibits insulin-induced activation of s6 kinase 1 by mammalian target of rapamycin [ xref ], and stimulates liver lipolysis by promoting the degradation of acetyl-coenzyme a carboxylase (acc), the rate-limiting enzyme of fatty acid synthesis [ xref ].,phosphorylation level of p70 s6 kinase was decreased by set knockdown in cmec-2, suggesting the involvement of mtor (mammalian target of rapamycin)/p70 s6 kinase signaling.","pmc4714661,pmc3892554,pmc4667663",3,10,7,1,37
20072,hmgb1,protein,,hgnc:4983,hgnc,4983,,,tnf,protein,,hgnc:11892,hgnc,11892,,,positive,i,activation,,,,,,"0.65,0.65,0.65","nan,nan,nan","in particular, on monocyte derived immature dcs, hmgb1 upregulates specific maturation markers (cd80, cd83, cd86, and hla-i), enhances the production of cytokines (il-6, cxcl8, il-12 p70, and tnf-alpha), switches their chemokine responsiveness from ccl5 sensitive to ccl21 sensitive, and induces the cell capacity to stimulate allogeneic t cell proliferation [xref_bibr].,in rheumatoid arthritis (ra), a positive proinflammatory feedback loop was found, where hmgb1 induces release of tnf-alpha from activated macrophages, which in turn induces translocation to the cytosol in macrophages [xref_bibr].,hmgb1 stimulation of endothelial cells and macrophages promotes tnfalpha secretion, which also in turn enhances hmgb1 secretion [xref_bibr].","pmc4880686,pmc4665591,pmc2666642",3,10,5,1,35
13772,egf,protein,,hgnc:3229,hgnc,3229,,,rac1,protein,,hgnc:9801,hgnc,9801,,,positive,i,activation,,,,,,"0.65,0.65,0.8775000000000001","nan,nan,nan","both egf and hgf can induce several rac1 or cdc42 specific guanine nucleotide exchange factors (gefs) [xref_bibr, xref_bibr, xref_bibr, xref_bibr, xref_bibr]; however, it is still unclear which racgef (s) are responsible for mlk3 activation.,in previous studies, the carboxyl-terminus of vav2, which contains the sh2 and sh3 domains, was suggested to play an autoinhibitory role in regulating vav2 activity, acting as a dominant negative for egf-induced rac1 activation ( xref ).,recently, it has been shown to localize at the leading edge of migrating glioma cells where it promoted membrane ruffling and migration and invasion of glioma cells, as well as the egf induced activation of rac1.","pmc4880868,pmc3681694,pmc3790103",3,10,5,1,35
43999,src,protein,,hgnc:11283,hgnc,11283,,,hif1a,protein,,hgnc:4910,hgnc,4910,,,positive,i,activation,,,,,,"0.65,0.979665,0.65","nan,nan,nan","it has been shown that src mediated activation of hif-1alpha occurs through nox generated ros and not by direct phosphorylation as previous thought.,c-src is a well known regulator of cell proliferation xref and this study and the work carried out by other laboratories xref , xref , xref show that c-src can activate hif-1α and consequently glucose uptake.,the intracellular c -terminal domain of cx43 inhibits the non-receptor tyrosine kinase c-src activity and c-src can activate hif-1α [ xref ].","pmc3219092,pmc3285680,pmc4307255",3,10,5,1,35
30430,mtor,protein,,hgnc:3942,hgnc,3942,,,hif1a,protein,,hgnc:4910,hgnc,4910,,,positive,i,increaseamount,,,,,,"0.65,0.65,0.65","nan,nan,nan","the regulation of ros by redd1 is mtor independent, which in the presence of antioxidants can restore normal levels of hif-1alpha.,recent studies reported that mtor mediated signaling stimulates hif-1alpha transcription, which regulates vegf, via 4e-bp1 phosphorylation xref_bibr.,mtor pathway activation leads to constitutive hif-1alpha expression, an important signaling in the pathogenesis of rcc, as well as the expression of cell-cycle regulators c-myc and cyclin d1 [xref_bibr - xref_bibr].","pmc3987075,pmc3653905,pmc4884584",3,10,5,1,35
20025,hmgb1,protein,,hgnc:4983,hgnc,4983,,,il1b,protein,,hgnc:5992,hgnc,5992,,,positive,i,activation,,,,,,"0.65,0.9499940951,0.65","nan,nan,nan","also, hmgb1 forms complex with il-1beta, greatly potentiating the proinflammatory activity of il-1beta alone [xref_bibr].,thus, hmgb1 and caspase -8 pathway promoted the processing of il-1beta via nf-kappab pathway.,by binding to toll like receptors (tlrs) such as tlr4 and tlr2 on the surface of dcs, hmgb1 triggers the release of il-1beta and stimulate the presentation of taas to t and b cells.","pmc4393905,pmc4518626,pmc3525632",3,10,5,1,35
4574,bax,protein,,hgnc:959,hgnc,959,,,bcl2,protein,,hgnc:990,hgnc,990,,,negative,i,inhibition,,,,,,"0.65,0.65,0.65","nan,nan,nan","lupeol upregulates the expression of bak and bax and downregulates bcl-2.,indeed, upon fgf-bp reduction a marked activation of members of the bcl-2 family and promoters of apoptosis, bad and bax, and to a lesser extent of bcl-2, was observed in an apoptosis antibody array.,the induction of bax and concomitant suppression of bcl-2 by withaferin-a led to the cleavage of caspase-3 and parp, and induction of apoptosis in caski cells [xref_bibr].","pmc4183851,pmc3281803,pmc4813154",3,10,5,1,35
6285,canx,protein,,hgnc:1473,hgnc,1473,,,rps6,protein,,hgnc:10429,hgnc,10429,,,,i,phosphorylation,,,,,,"0.951,0.65,0.65","nan,nan,nan","in addition, erk1/2 has been demonstrated to activate the p90 ribosomal s6 kinase (rsk), which can subsequently phosphorylate s6 at ser 235/236 independent of mtor signaling ( xref ) xref .,in addition, erk1/2 has been demonstrated to activate the p90 ribosomal s6 kinase (rsk), which can subsequently phosphorylate s6 at ser 235/236 independent of mtor signaling (xref_supplementary) xref_bibr.,in addition, erk1/2 has been demonstrated to activate the p90 ribosomal s6 kinase (rsk), which can subsequently phosphorylate s6 at ser 235/236 independent of mtor signaling (xref_supplementary) xref_bibr.","pmc3621889,pmc3621889,pmc3621889",3,10,5,1,35
13688,egf,protein,,hgnc:3229,hgnc,3229,,,egfr,protein,,hgnc:3236,hgnc,3236,,,positive,i,increaseamount,,,,,,"0.65,0.65,0.65","nan,nan,nan","in mda mb-468 cells, egf increased levels of pegfr and perbb3 whereas egf and hgf together increased phosphorylated met, egfr and erbb3.,egf stimulation increased egfr, akt, src, and igf-1r phosphorylation in a549 and h460 cells but not in h522, a low egfr expressing cell line [xref_bibr].,70 local secretion of egf preferentially stimulates egf receptor expressing breast cancer cells, inducing the pluripotency gene sox-2 through activation of stat3 enhancing their survival and proliferation.","pmc4216798,pmc4453276,pmc4794275",3,10,3,1,33
44536,stat3,protein,,hgnc:11364,hgnc,11364,,,stat3,protein,,hgnc:11364,hgnc,11364,,,positive,i,increaseamount,,,,,,"0.86,0.65,0.65","nan,nan,nan","in agreement with this finding, sirna mediated knockdown of stat3 in 786-o cells significantly reduced the expression of several known stat3 downstream genes, including mcl-1, cyclind1 and bcl-xl (xref_fig).,as shown in xref_fig, we aimed to ascertain whether quercetin affects stat3 signaling measuring levels of p-stat3 and vegf (stat-3 target gene).,in xref_fig b), we investigated whether apigenin affects stat3 signalling measuring levels of p-stat3 and vegf (stat3 target gene).","pmc3855768,pmc4899028,pmc4708008",3,10,3,1,33
47735,tnf,protein,,hgnc:11892,hgnc,11892,,,tnf,protein,,hgnc:11892,hgnc,11892,,,positive,i,activation,,,,,,"0.65,0.65,0.65","nan,nan,nan","tumor necrosis factor alpha (tnfalpha)-converting enzyme (tace) is key to produce active tnfalpha, and is negatively regulated by tissue inhibitor of metalloproteinases 3 (timp3), which is under the control of the silent information regulator 1 (sirt1).,there was up-regulation of genes involved in tnf signaling including tnfalpha and tnfrsf1a and the up-regulation of tnf during prrsv infection has been reported to have an important role in pathogenicity.,the demonstration of elevated levels of tnf-alpha in prp lesional skin biopsies, [xref_bibr] combined with the reported cases of successful treatment with infliximab [xref_bibr] and adalimumab, support the use of tnf-alpha antagonists in the treatment of prp.","pmc3283502,pmc3091693,pmc3816698",3,10,3,1,33
30429,mtor,protein,,hgnc:3942,hgnc,3942,,,hif1a,protein,,hgnc:4910,hgnc,4910,,,positive,i,activation,,,,,,"0.65,0.65","nan,nan","it has been previously shown that in some neoplasms mtor is an upstream activator of hif-1alpha protein, enhancing its gene transcription xref_bibr - xref_bibr.,mtor controls production of hif-1alpha, an important protein in rcc, where its unregulated activity is causally related to disease pathogenesis.","pmc4148307,pmc3089921",2,10,5,1,25
44360,stat3,protein,,hgnc:11364,hgnc,11364,,,bcl2,protein,,hgnc:990,hgnc,990,,,positive,i,increaseamount,,,,,,"0.65,0.65","nan,nan","xref_bibr stat3 and oct-1 knockdown leads to increased expression of proapoptotic bax and bad proteins, cytochrome c release from mitochondria, subsequent cleavage of caspases 3 and 9, and decreased expression of antiapoptotic bcl-2 and bcl-xl proteins.,furthermore, inhibition of stat3 represses the expression of bcl-2 and sensitizes cells to chemotherapy induced apoptosis [xref_bibr].","pmc3735336,pmc4730348",2,10,5,1,25
13738,egf,protein,,hgnc:3229,hgnc,3229,,,mtor,protein,,hgnc:3942,hgnc,3942,,,positive,i,activation,,,,,,"0.65,0.65","nan,nan","we found that egf stimulation increased erk1/2 phosphorylation, but not s6k t389 phosphorylation, in hek293t cells, suggesting that egf cannot potently activate mtor in our experiment.,serum- and egf induced mtor and akt activity was measured with ps6k thr389 and pakt ser473 as readout by western blotting.","pmc4565669,pmc2753613",2,10,5,1,25
30468,mtor,protein,,hgnc:3942,hgnc,3942,,,pten,protein,,hgnc:9588,hgnc,9588,,,positive,i,activation,,,,,,"0.65,0.86","nan,nan","studies with cancer stem cells have shown that inhibition of mtor pathways by rapamycin can block the generation or maintenance of leukemia initiating cells in the pten deficient mice.,in addition to the characterization of expansive myelopoiesis and the impaired immune response of myeloid cells induced by pten deficiency, this study also indicated the contribution of c/ebpalpha and pi3k and mtor signaling in pten regulated myelopoiesis.","pmc3032507,pmc4015859",2,10,5,1,25
40800,rps6kb1,protein,,hgnc:10436,hgnc,10436,,,mtor,protein,,hgnc:3942,hgnc,3942,,,,i,phosphorylation,,,,,,"0.65,0.65","nan,nan","we found that the pi3k inhibitors ly294002 and pi-103 were able to inhibit phosphorylation of the mtor target p70s6k.,of note, the formation of autophagosomes during rlgals9 treatment did not require the autophagy regulator mtor (mechanistic target of rapamycin [serine/threonine kinase]), as rlgals9 treatment induced both phosphorylation and dephosphorylation of mtor in kras mut and braf mut cell lines, with minimal effect on phosphorylation of the downstream mtor target rps6kb1 (ribosomal protein s6 kinase, 70kda, polypeptide 1) (xref_fig).","pmc4277460,pmc4590647",2,10,5,1,25
44000,src,protein,,hgnc:11283,hgnc,11283,,,hif1a,protein,,hgnc:4910,hgnc,4910,,,positive,i,increaseamount,,,,,,"0.65,0.65","nan,nan","however, studies using src transformed fibroblasts demonstrated that src induces elevated expression of hif-1alpha in mrna and protein level under normoxia [xref_bibr, xref_bibr].,our results point out that down-regulation of cx43 activates c-src, which induces hif-1alpha expression leading to the secretion of vegf.","pmc3439988,pmc4307255",2,10,5,1,25
18061,glucose,chemical,,,chebi,chebi:17234,,,glucose,chemical,,,chebi,chebi:17234,,,positive,i,activation,,,,,,"0.65,0.65","nan,nan","in gastric cancer cells, the expressions of glucose transporters (glut-1 and glut-3) were up-regulated to transport more glucose into cells to satisfy the great amount of energy requirements [xref_bibr, xref_bibr].,hif-1 increases the expression of glucose transporters (glut-1 and glut-3) to increase glucose capture and induces the expression of down-stream glycolytic enzymes such as hk2, phosphoglycerate kinase (pgk1), ldh-a [xref_bibr, xref_bibr] (xref_fig).","pmc4928316,pmc3823111",2,10,3,1,23
3546,ar,protein,,hgnc:644,hgnc,644,,,ar,protein,,hgnc:644,hgnc,644,,,positive,i,activation,,,,,,"0.65,0.86","nan,nan","on the other hand, ppp1 overexpression increased ar expression and markedly enhanced ar transcriptional activity in prostate cancer cells xref_bibr.,through direct physical interaction with the ar, src is able to phosphorylate the ar and thereby induce ligand independent ar activation (one of the key mechanisms of castration resistant pc).","pmc4000109,pmc4313607",2,10,3,1,23
1753,ahr,protein,,hgnc:348,hgnc,348,,,ahr,protein,,hgnc:348,hgnc,348,,,positive,i,increaseamount,,,,,,"0.65,0.65","nan,nan","kynurenine mediated activation of the ahr increased ahr expression in skov-3 cells (supplementary xref_supplementary), indicating that ahr activation increases ahr expression.,ahr antagonists sr1 and sr2 specifically increase ahr dependent expression of ly6e in tamoxifen sensitive mcf7 cells but not in mcf7 (tam-r) cells (xref_fig).","pmc4011581,pmc3389396",2,10,3,1,23
