index,Regulator Name,Regulator Type,Regulator Subtype,Regulator HGNC Symbol,Regulator Database,Regulator ID,Regulator Compartment,Regulator Compartment ID,Regulated Name,Regulated Type,Regulated Subtype,Regulated HGNC Symbol,Regulated Database,Regulated ID,Regulated Compartment,Regulated Compartment ID,Sign,Connection Type,Mechanism,Site,Cell Line,Cell Type,Tissue Type,Organism,Score,Source,Statements,Paper IDs,Evidence Score,Match Score,Kind Score,Epistemic Value,Total Score
22516,il1b,protein,,hgnc:5992,hgnc,5992,,,il1b,protein,,hgnc:5992,hgnc,5992,,,positive,i,increaseamount,,,,,,0.65,nan,"generally, these results indicate that curcumin might suppress the aggregation of the spinal nalp1 inflammasome, thereby inhibiting il-1β maturation and neuropathic pain.previous studies have reported that the activation of jak2-stat3 signalling mediates il-1β mrna expression in vitro in pancreatic acinar ar42j cells stimulated with cerulein as well as in vivo in rats with cerulean-induced pancreatitis17.",pmc4933926,1,10,18,1,28
4689,bcl2,protein,,hgnc:990,hgnc,990,,,bcl2,protein,,hgnc:990,hgnc,990,,,negative,i,decreaseamount,,,,,,0.65,nan,u0126 reduced basal expression of bcl-2 in ocm1 cells and enzastaurin induced expression of bcl-2 in c918 and ocm1 cells.,pmc3257235,1,10,18,1,28
22484,il1b,protein,,hgnc:5992,hgnc,5992,,,apcs,protein,,hgnc:584,hgnc,584,,,positive,i,activation,,,,,,0.65,nan,il-1alpha and il-1beta are the products of apcs [xref_bibr].,pmc3315743,1,10,18,1,28
22230,il10,protein,,hgnc:5962,hgnc,5962,,,il10,protein,,hgnc:5962,hgnc,5962,,,positive,i,activation,,,,,,0.65,nan,high il-10 expression and increased serum concentrations of il-10 in nsclc patients have been shown to correlate with reduced survival [xref_bibr].,pmc4916325,1,10,18,1,28
6518,casp9,protein,,hgnc:1511,hgnc,1511,,,casp9,protein,,hgnc:1511,hgnc,1511,,,positive,i,activation,,,,,,0.65,nan,it is possible that the decrease in cyclin b1 upon treatment of the sigma-2 ligands reduces the phosphorylation level of caspase-9 at the inhibitory site and thus activates caspase-9 and apoptosis.,pmc3322954,1,10,18,1,28
37774,pten,protein,,hgnc:9588,hgnc,9588,,,pten,protein,,hgnc:9588,hgnc,9588,,,positive,i,increaseamount,,,,,,0.65,nan,"ptenp1 was found to regulate pten expression through sequestration of pten targeting mir, thereby increasing the half-life of pten mrna and increasing pten protein levels.",pmc4329810,1,10,18,1,28
40744,rps6,protein,,hgnc:10429,hgnc,10429,,,rps6kb1,protein,,hgnc:10436,hgnc,10436,,,positive,i,activation,,,,,,0.65,nan,"activated p70s6k phosphorylates rps6, an s6 protein of the 40s ribosomal subunit, which in turn causes feedback inhibition of insulin like growth factor 1 (igf-1) signaling by phosphorylating insulin receptor substrate 1 (irs-1), leading to its degradation [xref_bibr, xref_bibr].",pmc4226718,1,10,18,1,28
49680,usp1,protein,,hgnc:12607,hgnc,12607,,,usp1,protein,,hgnc:12607,hgnc,12607,,,negative,i,decreaseamount,,,,,,0.65,nan,"the important regulatory role of usp1 in dna repair, supported by the finding that usp1 gene knockout in model systems leads to dna damage hypersensitivity [xref_bibr - xref_bibr], together with the observation that usp1 is frequently overexpressed in tumors, suggests that usp1 could be a relevant target for cancer therapy, whose inhibition might contribute to overcome chemoresistance.",pmc3750636,1,10,18,1,28
