index,Regulator Name,Regulator Type,Regulator Subtype,Regulator HGNC Symbol,Regulator Database,Regulator ID,Regulator Compartment,Regulator Compartment ID,Regulated Name,Regulated Type,Regulated Subtype,Regulated HGNC Symbol,Regulated Database,Regulated ID,Regulated Compartment,Regulated Compartment ID,Sign,Connection Type,Mechanism,Site,Cell Line,Cell Type,Tissue Type,Organism,Score,Source,Statements,Paper IDs,Evidence Score,Match Score,Kind Score,Epistemic Value,Total Score
1752,ahr,protein,,hgnc:348,hgnc,348,,,ahr,protein,,hgnc:348,hgnc,348,,,positive,i,activation,,,,,,"0.65,0.65","nan,nan","this growth inhibition occurs regardless of whether or not the cells are induced by doxycycline to decrease ahr protein levels significantly and attenuate genomic ahr signaling.,in addition, impaired interaction between sp1 and ahr promoter caused by sp1 inhibitor or ahr hypermethylation led to ahr downregulation xref_bibr xref_bibr xref_bibr.","pmc4037283,pmc4570213",2,10,3,1,23
27609,mdm2,protein,,hgnc:6973,hgnc,6973,,,mdm2,protein,,hgnc:6973,hgnc,6973,,,positive,i,increaseamount,,,,,,0.65,nan,recent data suggested that mdm2 gene polymorphisms may contribute to increased mdm2 basal expression and increase cancer susceptibility.,pmc4979029,1,10,7,1,17
23060,il6,protein,,hgnc:6018,hgnc,6018,,,stat3,protein,,hgnc:11364,hgnc,11364,,,positive,d,increaseamount,,,,,,0.65,nan,"moreover, it was recently shown that stat-3 overexpression or stat-3 activation by il-6 significantly increased the levels of beta-catenin in pancreatic tumor cells, and this effect inhibited beta-catenin signaling [xref_bibr].",pmc4587977,1,10,7,1,17
15806,f2,protein,,hgnc:3535,hgnc,3535,,,f2,protein,,hgnc:3535,hgnc,3535,,,positive,d,activation,,,,,,0.65,nan,"third, thrombin-tm complex activates thrombin activatable fibrinolysis inhibitor (tafi), also known as procarboxypeptidase r, a procarboxypeptidase that degrades several pro-inflammatory mediators such as bradykinin and complement factors c3a and c5a.",pmc3342133,1,10,7,1,17
20018,hmgb1,protein,,hgnc:4983,hgnc,4983,,,hmgb1,protein,,hgnc:4983,hgnc,4983,,,positive,d,increaseamount,,,,,,0.65,nan,silencing of hmgb1 expression by an hmgb1 specific rnai lentiviral vector has been shown to reduce matrix metalloproteinase 9 (mmp9) expression and metastatic capacity in mgc-803 gastric carcinoma cells.,pmc3561630,1,10,7,1,17
7221,cd28,protein,,hgnc:1653,hgnc,1653,,,cd28,protein,,hgnc:1653,hgnc,1653,,,positive,i,increaseamount,,,,,,0.65,nan,"here, we discuss recent insights into the molecular events underlying cd28 mediated co-stimulation, its impact on gene regulation, and the differential role of cd28 expression on treg cells versus conventional cd4 + and cd8 + t-cells.",pmc4918251,1,10,7,1,17
40096,rhog,protein,,hgnc:672,hgnc,672,,,rac1,protein,,hgnc:9801,hgnc,9801,,,positive,i,activation,,,,,,0.65,nan,rac1 or rhog depletion results in a transitional phenotype consistent with previous studies showing that rac1 is required for protrusion and inhibition induces rounding in ht1080 cells in a 3d collagen matrix and that rhog can promote rac1 activity and polarized protrusions.,pmc4710245,1,10,5,1,15
30782,myc,protein,,hgnc:7553,hgnc,7553,,,ccnd1,protein,,hgnc:1582,hgnc,1582,,,positive,i,increaseamount,,,,,,0.65,nan,"therefore, we can hypothesize that, in cancer cells, the expression of ccnd1 promoted by myc can be a result of oncogenic signals triggered by kras that eventually protects myc from degradation by gsk3b.",pmc3808429,1,10,5,1,15
30776,myc,protein,,hgnc:7553,hgnc,7553,,,bcl2,protein,,hgnc:990,hgnc,990,,,negative,i,inhibition,,,,,,0.65,nan,myc can also induce apoptosis by suppressing anti-apoptotic members of the bcl-2 family [xref_bibr].,pmc2881513,1,10,5,1,15
34670,pdpk1,protein,,hgnc:8816,hgnc,8816,,,amh,protein,,hgnc:464,hgnc,464,,,positive,i,activation,,,,,,0.65,nan,"we employed further small molecule inhibitors to validate the three additional mis targets pdk1, crm1 and cdk4/6.",pmc3466406,1,10,5,1,15
34677,pdpk1,protein,,hgnc:8816,hgnc,8816,,,egfr,protein,,hgnc:3236,hgnc,3236,,,positive,i,activation,,,,,,0.65,nan,"45 in hnscc, pdk1 has been shown to mediate g-protein-coupled receptor and egfr cross-talk as well as cell growth, both in vitro and in vivo.",pmc4985507,1,10,5,1,15
37738,pten,protein,,hgnc:9588,hgnc,9588,,,hif1a,protein,,hgnc:4910,hgnc,4910,,,negative,i,inhibition,,,,,,0.65,nan,transfection of wild-type pten (wtpten) as well as silencing the pi3k and akt pathway via pharmacological inhibition decreased both hif-1alpha and target gene expression.,pmc2828807,1,10,5,1,15
37745,pten,protein,,hgnc:9588,hgnc,9588,,,mtor,protein,,hgnc:3942,hgnc,3942,,,negative,i,inhibition,,,,,,0.65,nan,"the pten phosphatase controls the levels of pip 3 induced by growth factor activation of pi3 kinase, and acts to negatively regulate mtor activity.",pmc2528145,1,10,5,1,15
37782,pten,protein,,hgnc:9588,hgnc,9588,,,tnf,protein,,hgnc:11892,hgnc,11892,,,negative,i,decreaseamount,,,,,,0.65,nan,"furthermore pten has been shown to antagonize tumor necrosis factor (tnf)-stimulated nf-kappab-dependent gene expression, thus sensitizing cells to tnf induced apoptosis [xref_bibr].",pmc2801511,1,10,5,1,15
956,abcc2,protein,,hgnc:53,hgnc,53,,,abcb1,protein,,hgnc:40,hgnc,40,,,negative,i,decreaseamount,,,,,,0.65,nan,"combined treatment markedly decreased mrna expression levels of multidrug resistance protein 1 (mdr1), mdr associated protein (mrp) 1, and mrp2.",pmc3565256,1,10,5,1,15
40735,rps6,protein,,hgnc:10429,hgnc,10429,,,mtor,protein,,hgnc:3942,hgnc,3942,,,,i,phosphorylation,,,,,,0.65,nan,"indeed, combination treatment showed a synergistic effect on inhibition of phosphorylation of the downstream mtor targets 4e-bp1 and ribosomal protein s6 (xref_fig a and xref_fig b).",pmc4312923,1,10,5,1,15
45317,tap1,protein,,hgnc:43,hgnc,43,,,tap2,protein,,hgnc:44,hgnc,44,,,positive,i,increaseamount,,,,,,0.65,nan,"up-regulation of tap-1 and lmp-7 peptides, and, rescued expression of tap-2, lmp-2 peptides and the b-7.1 molecule.",pmc3603982,1,10,5,1,15
47719,tnf,protein,,hgnc:11892,hgnc,11892,,,samd9,protein,,hgnc:1348,hgnc,1348,,,positive,i,increaseamount,,,,,,0.65,nan,"human samd9 expression can be upregulated by tumor necrosis factor (tnf) [xref_bibr] or by type i [xref_bibr] and type ii interferons (ifns) [xref_bibr], and it is classified as an interferon stimulated gene (isg).",pmc3685527,1,10,5,1,15
47673,tnf,protein,,hgnc:11892,hgnc,11892,,,mtor,protein,,hgnc:3942,hgnc,3942,,,positive,i,activation,,,,,,0.65,nan,"interestingly, intrahypothalamic infusion of recombinant il-1 or tnf increases mtor activity and evokes anorexia in control rats.",pmc3060650,1,10,5,1,15
47628,tnf,protein,,hgnc:11892,hgnc,11892,,,hmgb1,protein,,hgnc:4983,hgnc,4983,,,positive,i,increaseamount,,,,,,0.65,nan,"because tnf-alpha increases the expression of hmgb1 xref_bibr, its down-regulation by ifn-beta was more evident in the study design we employed.",pmc3633862,1,10,5,1,15
47627,tnf,protein,,hgnc:11892,hgnc,11892,,,hmgb1,protein,,hgnc:4983,hgnc,4983,,,positive,i,activation,,,,,,0.65,nan,"hmgb1 stimulation of endothelial cells and macrophages promotes tnfalpha secretion, which also in turn enhances hmgb1 secretion [xref_bibr].",pmc2666642,1,10,5,1,15
47619,tnf,protein,,hgnc:11892,hgnc,11892,,,fn1,protein,,hgnc:3778,hgnc,3778,,,positive,i,activation,,,,,,0.86,nan,"in addition, tnf-alpha upregulated fn, not vim.",pmc4554915,1,10,5,1,15
47602,tnf,protein,,hgnc:11892,hgnc,11892,,,egfr,protein,,hgnc:3236,hgnc,3236,,,positive,i,activation,,,,,,0.65,nan,we previously demonstrated that tnf-alpha promotes egfr endocytosis in a p38 dependent manner xref_bibr xref_bibr.,pmc4510653,1,10,5,1,15
47552,tnf,protein,,hgnc:11892,hgnc,11892,,,bcl2,protein,,hgnc:990,hgnc,990,,,positive,i,activation,,,,,,0.65,nan,"agents that specifically target apoptotic machinery including tumor necrosis factor (tnf)-related apoptosis inducing ligand (trail) receptors, the bcl2 family of anti-apoptotic proteins, inhibitor of apoptosis (iap) and mdm2 are currently being explored for cancer drug discovery xref_bibr.",pmc3714264,1,10,5,1,15
46468,tgfb1,protein,,hgnc:11766,hgnc,11766,,,fn1,protein,,hgnc:3778,hgnc,3778,,,positive,i,increaseamount,,,,,,0.65,nan,"it was also already known that fn expression by mesothelial cells is induced by tgf-beta1 produced by ovarian cancer cells, via the tgf-beta1 receptor/rac/smad dependent transcriptional pathway, and is critical for the metastasis of ovarian cancer cells to the peritoneum [xref_bibr].",pmc4808028,1,10,5,1,15
46410,tgfb1,protein,,hgnc:11766,hgnc,11766,,,acvrl1,protein,,hgnc:175,hgnc,175,,,positive,i,activation,,,,,,0.65,nan,"xref_bibr therefore, grk2 levels are able to modulate tgfbeta1 mediated alk1 and alk5 pathways in endothelial cells by both inhibiting the alk5 route at the level of smad2/3 and by positively contributing to the activation of the alk1 route through an uncharacterized mechanism.",pmc4905215,1,10,5,1,15
44359,stat3,protein,,hgnc:11364,hgnc,11364,,,bcl2,protein,,hgnc:990,hgnc,990,,,positive,i,activation,,,,,,0.65,nan,"xref_bibr similarly, bcl-2 which is upregulated by stat3 downstream of npm-alk, is detected only in a minority of cases of imt.",pmc3977456,1,10,5,1,15
40780,rps6kb1,protein,,hgnc:10436,hgnc,10436,,,bad,protein,,hgnc:936,hgnc,936,,,negative,i,inhibition,,,,,,0.65,nan,"both erk, through the activity of its downstream effector p90rsk, and p70s6 kinase can phosphorylate and thereby deactivate the pro apoptotic protein bad [xref_bibr, xref_bibr].",pmc3720609,1,10,5,1,15
44058,src,protein,,hgnc:11283,hgnc,11283,,,rac1,protein,,hgnc:9801,hgnc,9801,,,positive,i,activation,,,,,,0.65,nan,"in human pancreatic cancer cells, epidermal growth factor (egf) induces the secretion and activation of mmp-2 through an intracellular signaling pathway that involves pi3k- and src dependent activation of rac1, which, in turn, is responsible for the nox mediated ros production [xref_bibr].",pmc3835130,1,10,5,1,15
44021,src,protein,,hgnc:11283,hgnc,11283,,,mtor,protein,,hgnc:3942,hgnc,3942,,,positive,i,activation,,,,,,0.86,nan,"similarly, c-src activation by egf stimulation induced upregulation of rictor and mtor (xref_supplementary).",pmc3823661,1,10,5,1,15
43962,src,protein,,hgnc:11283,hgnc,11283,,,egf,protein,,hgnc:3229,hgnc,3229,,,positive,i,activation,,,,,,0.65,nan,"this study demonstrated that, while over-expression of c-src by itself did not affect acinar morphogenesis or growth factor dependence in 3d culture, c-src co-operated with gab2 to promote egf independent acinar growth.",pmc2747914,1,10,5,1,15
43887,src,protein,,hgnc:11283,hgnc,11283,,,aldh1a1,protein,,hgnc:402,hgnc,402,,,positive,i,increaseamount,,,,,,0.65,nan,"furthermore, combination of src inhibition (either by dasatinib or sirna) and gemcitabine significantly decreased the levels of aldh1a1 expression.",pmc4063532,1,10,5,1,15
43631,sp1,protein,,hgnc:11205,hgnc,11205,,,tert,protein,,hgnc:11730,hgnc,11730,,,negative,i,inhibition,,,,,,0.65,nan,"third, we showed that the sp1 shrna dramatically decreased the telomerase activity in both mouse models.",pmc2815765,1,10,5,1,15
43616,sp1,protein,,hgnc:11205,hgnc,11205,,,hif1a,protein,,hgnc:4910,hgnc,4910,,,negative,i,inhibition,,,,,,0.65,nan,sp1 cooperates with p53 to indirectly downregulate the hif1a gene in cancer cells [xref_bibr].,pmc4728449,1,10,5,1,15
43598,sp1,protein,,hgnc:11205,hgnc,11205,,,ahr,protein,,hgnc:348,hgnc,348,,,negative,i,decreaseamount,,,,,,0.65,nan,differential sp1 expression and abnormal sp1 binding activity were demonstrated to mediate reduced expressions of ahr and its target genes in human breast cancer cells xref_bibr xref_bibr.,pmc4570213,1,10,5,1,15
40801,rps6kb1,protein,,hgnc:10436,hgnc,10436,,,mtor,protein,,hgnc:3942,hgnc,3942,,,negative,i,inhibition,,,,,,0.86,nan,"building on these results, we demonstrate that ass1 deficiency in cancer increases cytosolic aspartate levels which increases cad activation by upregulating its substrate availability and also by increasing its phosphorylation by s6k1 through the mammalian target of rapamycin (mtor) pathway.",pmc4655447,1,10,5,1,15
40786,rps6kb1,protein,,hgnc:10436,hgnc,10436,,,egfr,protein,,hgnc:3236,hgnc,3236,,,negative,i,inhibition,,,,,,0.65,nan,p70s6 kinase inhibition leads to egf receptor dependent compensatory signaling through erk.,pmc3720609,1,10,5,1,15
43897,src,protein,,hgnc:11283,hgnc,11283,,,ar,protein,,hgnc:644,hgnc,644,,,positive,i,activation,,,,,,0.65,nan,"src and its substrate fak participate in bombesin induced activation of ar, which is inhibited by expressing dominant negative src or fak.",pmc3634711,1,10,5,1,15
21836,igf1,protein,,hgnc:5464,hgnc,5464,,,tap1,protein,,hgnc:43,hgnc,43,,,positive,i,activation,,,,,,0.65,nan,"that is, the down-regulation of tap-1 and lmp-2 in cells and/or the restoration of tap1 by down-regulation of igf-1 in these tumor cells are pstat 1 independent.",pmc3603982,1,10,5,1,15
24508,jak1,protein,,hgnc:6190,hgnc,6190,,,stat1,protein,,hgnc:11362,hgnc,11362,,,positive,i,activation,,,,,,0.65,nan,the functional role of jak1 and jak2 activation of stat1 was confirmed when expression of stat1 was reduced by stable transduction with two different stat1-shrnas.,pmc4485824,1,10,5,1,15
13837,egfr,protein,,hgnc:3236,hgnc,3236,,,bax,protein,,hgnc:959,hgnc,959,,,negative,i,decreaseamount,,,,,,0.65,nan,"xref_bibr infected wild-type and kinase defective epidermal growth factor receptor (egfr) mice with h. pylori and demonstrated that h. pylori induced egfr phosphorylation stimulated pi3k dependent activation of the anti-apoptotic factor akt, increased expression of the anti-apoptotic factor bcl-2, and decreased expression of the pro apoptotic factor bax, suggesting that h. pylori uses multiple mechanisms to suppress gastric epithelial cell death and promote infection (xref_fig).",pmc3241725,1,10,5,1,15
13711,egf,protein,,hgnc:3229,hgnc,3229,,,hif1a,protein,,hgnc:4910,hgnc,4910,,,positive,i,increaseamount,,,,,,0.65,nan,"similarly, mftz-1 also abrogated the accumulation of hif-1alpha protein driven by the growth factors egf (xref_fig), which are known to stimulate the expression of hif-1alpha protein [xref_bibr, xref_bibr, xref_bibr].",pmc3822569,1,10,5,1,15
13705,egf,protein,,hgnc:3229,hgnc,3229,,,fn1,protein,,hgnc:3778,hgnc,3778,,,positive,i,activation,,,,,,0.65,nan,egf also increased cell adhesion to fibronectin and increased migration by increasing cell surface levels of the beta 1 subunit without a corresponding increase in alpha 5 [xref_bibr].,pmc3712721,1,10,5,1,15
13696,egf,protein,,hgnc:3229,hgnc,3229,,,ereg,protein,,hgnc:3443,hgnc,3443,,,positive,i,increaseamount,,,,,,0.65,nan,"to determine whether egf could induce the expression of areg, ereg, and tgfa, kinetic analyses of egf treated rasb1 cells were performed.",pmc4116519,1,10,5,1,15
13651,egf,protein,,hgnc:3229,hgnc,3229,,,ar,protein,,hgnc:644,hgnc,644,,,positive,i,activation,,,,,,0.65,nan,"we also note that 14-3-3eta has been reported to contribute to prostate cancer, based on a study in which 14-3-3eta enhanced androgen- and egf induced androgen receptor transcriptional activity [xref_bibr].",pmc3025492,1,10,5,1,15
13024,dusp1,protein,,hgnc:3064,hgnc,3064,,,tnf,protein,,hgnc:11892,hgnc,11892,,,negative,i,inhibition,,,,,,0.65,nan,"reported that 0.5 gy of gamma irradiation significantly increases the expression of mkp-1, inactivates p38-mapk, and finally suppresses the tnfalpha production in mouse raw264.7 macrophages.",pmc3404483,1,10,5,1,15
6295,capn10,protein,,hgnc:1477,hgnc,1477,,,ahr,protein,,hgnc:348,hgnc,348,,,positive,i,activation,,,,,,0.86,nan,"furthermore, we investigated whether inhibition of calpain-10 suppresses ahr cleavage and located in snail binding site.",pmc4202161,1,10,5,1,15
5142,birc3,protein,,hgnc:591,hgnc,591,,,tert,protein,,hgnc:11730,hgnc,11730,,,positive,i,increaseamount,,,,,,0.86,nan,"among iaps family, c-iap2 is related to the htert protein and promotes htert expression [22].",pmc2868050,1,10,5,1,15
5138,birc3,protein,,hgnc:591,hgnc,591,,,myc,protein,,hgnc:7553,hgnc,7553,,,positive,i,activation,,,,,,0.86,nan,"among iaps family members, c-iap2 is related to htert protein and promotes htert as well as c-myc activity in e6 of hpv 16 [22].",pmc2868050,1,10,5,1,15
5137,birc3,protein,,hgnc:591,hgnc,591,,,hmgb1,protein,,hgnc:4983,hgnc,4983,,,positive,i,activation,,,,,,0.65,nan,"the current study found an association between the expression of hmgb1 and c-iap2 proteins in hcc, suggesting that c-iap2 could mediate the effects of hmgb1 on inhibition of hcc apoptosis and promotion of hcc progression.",pmc4310020,1,10,5,1,15
4036,atm,protein,,hgnc:795,hgnc,795,,,cdc25a,protein,,hgnc:1725,hgnc,1725,,,positive,i,activation,,,,,,0.65,nan,"the importance of atm signalling in mvm induced cell cycle arrest was further corroborated by the finding that chk2, a target of atm phosphorylation, in mvm infected cells, mediates the proteosomal degradation of cdc25a, a phosphatase required for cell cycle progression [xref_bibr].",pmc4323056,1,10,5,1,15
3757,arsb,protein,,hgnc:714,hgnc,714,,,hif1a,protein,,hgnc:4910,hgnc,4910,,,negative,i,inhibition,,,,,,0.65,nan,"the transcriptional effects of arsb and c4s due to reduced binding of galectin-3 to the more highly sulfated chondroitin 4-sulfate present when arsb was reduced increased expression of versican in prostate cells, wnt9a in colonic epithelial cells, and hif-1alpha in bronchial epithelial cells [xref_bibr - xref_bibr].",pmc4831796,1,10,5,1,15
3581,ar,protein,,hgnc:644,hgnc,644,,,tert,protein,,hgnc:11730,hgnc,11730,,,positive,i,activation,,,,,,0.65,nan,"additionally, the model identified the only factor, ar, which was able to reverse myc dependent tert suppression by rnai in these experiments.",pmc3923661,1,10,5,1,15
3580,ar,protein,,hgnc:644,hgnc,644,,,tert,protein,,hgnc:11730,hgnc,11730,,,negative,i,inhibition,,,,,,0.86,nan,further analysis of the role of myc led to the finding that ar co-suppression is able to reverse myc dependent tert suppression in a2780 cells.,pmc3923661,1,10,5,1,15
3579,ar,protein,,hgnc:644,hgnc,644,,,tert,protein,,hgnc:11730,hgnc,11730,,,negative,i,decreaseamount,,,,,,0.65,nan,"interestingly, as predicted by the model, ar co-suppression substantially restored tert expression relative to myc knockdown alone.",pmc3923661,1,10,5,1,15
3322,apcs,protein,,hgnc:584,hgnc,584,,,apc,protein,,hgnc:583,hgnc,583,,,positive,i,activation,,,,,,0.65,nan,"for optimal performance, antigen delivery vehicles should closely mimic the composition and immunological processing of actual pathogens; they should actively or passively target apcs such as dcs; protect the antigenic protein from degradation; direct the nature of the resulting immune response (i.e., cellular versus humoral responses) and lastly, induce apc maturation by interacting with elements of the innate immune system such as toll like receptors (tlrs).",pmc3759217,1,10,5,1,15
3307,apc,protein,,hgnc:583,hgnc,583,,,tnf,protein,,hgnc:11892,hgnc,11892,,,positive,i,activation,,,,,,0.65,nan,"apc = antigen presenting cell; btla = b and t lymphocyte attenuator; ctla-4 = cytotoxic t lymphocyte associated antigen-4; dc = dendritic cell; foxp3 = forkhead box p3; gitr = glucocorticoid induced tumor necrosis factor receptor; icos = inducible costimulatory molecule; ido = indoleamine 2,3-dioxygenase; il = interleukin; tcr = t cell receptor; th = t helper; t reg = regulatory t. competing interests.",pmc546290,1,10,5,1,15
2645,amh,protein,,hgnc:464,hgnc,464,,,pdpk1,protein,,hgnc:8816,hgnc,8816,,,positive,i,activation,,,,,,0.65,nan,"we employed further small molecule inhibitors to validate the three additional mis targets pdk1, crm1 and cdk4/6.",pmc3466406,1,10,5,1,15
2634,amelx,protein,,hgnc:461,hgnc,461,,,angpt1,protein,,hgnc:484,hgnc,484,,,negative,i,inhibition,,,,,,0.65,nan,"amg 386 inhibits the interactions of angiopoietin 1 (ang-1) and ang-2 with their receptor, tie2, thereby affecting angiogenesis.",pmc3759200,1,10,5,1,15
2234,akt1,protein,,hgnc:391,hgnc,391,,,mtor,protein,,hgnc:3942,hgnc,3942,,,positive,i,activation,,,,,,0.65,nan,"akt1 independent activation of mtor has been reported in several cell types, including b-lymphocyte cell lines [xref_bibr] and follicular lymphoma cells [xref_bibr].",pmc4358942,1,10,5,1,15
2232,akt1,protein,,hgnc:391,hgnc,391,,,mdm2,protein,,hgnc:6973,hgnc,6973,,,positive,i,activation,,,,,,0.65,nan,activation of akt1 can induce mdm2 mediated degradation of p53 and may thereby suppress p53 dependent effects on tumor formation.,pmc2405818,1,10,5,1,15
1750,ahr,protein,,hgnc:348,hgnc,348,,,abcg2,protein,,hgnc:74,hgnc,74,,,positive,i,increaseamount,,,,,,0.65,nan,"it has been reported that progesterone 38 and aryl hydrocarbon receptor 39 upregulate abcg2 expression, whilst dna methylation represses abcg2 expression in human renal carcinoma, 41 and in multiple myleoma cell lines.",pmc4670919,1,10,5,1,15
13714,egf,protein,,hgnc:3229,hgnc,3229,,,ifng,protein,,hgnc:5438,hgnc,5438,,,positive,i,activation,,,,,,0.65,nan,"egf does not further increase wound healing upon kcnn4 inhibition, but completely abrogates the reversing effect of ifn-gamma pretreatment on kcnn4 dependent wound closure.",pmc4732808,1,10,5,1,15
13798,egf,protein,,hgnc:3229,hgnc,3229,,,tert,protein,,hgnc:11730,hgnc,11730,,,positive,i,activation,,,,,,0.65,nan,it has recently been reported that epidermal growth factor (egf)-mediated activation of telomerase activity in lung cancer is associated with direct binding of ets-2 to the htert promoter [xref_bibr].,pmc4915101,1,10,5,1,15
20061,hmgb1,protein,,hgnc:4983,hgnc,4983,,,rps6kb1,protein,,hgnc:10436,hgnc,10436,,,positive,i,activation,,,,,,0.65,nan,"in particular, on monocyte derived immature dcs, hmgb1 upregulates specific maturation markers (cd80, cd83, cd86, and hla-i), enhances the production of cytokines (il-6, cxcl8, il-12 p70, and tnf-alpha), switches their chemokine responsiveness from ccl5 sensitive to ccl21 sensitive, and induces the cell capacity to stimulate allogeneic t cell proliferation [xref_bibr].",pmc4880686,1,10,5,1,15
18090,glucose,chemical,,,chebi,chebi:17234,,,pten,protein,,hgnc:9588,hgnc,9588,,,positive,i,increaseamount,,,,,,0.65,nan,pten expression was increased in pten mutant but decreased in p53-mutant cell lines by glucose starvation.,pmc4734611,1,10,5,1,15
22556,il1b,protein,,hgnc:5992,hgnc,5992,,,tnf,protein,,hgnc:11892,hgnc,11892,,,positive,i,activation,,,,,,0.65,nan,"il-1beta induces the expression of several pro metastatic and pro angiogenic proteins, among them vegfa, mmps, tnfalpha, and notably tgf-beta1 [xref_bibr].",pmc4556693,1,10,5,1,15
22554,il1b,protein,,hgnc:5992,hgnc,5992,,,tgfb1,protein,,hgnc:11766,hgnc,11766,,,positive,i,activation,,,,,,0.65,nan,"il-1beta induces the expression of several pro metastatic and pro angiogenic proteins, among them vegfa, mmps, tnfalpha, and notably tgf-beta1 [xref_bibr].",pmc4556693,1,10,5,1,15
22481,il1b,protein,,hgnc:5992,hgnc,5992,,,amd1,protein,,hgnc:457,hgnc,457,,,positive,i,activation,,,,,,0.65,nan,"therefore, it is important to determine the mechanisms by which inflammasomes in rpe cells directly or indirectly modulate il-1beta activity that may lead to amd.",pmc3676958,1,10,5,1,15
963,abcg2,protein,,hgnc:74,hgnc,74,,,abcg2,protein,,hgnc:74,hgnc,74,,,positive,i,activation,,,,,,0.65,nan,"in a human placenta cell line, e2 signaled through erbeta to up-regulate bcrp [xref_bibr]; and anika m s hartz et al. found that e2 signals through erbeta, pten/pi3k/akt/gsk3 to down-regulate the expression of bcrp [xref_bibr].",pmc3191358,1,10,5,1,15
21811,igf1,protein,,hgnc:5464,hgnc,5464,,,mtor,protein,,hgnc:3942,hgnc,3942,,,positive,i,activation,,,,,,0.65,nan,"however, growth factors, e.g., igf1 and insulin have also been shown to activate mtor signaling (via pi3k and akt), and dr has been shown to reduce circulating levels of igf-1 and insulin in rodents.",pmc3989927,1,10,5,1,15
21759,igf1,protein,,hgnc:5464,hgnc,5464,,,bcl2,protein,,hgnc:990,hgnc,990,,,positive,i,activation,,,,,,0.65,nan,induction of bcl-2 promoter activity by igf-1 occurs via a pkb and akt pathway involving the cyclic amp response element binding protein transcription factor.,pmc4090725,1,10,5,1,15
20396,hras,protein,,hgnc:5173,hgnc,5173,,,egfr,protein,,hgnc:3236,hgnc,3236,,,positive,i,activation,,,,,,0.65,nan,"8 therefore, accumulative evidence suggests that an increase in the egfr gene copy number and dysregulation of downstream egfr signaling pathway modulators, such as braf, hras, nras, pi3k and akt and pten, are also important factors when determining tumor sensitivity to egfr antibodies.",pmc4785572,1,10,5,1,15
20290,hoxa9,protein,,hgnc:5109,hgnc,5109,,,brca1,protein,,hgnc:1100,hgnc,1100,,,positive,i,increaseamount,,,,,,0.65,nan,"hoxa9 directly regulates brca1 expression, restricts breast tumor aggression and therefore elevated hoxa9 expression level can be correlated with optimistic prognosis for the patient xref_bibr.",pmc3741270,1,10,5,1,15
49024,tsc2,protein,,hgnc:12363,hgnc,12363,,,rac1,protein,,hgnc:9801,hgnc,9801,,,positive,i,activation,,,,,,0.8775000000000001,nan,"previous studies showed that pkcβii is required for tpa‐induced ros production in myeloid leukemia cells. xref another study showed that pkcβii mediated invasion that its plays, suggesting a major role in the promotion of colon carcinogenesis. xref in addition, a previous study showed that mutations in tsc2 activates rac1 and increases ros production. xref another study showed that tsc2 responds to ros at the peroxisome and identified that peroxisomes are signal organelles involved in mtor regulation. xref our tuberin‐null cells treated with pkc inhibitor showed significant decreases in protein expression of nox1, nox2, and nox4 compared to non‐treated cells, suggesting the deficiency in tuberin resulted in increased pkc activity and led to accumulation of nox protein.",pmc4982584,1,10,5,1,15
