index,Regulator Name,Regulator Type,Regulator Subtype,Regulator HGNC Symbol,Regulator Database,Regulator ID,Regulator Compartment,Regulator Compartment ID,Regulated Name,Regulated Type,Regulated Subtype,Regulated HGNC Symbol,Regulated Database,Regulated ID,Regulated Compartment,Regulated Compartment ID,Sign,Connection Type,Mechanism,Site,Cell Line,Cell Type,Tissue Type,Organism,Score,Source,Statements,Paper IDs,Evidence Score,Match Score,Kind Score,Epistemic Value,Total Score
124,akt,protein family|protein complex,,,,akt,,,caspase-9,protein,,,uniprot,p55211,,,negative,i,none,,,,,,nan,nan,"taken together , these data suggest that akt inhibits activation of caspase-9 and -3 by posttranslational modification of a cytosolic factor downstream of cytochrome c and before activation of caspase-9 .",pmc2185587,1,10,19,1,29
118,akt,protein family|protein complex,,,,akt,,,bcl-2,protein,,,uniprot,p10415,,,negative,i,none,,,,,,nan,nan,"we therefore explored the possibility that akt may inhibit apoptosis in hmn1 cells by regulating the expression levels of three key members of the bcl-2 family : bcl-2 , bcl-x , and bax .",pmc2185587,1,10,19,1,29
111,akt,protein family|protein complex,,,,akt,,,arf,protein,,,uniprot,q8n726,,,positive,i,transcription,,,,,,nan,nan,"interestingly , akt has been demonstrated to increase arf transcription by relieving bmi1 repression of arf transcription [ xref_bibr ] and therefore provides a potent mechanism to stabilize p53 mut via the elevated transcription and nucleoplasmic localization of arf .",pmc4171619,1,10,19,1,29
110,akt,protein family|protein complex,,,,akt,,,apoptosis,biological process,,,go,go:0006915,,,negative,i,none,,cellosaurus:cvcl_0152 ++++ cellosaurus:cvcl_0480,,,,nan,nan,"since inhibition of pi3k and akt and mek and erk pathways synergistically induces apoptosis in pancreatic cancer cells , we next sought to examine whether inhibition of these two pathways act together to regulate foxo activity . ++++ pi3k and akt pathway has been shown to inhibit apoptosis . ++++ the inhibition of pi3k and akt and mek and erk pathways induced foxo transcriptional activity and apoptosis . ++++ akt inhibitor ( akt inh-iv ) and mek1/2 inhibitor ( pd98059 ) alone induced apoptosis in both panc-1 and aspc-1 cells ( xref_fig ) . ++++ since inhibition of pi3k and akt and mek and erk pathways together induce apoptosis in an additive or synergistic manner , we sought to examine whether these pathways act together to regulate resveratrol induced apoptosis . ++++ the inhibition of pi3k and akt and mek and erk pathways induced foxo transcriptional activity and apoptosis .",pmc3181262,1,10,19,1,29
109,akt,protein family|protein complex,,,,akt,,,apoptosis,biological process,,,go,go:0006915,,,negative,i,none,,cellosaurus:cvcl_0152,,,,nan,nan,"inhibition of pi3k and akt and mek and erk pathways synergistically and additively induces foxo transcriptional activity and apoptosis in the presence or absence of sulforaphane . ++++ since inhibition of pi3k and akt and mek and erk pathways induce apoptosis in pancreatic cancer cells , we sought to examine whether these pathways act together to regulate sfn induced apoptosis . ++++ since inhibition of pi3k and akt and mek and erk pathways synergistically and additively induces apoptosis in pancreatic cancer cells , we sought to examine whether inhibition of these two pathways act together to regulate foxo activity .",pmc2915986,1,10,19,1,29
1056,cdkn2a,protein,,,,p42771,other,go:0005654,mdm2,protein,,,uniprot,q00987,other,go:0005654,negative,i,none,,,,,,nan,nan,"this supports previous data on akt mediated targeting of mdm2 and our current observations , as akt can promote either negative or positive regulation of p53 depending on the presence of arf and its ability to restrict mdm2 activity in the nucleoplasm ( xref_supplementary ) .",pmc4171619,1,10,19,1,29
682,bcl-2,protein,,,,p10415,,,autophagy,biological process,,,go,go:0006914,,,positive,i,none,,,,,,nan,nan,"therefore , anti-survival bh3-only bcl-2 family proteins can activate autophagy through freeing beclin-1 .",pmc4294377,1,10,19,1,29
2581,insulin,protein,,,,p01308,,,akt,protein family|protein complex,,,be,akt,,,negative,i,phosphorylation,,,,,uberon:uberon:0000105,nan,nan,"two active-site inhibitors of mtor , pp242 and pp30 , which inhibit insulin stimulated phosphorylation of akt at ser473 , were reported as having potent inhibitory effects on protein synthesis and cell proliferation [ xref_bibr ] .",pmc3291999,1,10,19,1,29
2167,glucose,chemical,,,,hmdb06564,,,autophagy,biological process,,,go,go:0006914,,,positive,i,none,,,,,,nan,nan,"although pfk-15 and 3-po , two inhibitors of pfkfb3 , 26 decreased the magnitude of autophagy and increased the rasfonin induced cleavage of parp-1 , the inhibition of glucose uptake by 2-deoxyglucose ( 2-dg ) or glucose-free medium reduces both rasfonin dependent autophagy and apoptosis .",pmc4720880,1,10,19,1,29
1602,egfr,protein,,,,p00533,other,go:0042641,rac1,protein,,,uniprot,p63000,other,go:0042641,positive,i,none,,,,,,nan,nan,"egfr signaling is known to activate rac1 [ xref_bibr ] , which also regulates actomyosin contractility and cell shape , thus egfr activated rac1 may not only support pdgfr inhibitor-iv induced cell rounding but also stat3 nuclear import . ++++ egfr signaling is known to activate rac1 [ xref_bibr ] , which also regulates actomyosin contractility and cell shape , thus egfr activated rac1 may not only support pdgfr inhibitor-iv induced cell rounding but also stat3 nuclear import .",pmc3537888,1,10,19,1,29
1600,egfr,protein,,,,p00533,other,go:0016020,src,protein family|protein complex,,,be,src,other,go:0016020,positive,i,none,,,,,,nan,nan,"in the model , these kinases are linked to src activity , which is differently stimulated by egfr or ir . ++++ importantly in the model , src is strongly activated by egfr and more weakly by ir .",pmc2683723,1,10,19,1,29
1594,egfr,protein,,,,p00533,,,src,protein family|protein complex,,,be,src,,,positive,i,none,,cellosaurus:cvcl_0045,,,,nan,nan,"considering a substantial src contribution to gab1 phosphorylation under various conditions , the model explains this observation by the fact that src is preferably activated by egfr and not by ir .",pmc2683723,1,10,19,1,29
1593,egfr,protein,,,,p00533,,,src,protein family|protein complex,,,be,src,,,positive,i,generic_event,,cellosaurus:cvcl_5594,,,,nan,nan,"crosstalk of met with the src and egfr signaling pathway has also been demonstrated in bladder carcinoma cells , in which serum independent growth of the cells requires the activation of egfr and src , which leads to the phosphorylation of met on y1003 [ xref_bibr ] .",pmc3709701,1,10,19,1,29
2524,igf-1,protein,,,,p05019,,,pp2a,protein,,,uniprot,p67775,,,negative,i,none,,cellosaurus:cvcl_0041,,,,nan,nan,"furthermore , we found that igf-1 decreased the activity of pp2a , which was prevented by rapamycin ( xref_fig ) . ++++ igf-1 stimulation of mtor represses pp2a , resulting in activation of erk1/2 and this is prevented by rapamycin .",pmc2868031,1,10,19,1,29
1569,egf,protein,,,,p01133,other,go:0016020,pkb,protein,,,uniprot,p31749,other,go:0016020,positive,i,none,,uaz:cvcl_9115,,,,nan,nan,"in control tsc2 +/+ mouse embryo fibroblasts ( mefs ) or tsc2 -/- mefs in which wild-type tsc2 has been reintroduced , pkb is activated by insulin , igf-1 , and egf ( xref_fig a ) . ++++ in contrast , in tsc2 -/- mefs or tsc2 -/- mefs in which a pathogenic tsc2 mutant is reintroduced , pkb is activated strongly only by egf .",pmc2172316,1,10,19,1,29
1567,egf,protein,,,,p01133,other,go:0016020,mapk,protein family|protein complex,,,be,erk,other,go:0016020,positive,i,none,,cellosaurus:cvcl_3772 ++++ cellosaurus:cvcl_0045,,,,nan,nan,"the simulations show that for egf plus insulin stimulation , the peak level of phospho-erk decreases only slightly with gab1 depletion , whereas for egf induced erk activation , the peak level decreases significantly ( xref_fig , right panel ) . ++++ there is evidence that insulin can enhance egf stimulated extracellular signal regulated kinase ( erk ) activation , dna synthesis , and cell proliferation responses , whereas growth factors , cytokines , and other hormones can negatively regulate insulin signaling . ++++ both the experimental data and simulations showed that the activation of the ras and erk and pi3k and akt pathways by persistent egf or insulin stimulation was transient ( xref_fig and xref_supplementary ) . ++++ an alternative pathway of pip 3 -dependent erk activation involves phosphoinositide dependent kinase-1 ( pdk1 ) , a target of pi3k , which can activate mek directly and erk indirectly through the activation of certain pkc isoforms , although it has been reported that pkcs are not involved in egf induced erk activation . ++++ we show that , although in hek293 cells insulin by itself is a poor activator of erk , it greatly enhances mapk pathway activation by physiological egf concentrations .",pmc2683723,1,10,19,1,29
2532,igf-1,protein,,,,p05019,other,go:0016020,pkb,protein,,,uniprot,p31749,other,go:0016020,positive,i,none,,uaz:cvcl_9115,,,,nan,nan,"in control tsc2 +/+ mouse embryo fibroblasts ( mefs ) or tsc2 -/- mefs in which wild-type tsc2 has been reintroduced , pkb is activated by insulin , igf-1 , and egf ( xref_fig a ) .",pmc2172316,1,10,19,1,29
1523,egf,protein,,,,p01133,,,akt,protein family|protein complex,,,be,akt,,,negative,i,phosphorylation,,cellosaurus:cvcl_w886,,,,nan,nan,"conversely , depletion of mig6 in wm1366 cells led to an increase in egf induced phosphorylation of egfr , akt and erk1/2 that was most evident 30 to 120 min following stimulation ( xref_fig ) .",pmc4789776,1,10,19,1,29
1522,egf,protein,,,,p01133,,,akt,protein family|protein complex,,,be,akt,,,negative,i,none,,,,,,nan,nan,we identified a role for mig6 as a negative regulator of egf induced akt and erk1/2 signaling and cell migration and invasion in mutant nras melanoma .,pmc4789776,1,10,19,1,29
2533,igf-1r,protein,,,,p08069,,,apoptosis,biological process,,,go,go:0006915,,,negative,i,none,,,,,,nan,nan,recent work has shown that the igf-1r suppresses apoptosis by signaling through pi3k and akt [ xref_bibr ] .,pmc149420,1,10,19,1,29
2542,igf1,protein,,,,p05019,,,apoptosis,biological process,,,go,go:0006915,,,negative,i,none,,,,,,nan,nan,"in addition , rapalogs incompletely inhibit the 4e-bp1 phosphorylation [ xref_bibr ] and do not induce apoptosis in cancer cells [ xref_bibr ] because the igf1 pathway inhibits apoptosis [ xref_bibr ] .",pmc3750018,1,10,19,1,29
2166,glucose,chemical,,,,hmdb06564,,,apoptosis,biological process,,,go,go:0006915,,,positive,i,none,,,,,,nan,nan,"although pfk-15 and 3-po , two inhibitors of pfkfb3 , 26 decreased the magnitude of autophagy and increased the rasfonin induced cleavage of parp-1 , the inhibition of glucose uptake by 2-deoxyglucose ( 2-dg ) or glucose-free medium reduces both rasfonin dependent autophagy and apoptosis .",pmc4720880,1,10,19,1,29
2623,insulin,protein,,,,p01308,other,go:0005694,pi3k,protein family|protein complex,,,be,pi3k,other,go:0005694,negative,i,none,,,,,,nan,nan,it was demonstrated that over-expression of pten reduced insulin induced pip 3 production in human cells without effecting insulin induced pi3k [ xref_bibr ] .,pmc2652403,1,10,19,1,29
2624,insulin,protein,,,,p01308,other,go:0009986,egfr,protein,,,uniprot,p00533,other,go:0009986,positive,i,none,,cellosaurus:cvcl_0045,,,,nan,nan,"insulin also promotes the transactivation of egfr , involving the phosphorylation of y845 and y1173 , but not y1045 , in rat perfused liver or primary hepatocytes [ xref_bibr ] .",pmc3709701,1,10,19,1,29
2625,insulin,protein,,,,p01308,other,go:0016020,akt,protein family|protein complex,,,be,akt,other,go:0016020,positive,i,none,,cellosaurus:cvcl_0045,,,,nan,nan,"both the experimental data and simulations showed that the activation of the ras and erk and pi3k and akt pathways by persistent egf or insulin stimulation was transient ( xref_fig and xref_supplementary ) . ++++ although a higher akt activation by insulin than by egf may contribute to additional raf inhibition , our data suggest that this inhibition is insignificant in hek293 cells ( xref_supplementary ) .",pmc2683723,1,10,19,1,29
2626,insulin,protein,,,,p01308,other,go:0016020,akt,protein family|protein complex,,,be,akt,other,go:0016020,positive,i,phosphorylation,,,,,,nan,nan,"in hmn1 cells , pd 98059 blocked serum stimulated erk phosphorylation at threonine-202 and tyrosine-204 , indicating effective inhibition of mek1 , and ly 294002 blocked serum- and insulin stimulated akt phosphorylation at serine 473 , indicating effective inhibition of pi 3-kinase ( xref_fig a ) .",pmc2185587,1,10,19,1,29
1163,chk2,protein,,,,o96017,other,sl-0276,proliferation,biological process,,,go,go:0008283,other,sl-0276,positive,i,none,,uaz:cvcl_9115,cl:cl:0000646,,,nan,nan,chk2 deficiency reduces p53 induction and increases proliferation of the skin of k5cre trf1 delta and delta chk2 -/- newborns .,pmc4331747,1,10,19,1,29
2627,insulin,protein,,,,p01308,other,go:0016020,mapk,protein family|protein complex,,,be,erk,other,go:0016020,positive,i,none,,cellosaurus:cvcl_0045,,,,nan,nan,"insulin potentiates mapk responses to physiological egf concentrations . ++++ the data presented in xref_fig ( middle panel ) validate the model prediction and also show that insulin is unable to enhance mek and erk when pi3k is inhibited ( xref_fig , all panels ) . ++++ in hek293 cells , insulin is a poor activator of the ras and erk ( extracellular signal regulated kinase ) cascade , yet it enhances erk activation by low egf doses . ++++ in hek293 cells , insulin is a poor activator of the ras and erk ( extracellular signal regulated kinase ) cascade , yet it enhances erk activation by low egf doses . ++++ we show that , although in hek293 cells insulin by itself is a poor activator of erk , it greatly enhances mapk pathway activation by physiological egf concentrations . ++++ the simulated erk dynamics in cells with different gab1 expression ( xref_fig ) suggest that insulin significantly increases robustness of erk activation to gab1 downregulation . ++++ both the experimental data and simulations showed that the activation of the ras and erk and pi3k and akt pathways by persistent egf or insulin stimulation was transient ( xref_fig and xref_supplementary ) . ++++ we show that , although in hek293 cells insulin by itself is a poor activator of erk , it greatly enhances mapk pathway activation by physiological egf concentrations .",pmc2683723,1,10,19,1,29
2630,insulin,protein,,,,p01308,other,go:0016020,pkb,protein,,,uniprot,p31749,other,go:0016020,positive,i,none,,uaz:cvcl_9115,,,,nan,nan,"in control tsc2 +/+ mouse embryo fibroblasts ( mefs ) or tsc2 -/- mefs in which wild-type tsc2 has been reintroduced , pkb is activated by insulin , igf-1 , and egf ( xref_fig a ) .",pmc2172316,1,10,19,1,29
1140,chk2,protein,,,,o96017,,,ros,chemical,,,chebi,chebi:26523,,,negative,i,none,,cellosaurus:cvcl_0428,,,,nan,nan,it remains largely unknown how chk2 inhibition increases ros production induced by dna damaging agents such as gem .,pmc4159025,1,10,19,1,29
2631,insulin,protein,,,,p01308,other,go:0038201,mtorc1,protein family|protein complex,,,be,mtorc1,other,go:0038201,positive,i,none,,,,,,nan,nan,"mtorc1 is activated by nutrients ( amino acids ) , anabolic growth factors ( e.g. , insulin and insulin like growth factor ) , and cellular energy ( atp ) xref_bibr - xref_bibr .",pmc2075366,1,10,19,1,29
2651,integrin,protein,,,,p08648,other,go:0001726,pi3k,protein family|protein complex,,,be,pi3k,other,go:0001726,positive,i,none,,,,,,nan,nan,integrin mediated activation of pi3k was shown to promote carcinoma invasion by targeting rac [ xref_bibr ] .,pmc2652403,1,10,19,1,29
2684,irs-1,protein,,,,p35568,,,akt,protein family|protein complex,,,be,akt,,,negative,i,none,,cellosaurus:cvcl_8262,,,,nan,nan,"these data suggest that downregulation of irs-1 is involved in the ability of alpha-tea to suppress akt , erk , and mtor signalling and demonstrated that jnk is involved in this event via phosphorylation of irs-1 at ser 307 , leading to its degradation .",pmc3039802,1,10,19,1,29
5220,src,protein family|protein complex,,,,src,,,src,protein family|protein complex,,,be,src,,,positive,i,generic_event,,cellosaurus:cvcl_5594 ++++ cellosaurus:cvcl_s979,cl:cl:0000575 ++++ cl:cl:2000042,,,nan,nan,"crosstalk of met with the src and egfr signaling pathway has also been demonstrated in bladder carcinoma cells , in which serum independent growth of the cells requires the activation of egfr and src , which leads to the phosphorylation of met on y1003 [ xref_bibr ] . ++++ another kind of environmental pollutant , hexachlorobenzene , has also been shown to promote src activation and y845 phosphorylation of egfr , which leads to the activation of stat5b and the erk and mapk pathways and cell migration [ xref_bibr , xref_bibr ] . ++++ the cytotoxicity of arsenic trioxide in keratinocytes involves nadph oxidase and p67 phox -mediated production of ros , which is under the control of src activation and y845 phosphorylation of egfr [ xref_bibr ] . ++++ for example , in sum229 breast cancer cells , src activation and y845 phosphorylation of egfr depend upon the activity of met , as judged by the effects of the met specific activator ( hgf ) and inhibitors ( su11274 ) .",pmc3709701,1,10,18,1,28
105,akt,protein family|protein complex,,,,akt,,,akt,protein family|protein complex,,,be,akt,,,negative,i,phosphorylation,,,,,,nan,nan,"conversely , when we activated akt in crc cells using constitutively activated akt constructs prior to selenite treatment , we found that , consistent with our hypothesis , constitutively activated akt increased phosphorylation of akt and foxo3a and selenite could no longer reduce phosphorylation of akt and consequently phosphorylation of foxo3a ( xref_fig ) .",pmc3734838,1,10,18,1,28
1085,chk1,protein,,,,o14757,,,chk1,protein,,,uniprot,o14757,,,positive,i,phosphorylation,,,,,,nan,nan,"rapamycin had no effect on early etoposide induced chk1 phosphorylation and protein level as compared with pp242 , suggesting that mtorc1 activity was dispensable for dna damage mediated regulation of chk1 .",pmc4381605,1,10,18,1,28
4295,pten,protein,,,,p60484.m,,,pten,protein,,,uniprot,p60484,,,positive,i,transcription,,,cl:cl:0000037,,,nan,nan,pten promoter methylation leads to low pten expression [ xref_bibr ] .,pmc3660063,1,10,18,1,28
1116,chk2,protein,,,,o96017,,,chk2,protein,,,uniprot,o96017,,,negative,i,amount,,cellosaurus:cvcl_0428,,,,nan,nan,knockdown of chk2 by chk2 specific sirna completely reduced the level of chk2 in mia paca-2 cells ( xref_fig a ) .,pmc4159025,1,10,18,1,28
1170,chk2,protein,,,,o96017.t,,,chk2,protein,,,uniprot,o96017,,,positive,i,transcription,,cellosaurus:cvcl_0042,,,,nan,nan,"to verify the specificity of these events , we transfected u2os-ccar2-/- cells with vectors encoding ccar2 wt , ccar2 t454a , flag-chk2 wt and flag-chk2 kd ( kinase dead , a catalytically inactive mutant ) and , after etoposide treatment , we found that expression of ccar2 ( both the wild type and , to a lesser extent , the t454a mutant ) and wild type chk2 restores kap1-s473 phosphorylation , but not the expression of chk2 kd , indicating that the defective kap1 phosphorylation on s473 is caused by ccar2 deficiency which in turn affects chk2 activity .",pmc4627348,1,10,18,1,28
1117,chk2,protein,,,,o96017,,,chk2,protein,,,uniprot,o96017,,,negative,i,transcription,,cellosaurus:cvcl_0045,,,,nan,nan,inhibition of chk2 expression by antisense chk2 and hcds1 ( chk2as ) reduced dna damage-induce s and g2 checkpoints and facilitated apoptosis in human embryonic kidney 293 cells ( hek293 ) in a p53 independent manner [ xref_bibr ] .,pmc4159025,1,10,18,1,28
982,cdk4,protein,,,,p11802,,,cdk4,protein,,,uniprot,p11802,,,positive,d,phosphorylation,,,,,,nan,nan,cdk4 was not phosphorylated by recombinant cdk2 and cdk4 complexes in these experiments ( not shown ) .,pmc3667761,1,10,18,1,28
981,cdk4,protein,,,,p11802,,,cdk4,protein,,,uniprot,p11802,,,positive,d,phosphorylation,,cellosaurus:cvcl_0291,,,,nan,nan,"the model depicted in xref_fig assembles our main observations : cdk7 is required for cdk4 activation in vivo , but this requirement is conditioned by cdk4 binding to p21 , and other cdk4 activating kinases must exist to phosphorylate p21-unbound cdk4 during cdk7 inhibition .",pmc3667761,1,10,18,1,28
883,caspase-9,protein,,,,p55211,,,caspase-7,protein,,,uniprot,p55210,,,positive,i,none,,cellosaurus:cvcl_0063,,,,nan,nan,the presence of caspase-9 protein activated caspase-7 to a higher level than in its absence .,pmc4040661,1,10,18,1,28
1149,chk2,protein,,,,o96017,other,go:0005634 ++++ go:go:0005813,chk2,protein,,,uniprot,o96017,other,go:0005634 ++++ go:go:0005813,positive,d,autophosphorylation,,,,,,nan,nan,"dimerization promotes chk2 autophosphorylation of the kinase domain at residues s260 and t432 , the t-loop residues t383 and t387 , and s516 , triggering an additional conformational change and dissociation of the dimers into fully active monomers . ++++ chk2 autophosphorylation seems to also be regulated by pml protein , a tumor suppressor implicated in acute promyelocytic leukemia and a main component of pml-nuclear bodies ( pml-nbs ) , which are nuclear matrix associated structures .",pmc4296918,1,10,18,1,28
1155,chk2,protein,,,,o96017,other,go:0005813,chk2,protein,,,uniprot,o96017,other,go:0005813,positive,d,autophosphorylation,,,,,,nan,nan,"another study reported that chk2 autophosphorylates on ser379 , an event that facilitates chk2 ubiquitinylation by an e3 ligase complex containing cullin 1 .",pmc4296918,1,10,18,1,28
383,akt1,protein,,,,p31749,plasma membrane,go:0005886,akt,protein family|protein complex,,,be,akt,plasma membrane,go:0005886,positive,i,none,,,,,,nan,nan,"in cd133 + hcc cscs , akt inhibition by a akt1 specific inhibitor lowered drug-resistance to both doxorubicin and fluouracil , possibly through a mechanism involving bad phosphorylation and bcl-2 expression [ xref_bibr ] .",pmc3837323,1,10,18,1,28
313,akt,protein family|protein complex,,,,akt,other,go:0005829,akt,protein family|protein complex,,,be,akt,plasma membrane,go:0005886,positive,i,none,,,,,,nan,nan,"the recruitment of akt from the cytosol to the plasma membrane requires binding to ptdins-3 ,4-bisphosphate ( ptdins 3,4 p2 ) and ptdins-3-4 ,5-trisphosphate ( ptdins 3,4,5 p3 ) in the membrane through the ph domain within the n-terminus of akt .",pmc3837323,1,10,18,1,28
372,akt1,protein,,,,p31749,,,akt2,protein,,,uniprot,p31751,,,negative,i,none,,,,,,nan,nan,"combinations of alpha-tea+ akt1 or 2 sirna acted cooperatively to induce apoptosis ( xref_fig ) and inhibit pakt ( ser 473 ) and total akt1 and akt2 , respectively , as well as pmtor ( ser 2448 ) , but had no effect on basal levels of perk1/2 , showing that the erk signalling pathway is independent of akt signalling ( xref_fig ) .",pmc3039802,1,10,18,1,28
353,akt,protein family|protein complex,,,,akt.t,,,akt,protein family|protein complex,,,be,akt,,,positive,i,phosphorylation,,,,,,nan,nan,overexpression of exogenous atm and akt in cos cells promotes akt ser473 phosphorylation by insulin or ir and the phosphorylation depends on the pi3k like catalytic domain of atm .,pmc3317191,1,10,18,1,28
352,akt,protein family|protein complex,,,,akt.p@ser 473,other,go:0005694,akt,protein family|protein complex,,,be,akt,other,go:0005694,positive,i,phosphorylation,,,,,,nan,nan,mtorc2 phosphorylates akt on ser 473 that enhances subsequent akt phosphorylation on thr 308 by pdk1 [ xref_bibr ] .,pmc3837323,1,10,18,1,28
348,akt,protein family|protein complex,,,,akt.p,,,akt,protein family|protein complex,,,be,akt,,,negative,i,phosphorylation,,,,,,nan,nan,"conversely , when we activated akt in crc cells using constitutively activated akt constructs prior to selenite treatment , we found that , consistent with our hypothesis , constitutively activated akt increased phosphorylation of akt and foxo3a and selenite could no longer reduce phosphorylation of akt and consequently phosphorylation of foxo3a ( xref_fig ) .",pmc3734838,1,10,18,1,28
1495,dp,protein,,,,p15924:[substitutionmutant],cytoplasm,go:0005737,dp,protein,,,uniprot,p15924,cytoplasm,go:0005737,negative,i,phosphorylation,,,,,,nan,nan,these data support in vitro observations that r2834h dp decreases phosphorylation of dp compared with wt .,pmc4347645,1,10,18,1,28
4284,pten,protein,,,,p60484,,,pten,protein,,,uniprot,p60484,,,positive,i,transcription,,,,,,nan,nan,"additionally , pten expression was upregulated by foxo3a and ( xref_fig and xref_fig ) , and pten activity was enhanced in response to selenite treatment ( xref_fig ) .",pmc3734838,1,10,18,1,28
5644,wnt,protein family|protein complex,,,,wnt,,,wnt,protein family|protein complex,,,be,wnt,,,positive,d,phosphorylation,,,,,,nan,nan,"on activation by wnt , the wnt co-receptor ldl receptor related protein 6 ( lrp6 ) is phosphorylated at multiple conserved intracellular pppspxs motifs by glycogen synthase kinase 3 ( gsk3 ) and casein kinase 1 ( ck1 ) , resulting in recruitment of the scaffolding protein axin to lrp6 .",pmc2654145,1,10,18,1,28
