48,ampk,protein family|protein complex,ampk,nan,nan,nan,nan,nan,nan,nan,nan,nan,nan,lkb1,protein,q15831,nan,nan,i,['nan'],['none'],['pmc3291999'],['ampk is activated by lkb1 ( liver kinase b1 ) that directly phosphorylates the activation loop and increases ampk kinase activity [ xref_bibr ] . ++++ ampk is activated by lkb1 ( liver kinase b1 ) that directly phosphorylates the activation loop and increases ampk kinase activity [ xref_bibr ] .'],1,10.0,10.0,1.0,20.0
424,mek1,protein,q02750,nan,nan,nan,nan,nan,nan,nan,nan,nan,nan,b-raf,protein,p15056,nan,nan,i,['nan'],['phosphorylation'],['pmc1289294'],"['b-raf phosphorylates mek1 and mek2 on ser217 and ser221 , which activates it to dual phosphorylate erks , at thr202 and tyr204 for human erk1 and thr185 and tyr187 for human erk2 [ xref_bibr , xref_bibr ] .']",1,10.0,10.0,1.0,20.0
425,mek1,protein,q02750,nan,nan,nan,nan,nan,nan,nan,nan,nan,nan,raf-1,protein,p04049,nan,nan,i,['nan'],['phosphorylation'],['pmc2409626'],"['this activation is mediated by activated mek1 , which in turn is phosphorylated by raf-1 , and raf-1 is activated by ras ( for reviews see cobb , 1999 ; widmann et al , 1999 ; chang and karin , 2001 ) .']",1,10.0,10.0,1.0,20.0
438,mtor,protein,p42345,nan,nan,nan,nan,nan,nan,nan,nan,nan,nan,akt,protein family|protein complex,akt,nan,nan,i,['nan'],['none'],['pmc3660063'],"['however , upon akt mediated activation of mtor , these latter mrnas are highly and disproportionately translated . ++++ since the loss of pten results in activation of akt , that in turn up-regulates mtor activity , cancer cells deficient in pten are thought to be major targets of mtor inhibitors .']",1,10.0,10.0,1.0,20.0
441,mtor,protein,p42345,nan,nan,nan,nan,nan,nan,nan,nan,nan,nan,mlst8,protein,q9bvc4,nan,nan,i,['nan'],['none'],['pmc2361102'],['gbetal and mlst8 interacts with the mtor kinase domain independently of raptor and potentiates mtor activity .'],1,10.0,10.0,1.0,20.0
445,mtor,protein,p42345,nan,nan,nan,nan,nan,tsc2,protein,p49815,nan,nan,nan,nan,nan,nan,nan,i,['nan'],['none'],['pmc1892639'],"['silencing tsc2 restored the mtor related signal and partially blocked the effect of rosiglitazone on cell growth inhibition . ++++ we found that ppargamma ligands activate tsc2 , which , in turn , inhibits mtor signaling in nsclc cells through ppargamma independent pathways . ++++ we set out to test the hypothesis that ppargamma ligands activate tuberous sclerosis complex-2 ( tsc2 ) , a tumor suppressor gene that inhibits mtor signaling .']",1,10.0,10.0,1.0,20.0
453,mtorc1,protein family|protein complex,mtorc1,nan,nan,nan,nan,nan,nan,nan,nan,nan,nan,mtor,protein,p42345,nan,nan,i,['nan'],['none'],['pmc4258317'],['mtor inhibitors can be broadly grouped into two classes : the allosteric inhibitors of mtorc1 ( rapamycin and rapalogs ) and the mtor kinase inhibitors .'],1,10.0,10.0,1.0,20.0
803,vegf,protein,p15692,nan,nan,nan,nan,nan,nan,nan,nan,nan,nan,egf,protein,p01133,nan,nan,i,['nan'],['none'],['pmc4624070'],"['consistent with our finding , src has been suggested to be involved in p38 activation during egf induced vegf production in pancreatic cancer cells and in lysophosphatidic acid mediated p38 activation .']",1,10.0,10.0,1.0,20.0
