,Element Name,Element Type,Element ID,Location,Location ID,Cell Line,Cell Type,Organism,Positive Reg Name,Positive Reg Type,Positive Reg ID,Positive Reg Location,Positive Reg Location ID,Negative Reg Name,Negative Reg Type,Negative Reg ID,Negative Reg Location,Negative Reg Location ID,Connection Type,Database Name,Mechanism,Paper ID,Evidence,Evidence Score,Match Score,Kind Score,Epistemic Value,Total Score
547,p53,protein,p04637,nan,nan,nan,nan,nan,nan,nan,nan,nan,nan,chk2,protein,o96017,nan,nan,i,"['nan', 'nan', 'nan', 'nan', 'nan', 'nan', 'nan', 'nan']","['phosphorylation', 'phosphorylation', 'phosphorylation', 'phosphorylation', 'none', 'phosphorylation', 'phosphorylation', 'none']","['pmc2817464', 'pmc2817464', 'pmc2817464', 'pmc2954851', 'pmc4296918', 'pmc4296918', 'pmc4296918', 'pmc4331747']","['atm dependent dephosphorylation of p53 at s376 and chk1 and chk2 dependent phosphorylation of p53 at s378 , s366 and t387 generate 14-3-3 binding sites in vivo . ++++ the chk1 and chk2 kinases phosphorylate p53 at s366 , s378 and t387 .', 'the chk1 and chk2 kinases phosphorylate p53 at s366 , s378 and t387 . ++++ atm dependent dephosphorylation of p53 at s376 and chk1 and chk2 dependent phosphorylation of p53 at s378 , s366 and t387 generate 14-3-3 binding sites in vivo .', 'atm dependent dephosphorylation of p53 at s376 and chk1 and chk2 dependent phosphorylation of p53 at s378 , s366 and t387 generate 14-3-3 binding sites in vivo .', 'atm , atr , and dna-pk phosphorylate p53 on s15 , while chk1 and chk2 phosphorylate p53 on s20 which stabilize p53 by preventing binding to mdm2 [ xref_bibr - xref_bibr ] .', 'chk2 can also activate p53 via the phosphorylation of other proteins , such as che-1 , strap , hdmx , as described above , and calcineurin binding protein 1 ( cabin1 ) . ++++ moreover , chk2 induces the removal of oocytes with unrepaired meiotic or induced dsbs by activating p53 and p63 .', 'another mechanism involves the phosphorylation of p53 by atm and chk2 , which stabilizes and activates p53 . ++++ chk2 also phosphorylates p53 to promote p21 accumulation and sustain g2/m arrest . ++++ furthermore it is elusive whether chk2 phosphorylates p53 after this protein is stabilized by atm in response to dsbs or if it phosphorylates a latent p53 fraction that existed before dna damage . ++++ furthermore it is elusive whether chk2 phosphorylates p53 after this protein is stabilized by atm in response to dsbs or if it phosphorylates a latent p53 fraction that existed before dna damage . ++++ it remains unclear today whether chk2 phosphorylates p53 to induce pro survival or pro apoptotic pathways .', 'a study published in 2000 reported that , upon dna damage , chk2 phosphorylates p53 on ser20 .', 'both chk1 and chk2 can activate p53 upon dna damage and are important for cell cycle checkpoints , however , while chk1 is crucial for intra-s and g2/s transition , chk2 is more important for g1/s checkpoint . ++++ altogether , these results demonstrate that chk2 deletion attenuates induction of p53 and p21 as well as rescues proliferative defects in the skin of trf1 delta and delta k5cre mice , which in turn leads to a partial rescue of survival but also to increased tumorigenesis .']",8,10.0,10.0,1.0,90.0
449,mtorc1,protein family|protein complex,mtorc1,nan,nan,nan,nan,nan,nan,nan,nan,nan,nan,akt,protein family|protein complex,akt,nan,nan,i,"['nan', 'nan', 'nan', 'nan', 'nan', 'nan', 'nan', 'nan']","['none', 'none', 'none', 'none', 'phosphorylation', 'phosphorylation', 'none', 'none']","['pmc3291999', 'pmc3660063', 'pmc4102778', 'pmc4216640', 'pmc4216640', 'pmc4216640', 'pmc4258317', 'pmc4720880']","['mtorc1 is activated by the pi3k and akt pathway ( xref_fig ) and inhibited by the tsc1 and tsc2 complex ; it is a major regulator of ribosomal biogenesis and protein synthesis [ xref_bibr ] , through the phosphorylation and activation of s6k , and the phosphorylation and inactivation of the repressor of mrna translation 4ebp1 .', 'akt also phosphorylates pras40 , an inhibitor of mtorc1 , and by doing so , it prevents the ability of pras40 to suppress mtorc1 signalling . ++++ thus , this could be yet another mechanism by which akt activates mtorc1 .', 'thus , this is another mechanism by which akt activates mtorc1 .', 'growth factor stimulated akt promotes mtorc1 activation through two pathways .', 'notably , both constitutively active akt and mtor were able to promote phosphorylation of akt- and mtorc1 activity indicator sites on pras40 ( t246 and s183 , respectively ) .', 'to test this , we generated flag-pras40 plasmids harboring single , non phosphorylatable ser or thr to ala point mutations of all the major identified pras40 phosphorylation sites , including mtorc1 targeted s183 , s212 , and s221 , as well as akt targeted t246 .', 'mtorc1 is activated by the pi3k and akt pathway whereas tsc1-tsc2 ( tuberous sclerosis complex ) inhibits it [ xref_bibr ] .', 'xref_bibr , xref_bibr mtorc2 activates akt ( protein kinase b ) , while pi3k and akt primarily activates mtorc1 .']",8,10.0,10.0,1.0,90.0
414,mdm2,protein,q00987,nan,nan,nan,nan,nan,nan,nan,nan,nan,nan,akt,protein family|protein complex,akt,nan,nan,i,"['nan', 'nan', 'nan', 'nan', 'nan', 'nan']","['none', 'phosphorylation', 'phosphorylation', 'phosphorylation', 'none', 'phosphorylation']","['pmc3317191', 'pmc3317191', 'pmc3317191', 'pmc3317191', 'pmc3325598', 'pmc3325598']","['dominant negative akt inhibits nuclear entry of mdm2 , thus increasing the cellular level of p53 and transcriptional activity [ xref_bibr ] .', 'akt phosphorylation of mdm2 is also necessary for the translocation of mdm2 from the cytoplasm to the nucleus .', 'in response to growth factor stimulation , active akt binds to and phosphorylates mdm2 at ser166 and ser186 to enhance protein stability and facilitate the function of mdm2 to promote p53 ubiquitination [ xref_bibr , xref_bibr ] .', 'in response to growth factor stimulation , active akt binds to and phosphorylates mdm2 at ser166 and ser186 to enhance protein stability and facilitate the function of mdm2 to promote p53 ubiquitination [ xref_bibr , xref_bibr ] .', 'these results are intriguing given that previous reports demonstrate that akt promotes the activity of the e3 ubiquitin ligase mdm2 , the important negative regulator of p53 . ++++ the migration of phospho-ser166-mdm2 was altered , suggesting that akt may promote alternative post-translational modifications of mdm2 . ++++ this was unexpected given that akt has been reported to promote the activity of the e3 ubiquitin ligase mdm2 , the important negative regulator of p53 . ++++ taken together , these results indicate that akt induces dna damage independent p53 stabilisation via arf- and pml independent nucleolar sequestration of mdm2 .', 'our results are in contrast to previous reports that akt phosphorylation of mdm2 promotes its nuclear localisation and enhances mdm2 ubiquitin ligase activity , resulting in p53 destabilisation .']",6,10.0,10.0,1.0,70.0
545,p53,protein,p04637,nan,nan,nan,nan,nan,nan,nan,nan,nan,nan,chk1,protein,o14757,nan,nan,i,"['nan', 'nan', 'nan', 'nan', 'nan']","['phosphorylation', 'phosphorylation', 'phosphorylation', 'phosphorylation', 'none']","['pmc2817464', 'pmc2817464', 'pmc2817464', 'pmc2954851', 'pmc4331747']","['the chk1 and chk2 kinases phosphorylate p53 at s366 , s378 and t387 .', 'the chk1 and chk2 kinases phosphorylate p53 at s366 , s378 and t387 .', 'the chk1 and chk2 kinases phosphorylate p53 at s366 , s378 and t387 .', 'atm , atr , and dna-pk phosphorylate p53 on s15 , while chk1 and chk2 phosphorylate p53 on s20 which stabilize p53 by preventing binding to mdm2 [ xref_bibr - xref_bibr ] .', 'both chk1 and chk2 can activate p53 upon dna damage and are important for cell cycle checkpoints , however , while chk1 is crucial for intra-s and g2/s transition , chk2 is more important for g1/s checkpoint .']",5,10.0,10.0,1.0,60.0
625,pras40,protein,q96b36,nan,nan,nan,nan,nan,nan,nan,nan,nan,nan,mtorc1,protein family|protein complex,mtorc1,nan,nan,i,"['nan', 'nan', 'nan', 'nan', 'nan']","['phosphorylation', 'phosphorylation', 'phosphorylation', 'phosphorylation', 'phosphorylation']","['pmc2075366', 'pmc3660063', 'pmc4102778', 'pmc4216640', 'pmc4258317']","[""the above results suggested that pras40 is phosphorylated by mtorc1 . ++++ we also observed that pras40 associated less well with a kinase dead version of mtor ( xref_fig ) , suggesting that mtorc1 mediated phosphorylation of pras40 ( see below ) may affect the pras40- mtorc1 interaction . ++++ pras40 was phosphorylated weakly by both mtorc1 and mtorc2 . ++++ it remains to be determined whether mtorc1 mediated phosphorylation of pras40 plays a role in pras40 's ability to bind and inhibit mtorc1 . ++++ importantly , we also found that pras40 inhibited mtorc1 autophosphorylation but not mtorc2 autophosphorylation ( xref_fig ) , suggesting that the weak phosphorylation of pras40 by mtorc1 might be due to pras40 mediated inhibition of mtorc1 ."", 'moreover , pras40 is a substrate of mtorc1 itself , and mtorc1 mediated phosphorylation of pras40 prevents inhibition of additional mtorc1 signaling [ xref_bibr - xref_bibr , xref_bibr ] .', 'to complicate matters , pras40 is a substrate of mtorc1 itself , and mtorc1 mediated phosphorylation of pras40 prevents inhibition of additional mtorc1 signaling .', 'interestingly , both akt- and mtorc1 mediated phosphorylation of pras40 are required for 14-3-3 binding in response to growth factors . ++++ our findings indicate that dual phosphorylation of pras40 by akt and mtorc1 promotes formation of a nuclear specific pras40- and rpl11 containing complex distinct from mtorc1 that inhibits the rpl11-hdm2-p53 pathway and thereby suppresses induction of senescence .', 'however , later studies showed that pras40 inhibits mtorc1 activity and is phosphorylated by mtorc1 on s183 when associated with mtorc1 via raptor and this binding is abolished by mutation of the s183 to aspartate [ xref_bibr , xref_bibr ] .']",5,10.0,10.0,1.0,60.0
536,p53,protein,p04637,nan,nan,nan,nan,nan,mdm2,protein,q00987,nan,nan,nan,nan,nan,nan,nan,i,"['nan', 'nan', 'nan']","['ubiquitination', 'none', 'decreaseamount']","['pmc3325598', 'pmc4171619', 'pmc4480747']","['these results indicate that p53 accumulation in akt cells results from both a reduction in mdm2 mediated p53 ubiquitination and degradation , plus enhanced p53 translation .', 'furthermore , our results indicate that p53 mut is degraded by mdm2 as nutlin3a treatment stabilizes protein levels both in the presence and absence of arf , implying that constitutive mdm2 activity in the absence of arf keeps p53 mut levels low . ++++ growing evidence suggests that since mdm2 can mediate degradation of p53 mut in normal tissue [ xref_bibr , xref_bibr ] the stabilization of p53 mut is not due to the lack of transcriptional activation of mdm2 .', 'in all the cell lines mdm2 transcripts were modestly reduced by pd0332991 , possibly reflecting the cdk4 inhibitor induced loss of p53 ( xref_supplementary ) .']",3,10.0,10.0,1.0,40.0
513,p21,protein,p38936,nan,nan,nan,nan,nan,nan,nan,nan,nan,nan,p53,protein,p04637,nan,nan,i,"['nan', 'nan', 'nan']","['transcription', 'none', 'amount']","['pmc3330162', 'pmc3556166', 'pmc3556166']","['predictably , transfection of wild type p53 activated p21 gene transcription , and the observed transactivation was evidently repressed by coexpression of wild type h1 .2 core complex ( xref_fig , p21 , assay 2 versus assay 6 ) .', 'finally , using our novel inducible p68 knockout mouse model , we show that p68 is required for p53 dependent induction of p21 in several , although not all , tissues in response to gamma irradiation and does not appear to be required for induction of pro apoptotic genes .', 'although there was little p53 induction in the liver there was a strong p53 dependent p21 induction in the control mice , which was absent in the mice lacking p68 , underscoring the requirement for p68 and indicating that only low levels of p53 induction are required to induce significant levels of p21 .']",3,10.0,10.0,1.0,40.0
460,mtorc1,protein family|protein complex,mtorc1,nan,nan,nan,nan,nan,tsc2,protein,p49815,nan,nan,nan,nan,nan,nan,nan,i,"['nan', 'nan']","['none', 'none']","['pmc3660063', 'pmc4102778']","[""lkb1 is an upstream activator of 5 ' amp activated protein kinase ( ampk ) which activates tsc2 that negatively regulates mtorc1 [ xref_bibr , xref_bibr ] ."", 'this has a pro proliferative effect as mtorc1 is not suppressed by tsc2 .']",2,10.0,10.0,1.0,30.0
624,pras40,protein,q96b36,nan,nan,nan,nan,nan,nan,nan,nan,nan,nan,akt,protein family|protein complex,akt,nan,nan,i,"['nan', 'nan']","['phosphorylation', 'phosphorylation']","['pmc4102778', 'pmc4216640']","['when pras40 is phosphorylated by akt , it can not suppress mtorc1 signalling [ xref_bibr , xref_bibr , xref_bibr , xref_bibr , xref_bibr - xref_bibr ] .', 'our findings indicate that dual phosphorylation of pras40 by akt and mtorc1 promotes formation of a nuclear specific pras40- and rpl11 containing complex distinct from mtorc1 that inhibits the rpl11-hdm2-p53 pathway and thereby suppresses induction of senescence .']",2,10.0,10.0,1.0,30.0
426,mek2,protein,p36507,nan,nan,nan,nan,nan,nan,nan,nan,nan,nan,b-raf,protein,p15056,nan,nan,i,"['nan', 'nan']","['phosphorylation', 'phosphorylation']","['pmc1289294', 'pmc1289294']","['b-raf phosphorylates mek1 and mek2 on ser217 and ser221 , which activates it to dual phosphorylate erks , at thr202 and tyr204 for human erk1 and thr185 and tyr187 for human erk2 [ xref_bibr , xref_bibr ] .', 'b-raf phosphorylates mek1 and mek2 on ser217 and ser221 , which activates it to dual phosphorylate erks , at thr202 and tyr204 for human erk1 and thr185 and tyr187 for human erk2 [ xref_bibr , xref_bibr ] .']",2,10.0,10.0,1.0,30.0
650,raf,protein family|protein complex,raf,nan,nan,nan,nan,nan,nan,nan,nan,nan,nan,ras,protein family,pf00071,nan,nan,i,"['nan', 'nan']","['none', 'none']","['pmc2683723', 'pmc4525067']","['for instance , the activation of raf by ras includes a conformational change in raf caused by binding to ras-gtp , followed by the dissociation of 14-3-3 protein , dephosphorylation of inhibitory s259 and phosphorylation of activatory s338 sites .', 'oncogenic ras constitutively stimulates the raf , pi3k , and ral gds signaling pathways , leading to cellular transformation . ++++ ras can activate three major pathways , the raf , ralgds , and pi3k pathways , all of which contribute to the fully transformed phenotype of cancer cells .']",2,10.0,10.0,1.0,30.0
653,raf-1,protein,p04049,nan,nan,nan,nan,nan,nan,nan,nan,nan,nan,ras,protein family,pf00071,nan,nan,i,"['nan', 'nan']","['none', 'none']","['pmc2409626', 'pmc2652403']","['this activation is mediated by activated mek1 , which in turn is phosphorylated by raf-1 , and raf-1 is activated by ras ( for reviews see cobb , 1999 ; widmann et al , 1999 ; chang and karin , 2001 ) .', 'in addition , raf-1 activation by ras was shown to be achieved through a combination of both physical interaction and indirect mechanisms involving the activation of pi3k as a second ras effector , which directs p21 activated kinase ( pak )-mediated regulatory phosphorylation of raf-1 [ xref_bibr ] .']",2,10.0,10.0,1.0,30.0
410,mdm2,protein,q00987,nan,nan,nan,nan,nan,arf,protein,q8n726,nan,nan,nan,nan,nan,nan,nan,i,"['nan', 'nan']","['none', 'none']","['pmc4171619', 'pmc4211374']","['arf has been reported to promote p53 stability by sequestering mdm2 to the nucleolus [ xref_bibr , xref_bibr ] , whereas others have reported that nucleoplasmic arf suppresses mdm2 activity [ xref_bibr - xref_bibr , xref_bibr ] . ++++ although arf has long been recognized as an inhibitor of mdm2 [ xref_bibr , xref_bibr ] , debate exists regarding the cellular location and mechanism of arf mediated mdm2 inhibition . ++++ given that arf has been proposed to inhibit mdm2 in the nucleoplasm and nucleolar localization of arf protects it from degradation , a conundrum exists regarding the mechanism that allows npm to restrict arf nucleolar accumulation and thereby allow mdm2 inhibition [ xref_bibr , xref_bibr - xref_bibr ] in this article we identify that akt regulates both arf stability and localization at the nucleolus . ++++ this in turn promotes arf mediated inhibition of mdm2 in the nucleoplasm .', '20 arf is also induced by oncogenic stress and inhibits mdm2 , thereby activating p53 and p21 waf1 and cip1 .']",2,10.0,10.0,1.0,30.0
708,s6k1,protein,p23443,nan,nan,nan,nan,nan,nan,nan,nan,nan,nan,mtor,protein,p42345,nan,nan,i,"['nan', 'nan']","['none', 'phosphorylation']","['pmc2868031', 'pmc4258317']","['recently we have demonstrated that rapamycin inhibits f-action reorganization and cell motility by inhibition of mtor mediated s6k1 and 4e-bp1/eif4e pathways xref_bibr , xref_bibr .', 'mtor kinase phosphorylates s6k1 at t389 which is the hydrophobic motif ( hm ) phosphorylation site [ xref_bibr , xref_bibr ] followed by the pdk1 mediated phosphorylation at t229 present in the activation loop ( al ) which leads to full activation of s6k1 [ xref_bibr ] .']",2,10.0,10.0,1.0,30.0
268,erk,protein family|protein complex,erk,nan,nan,nan,nan,nan,nan,nan,nan,nan,nan,mek,protein family|protein complex,mek,nan,nan,i,"['nan', 'nan']","['none', 'none']","['pmc2169466', 'pmc2683723']","['however , in our system it is unlikely that dephosphorylation of erk is upregulated in suspended cells , as erk activation mediated by active versions of either raf or mek was unaltered in suspension versus adherent conditions .', 'likewise , in the absence of evidence for a distributed mechanism of erk kinase ( mek ) activation by raf , we use a simplified , one-step description , whereas a distributed mechanism of erk activation by mek and deactivation by mkp3 is described as a two-step process .']",2,10.0,10.0,1.0,30.0
709,s6k1,protein,p23443,nan,nan,nan,nan,nan,nan,nan,nan,nan,nan,mtorc1,protein family|protein complex,mtorc1,nan,nan,i,"['nan', 'nan']","['phosphorylation', 'phosphorylation']","['pmc3291999', 'pmc4720880']","['distinct from rapamycin analogues , these molecules block both mtorc1 dependent phosphorylation of s6k1 and mtorc2 dependent phosphorylation of the akt ser473 residue .', 'mtorc1 phosphorylates two main substrates , ribosomal protein s6 kinase 1 ( s6k1 ) and eukaryotic initiation factor 4e binding protein 1 ( 4e-bp1 ) .']",2,10.0,10.0,1.0,30.0
788,tsc2,protein,p49815,nan,nan,nan,nan,nan,nan,nan,nan,nan,nan,ampk,protein family|protein complex,ampk,nan,nan,i,"['nan', 'nan']","['none', 'phosphorylation']","['pmc3660063', 'pmc3837323']","[""lkb1 is an upstream activator of 5 ' amp activated protein kinase ( ampk ) which activates tsc2 that negatively regulates mtorc1 [ xref_bibr , xref_bibr ] ."", 'low energy levels ( high amp : atp ratio ) activate ampk which then phosphorylates tsc2 on ser 1345 .']",2,10.0,10.0,1.0,30.0
656,raptor,protein,q8n122,nan,nan,nan,nan,nan,nan,nan,nan,nan,nan,mtor,protein,p42345,nan,nan,i,['nan'],['phosphorylation'],['pmc4258317'],"[""the phosphorylation status of raptor governs mtorc1 activity since phosphorylation of raptor on s722/792 by 5 ' amp activated kinase ( ampk ) inhibits mtorc1 whereas mtor mediated phosphorylation of raptor on s863 is crucial for the activation of mtorc1 in response to mitogen stimulation [ xref_bibr , xref_bibr ] .""]",1,10.0,10.0,1.0,20.0
639,rac,protein,p31749,nan,nan,nan,nan,nan,nan,nan,nan,nan,nan,pi3k,protein family|protein complex,pi3k,nan,nan,i,['nan'],['none'],['pmc2683723'],"['for instance , pip 3 generated by pi3k enables rac activation .']",1,10.0,10.0,1.0,20.0
668,rela,protein,q04206,nan,nan,nan,nan,nan,nan,nan,nan,nan,nan,akt,protein family|protein complex,akt,nan,nan,i,['nan'],['none'],['pmc1325242'],"['furthermore , akt can activate the transcriptional potential of the p65 and rela subunit of nf-kappab [ xref_bibr , xref_bibr ] , providing a potential link between akt kinase activity and nf-kappab activation .']",1,10.0,10.0,1.0,20.0
600,pi3k,protein family|protein complex,pi3k,nan,nan,nan,nan,nan,nan,nan,nan,nan,nan,rac1,protein,p63000,nan,nan,i,['nan'],['none'],['pmc2652403'],['h-ras and rac1 activate pi3k by targeting the gtpase responsive domain [ xref_bibr ] .'],1,10.0,10.0,1.0,20.0
785,tsc2,protein,p49815,nan,nan,nan,nan,nan,akt,protein family|protein complex,akt,nan,nan,nan,nan,nan,nan,nan,i,['nan'],['none'],['pmc2075366'],"['akt ( also known as pkb ) phosphorylates and inactivates tsc2 in response to growth factors xref_bibr , whereas ampk phosphorylates and activates tsc2 in response to low energy ( high amp ) xref_bibr , xref_bibr .']",1,10.0,10.0,1.0,20.0
794,tuberin,protein,p49815,nan,nan,nan,nan,nan,akt,protein family|protein complex,akt,nan,nan,nan,nan,nan,nan,nan,i,['nan'],['none'],['pmc2652403'],"['akt also inhibited tuberin mediated degradation of p27 ( kip1 ) , thereby promoting cdk2 activity and cellular proliferation [ xref_bibr ] .']",1,10.0,10.0,1.0,20.0
38,akt,protein family|protein complex,akt,nan,nan,nan,nan,nan,pp2a,protein,p67775,nan,nan,nan,nan,nan,nan,nan,i,['nan'],['none'],['pmc3837323'],"['protein phosphatase 2a ( pp2a ) downregulates akt activity directly , by dephosphorylating thr 308 and accumulating evidence indicates that pp2a acts as a tumor suppressor [ xref_bibr ] .']",1,10.0,10.0,1.0,20.0
454,mtorc1,protein family|protein complex,mtorc1,nan,nan,nan,nan,nan,nan,nan,nan,nan,nan,mtorc1,protein family|protein complex,mtorc1,nan,nan,i,['nan'],['autophosphorylation'],['pmc2075366'],"['importantly , we also found that pras40 inhibited mtorc1 autophosphorylation but not mtorc2 autophosphorylation ( xref_fig ) , suggesting that the weak phosphorylation of pras40 by mtorc1 might be due to pras40 mediated inhibition of mtorc1 . ++++ pras40 inhibits mtorc1 autophosphorylation and mtorc1 kinase activity toward eif-4e binding protein ( 4e-bp ) and pras40 itself . ++++ furthermore , pras40 inhibits mtorc1 autophosphorylation and mtorc1 kinase activity toward its substrates 4e-bp and pras40 .']",1,10.0,10.0,1.0,20.0
507,p14 arf,protein,q8n726,nan,nan,nan,nan,nan,nan,nan,nan,nan,nan,e2f-1,protein,q01094,nan,nan,i,['nan'],['none'],['pmc2817464'],"['further , e2f-1 upregulates p14 arf , which negatively regulates mdm2 .']",1,10.0,10.0,1.0,20.0
373,irs-1,protein,p35568,nan,nan,nan,nan,nan,s6k2,protein,q9ubs0,nan,nan,nan,nan,nan,nan,nan,i,['nan'],['none'],['pmc2172316'],['suppression of either s6k1 or s6k2 mimics the effect of rapamycin treatment and restores irs-1 mrna to a level approaching that of tsc2 +/+ mefs ( xref_fig ) .'],1,10.0,10.0,1.0,20.0
68,atm,protein,q13315,nan,nan,nan,nan,nan,nan,nan,nan,nan,nan,erk1,protein,p27361,nan,nan,i,['nan'],['phosphorylation'],['pmc3330700'],"['consistent with erk1/2 being the major , if not the sole targets of mek [ xref_bibr ] , it was recently demonstrated that knockdown of either erk1 or erk2 significantly reduced atm activation ( atm s1981 phosphorylation and the nuclear foci of s1981 phosphorylated atm ) in response to etop , and thereby attenuated phosphorylation of the atm substrates , including the s139 of h2ax ( gammah2ax ) , s15 of p53 , and t68 of chk2 .']",1,10.0,10.0,1.0,20.0
69,atm,protein,q13315,nan,nan,nan,nan,nan,nan,nan,nan,nan,nan,erk2,protein,p28482,nan,nan,i,['nan'],['phosphorylation'],['pmc3330700'],"['consistent with erk1/2 being the major , if not the sole targets of mek [ xref_bibr ] , it was recently demonstrated that knockdown of either erk1 or erk2 significantly reduced atm activation ( atm s1981 phosphorylation and the nuclear foci of s1981 phosphorylated atm ) in response to etop , and thereby attenuated phosphorylation of the atm substrates , including the s139 of h2ax ( gammah2ax ) , s15 of p53 , and t68 of chk2 .']",1,10.0,10.0,1.0,20.0
248,egfr,protein,p00533,nan,nan,nan,nan,nan,nan,nan,nan,nan,nan,egf,protein,p01133,nan,nan,i,['nan'],['none'],['pmc3135566'],"['unlike igf-1r , egfr can be stimulated by numerous egf like factors , which macrophages produce in a tissue and disease specific manner [ xref_bibr , xref_bibr , xref_bibr ] .']",1,10.0,10.0,1.0,20.0
250,egfr,protein,p00533:[substitutionmutant],nan,nan,nan,nan,nan,nan,nan,nan,nan,nan,egf,protein,p01133,nan,nan,i,['nan'],['none'],['pmc2653860'],"['notably , upon long exposure of western blots ( xref_fig ) egf modestly activated of rsk and erk1/2 in b82l cells expressing the y5f egfr .']",1,10.0,10.0,1.0,20.0
345,hif,protein family|protein complex,hif,nan,nan,nan,nan,nan,nan,nan,nan,nan,nan,mtor,protein,p42345,nan,nan,i,['nan'],['none'],['pmc3291999'],"['mtor inhibition seems to downregulate hif , which is frequently overexpressed in rcc , due to loss of function of vhl ( von hippel-lindau ) gene [ xref_bibr , xref_bibr ] .']",1,10.0,10.0,1.0,20.0
372,irs-1,protein,p35568,nan,nan,nan,nan,nan,s6k1,protein,p23443,nan,nan,nan,nan,nan,nan,nan,i,['nan'],['none'],['pmc2172316'],"['this restoration of irs-1 mrna abundance by sustained rapamycin treatment is reversed by actinomycin d ( xref_fig ) , indicating that mtor and s6k1 signaling likely reduces irs-1 mrna abundance primarily at the level of gene transcription . ++++ suppression of either s6k1 or s6k2 mimics the effect of rapamycin treatment and restores irs-1 mrna to a level approaching that of tsc2 +/+ mefs ( xref_fig ) .']",1,10.0,10.0,1.0,20.0
418,mdm2,protein,q00987,nan,nan,nan,nan,nan,p14 arf,protein,q8n726,nan,nan,nan,nan,nan,nan,nan,i,['nan'],['none'],['pmc2817464'],"['further , e2f-1 upregulates p14 arf , which negatively regulates mdm2 .']",1,10.0,10.0,1.0,20.0
