index,Regulator Name,Regulator Type,Regulator Subtype,Regulator HGNC Symbol,Regulator Database,Regulator ID,Regulator Compartment,Regulator Compartment ID,Regulated Name,Regulated Type,Regulated Subtype,Regulated HGNC Symbol,Regulated Database,Regulated ID,Regulated Compartment,Regulated Compartment ID,Sign,Connection Type,Mechanism,Site,Cell Line,Cell Type,Tissue Type,Organism,Score,Source,Statements,Paper IDs,Evidence Score,Match Score,Kind Score,Epistemic Value,Total Score
240,chk1,protein,,,,o14757,,,p53,protein,,,uniprot,p04637,,,positive,d,phosphorylation,,cellosaurus:cvcl_0060,,,,"nan,nan,nan","nan,nan,nan","the chk1 and chk2 kinases phosphorylate p53 at s366 , s378 and t387 .,the chk1 and chk2 kinases phosphorylate p53 at s366 , s378 and t387 .,the chk1 and chk2 kinases phosphorylate p53 at s366 , s378 and t387 .","pmc2817464,pmc2817464,pmc2817464",3,10,10,1,40
257,chk2,protein,,,,o96017,,,p53,protein,,,uniprot,p04637,,,positive,d,phosphorylation,,,,,,"nan,nan,nan","nan,nan,nan","atm dependent dephosphorylation of p53 at s376 and chk1 and chk2 dependent phosphorylation of p53 at s378 , s366 and t387 generate 14-3-3 binding sites in vivo .,atm , atr , and dna-pk phosphorylate p53 on s15 , while chk1 and chk2 phosphorylate p53 on s20 which stabilize p53 by preventing binding to mdm2 [ xref_bibr - xref_bibr ] .,a study published in 2000 reported that , upon dna damage , chk2 phosphorylates p53 on ser20 .","pmc2817464,pmc2954851,pmc4296918",3,10,10,1,40
74,akt,protein family|protein complex,,,,akt,nucleus,go:0005634,mdm2,protein,,,uniprot,q00987,nucleus,go:0005634,positive,d,phosphorylation,,,,,,"nan,nan,nan","nan,nan,nan","akt phosphorylation of mdm2 is also necessary for the translocation of mdm2 from the cytoplasm to the nucleus .,in response to growth factor stimulation , active akt binds to and phosphorylates mdm2 at ser166 and ser186 to enhance protein stability and facilitate the function of mdm2 to promote p53 ubiquitination [ xref_bibr , xref_bibr ] .,in response to growth factor stimulation , active akt binds to and phosphorylates mdm2 at ser166 and ser186 to enhance protein stability and facilitate the function of mdm2 to promote p53 ubiquitination [ xref_bibr , xref_bibr ] .","pmc3317191,pmc3317191,pmc3317191",3,10,8,1,38
256,chk2,protein,,,,o96017,,,p53,protein,,,uniprot,p04637,,,positive,d,phosphorylation,,cellosaurus:cvcl_0060,,,,"nan,nan","nan,nan","atm dependent dephosphorylation of p53 at s376 and chk1 and chk2 dependent phosphorylation of p53 at s378 , s366 and t387 generate 14-3-3 binding sites in vivo . ++++ the chk1 and chk2 kinases phosphorylate p53 at s366 , s378 and t387 .,the chk1 and chk2 kinases phosphorylate p53 at s366 , s378 and t387 . ++++ atm dependent dephosphorylation of p53 at s376 and chk1 and chk2 dependent phosphorylation of p53 at s378 , s366 and t387 generate 14-3-3 binding sites in vivo .","pmc2817464,pmc2817464",2,10,10,1,30
808,rac1,protein,,,,p63000,,,pi3k,protein family|protein complex,,,be,pi3k,,,positive,i,none,,,,,,nan,nan,h-ras and rac1 activate pi3k by targeting the gtpase responsive domain [ xref_bibr ] .,pmc2652403,1,10,10,1,20
615,mtorc1,protein family|protein complex,,,,mtorc1,,,pras40,protein,,,uniprot,q96b36,,,positive,d,phosphorylation,,,,,,nan,nan,"however , later studies showed that pras40 inhibits mtorc1 activity and is phosphorylated by mtorc1 on s183 when associated with mtorc1 via raptor and this binding is abolished by mutation of the s183 to aspartate [ xref_bibr , xref_bibr ] .",pmc4258317,1,10,10,1,20
607,mtorc1,protein family|protein complex,,,,mtorc1,,,akt,protein family|protein complex,,,be,akt,,,negative,i,none,,,,,,nan,nan,"assuming that equilibrium exists between these two complexes , when the mtorc1 complex is formed , it could antagonize the formation of the mtorc2 complex and reduce akt activity [ xref_bibr , xref_bibr ] . ++++ inhibition of mtorc1 signaling by rapamycin and rapalogs removes the previously mentioned negative feedback loop and activates akt through pi3k . ++++ mtorc1 inhibits akt via a negative feedback loop which involves , at least in part , p70s6k [ xref_bibr ] .",pmc3660063,1,10,10,1,20
568,mtor,protein,,,,p42345,,,akt,protein family|protein complex,,,be,akt,,,negative,i,phosphorylation,,uaz:cvcl_9115,,,,nan,nan,"from these data , we conclude that pp242 's effect on t308-p is dependent on its inhibition of akt phosphorylation by mtor at s473 .",pmc2637922,1,10,10,1,20
245,chk2,protein,,,,o96017,cytoplasm,go:0005737,p53,protein,,,uniprot,p04637,cytoplasm,go:0005737,positive,d,phosphorylation,,cellosaurus:cvcl_c111,,,,nan,nan,"another mechanism involves the phosphorylation of p53 by atm and chk2 , which stabilizes and activates p53 . ++++ chk2 also phosphorylates p53 to promote p21 accumulation and sustain g2/m arrest . ++++ furthermore it is elusive whether chk2 phosphorylates p53 after this protein is stabilized by atm in response to dsbs or if it phosphorylates a latent p53 fraction that existed before dna damage . ++++ furthermore it is elusive whether chk2 phosphorylates p53 after this protein is stabilized by atm in response to dsbs or if it phosphorylates a latent p53 fraction that existed before dna damage . ++++ it remains unclear today whether chk2 phosphorylates p53 to induce pro survival or pro apoptotic pathways .",pmc4296918,1,10,10,1,20
241,chk1,protein,,,,o14757,,,p53,protein,,,uniprot,p04637,,,positive,d,phosphorylation,,,,,,nan,nan,"atm , atr , and dna-pk phosphorylate p53 on s15 , while chk1 and chk2 phosphorylate p53 on s20 which stabilize p53 by preventing binding to mdm2 [ xref_bibr - xref_bibr ] .",pmc2954851,1,10,10,1,20
958,tnf-alpha,protein,,,,p01375,,,jnk,protein family|protein complex,,,be,jnk,,,positive,i,none,,,,,,nan,nan,"beta-arrestin specifically links the activation of seven transmembrane receptor to jnk3 activation ; crkii mediates the activation of rac1 in cells exposed to egf ; filamin mediates the activation of jnk by tnf-alpha receptor signaling ; and the jnk interacting proteins ( jip 1-3 ) , which are able to associate with all the components of the sapk module and additional signaling proteins and potentiate jnk activity .",pmc2801705,1,10,10,1,20
35,akt,protein family|protein complex,,,,akt,,,mtorc1,protein family|protein complex,,,be,mtorc1,,,negative,i,none,,,,,uberon:uberon:0000104,nan,nan,"akt also phosphorylates pras40 , an inhibitor of mtorc1 , and by doing so , it prevents the ability of pras40 to suppress mtorc1 signalling .",pmc3660063,1,10,9,1,19
68,akt,protein family|protein complex,,,,akt,,,tsc2,protein,,,uniprot,p49815,,,positive,d,phosphorylation,,,,,,nan,nan,"in cells that express activated akt , akt may phosphorylate tsc2 resulting in its inactivation . ++++ tsc2 phosphorylation by akt represses gap activity of the tsc1 and tsc2 complex , allowing rheb to accumulate in a gtp bound state .",pmc3660063,1,10,9,1,19
52,akt,protein family|protein complex,,,,akt,,,pras40,protein,,,uniprot,q96b36,,,negative,i,none,,,,,uberon:uberon:0000104,nan,nan,"akt also phosphorylates pras40 , an inhibitor of mtorc1 , and by doing so , it prevents the ability of pras40 to suppress mtorc1 signalling .",pmc3660063,1,10,9,1,19
506,ir,protein,,,,p06213,plasma membrane,go:0005886,pi3k,protein family|protein complex,,,be,pi3k,plasma membrane,go:0005886,positive,i,none,,,,,,nan,nan,"likewise , the pi3k and akt pathway is activated by ir via either direct or irs mediated recruitment of pi3k , whereas egfr mediated pi3k activation occurs mainly via a more intricate route that involves egfr- and src induced phosphorylation of the grb2 associated binder 1 ( gab1 ) .",pmc2683723,1,10,8,1,18
825,ras,protein family,,,,pf00071,other,go:0016020,raf-1,protein,,,uniprot,p04049,other,go:0016020,positive,i,none,,,,,,nan,nan,"in addition , raf-1 activation by ras was shown to be achieved through a combination of both physical interaction and indirect mechanisms involving the activation of pi3k as a second ras effector , which directs p21 activated kinase ( pak )-mediated regulatory phosphorylation of raf-1 [ xref_bibr ] .",pmc2652403,1,10,8,1,18
75,akt,protein family|protein complex,,,,akt,nucleus,go:0005634,mdm2,protein,,,uniprot,q00987,nucleus,go:0005634,positive,i,none,,,,,,nan,nan,"dominant negative akt inhibits nuclear entry of mdm2 , thus increasing the cellular level of p53 and transcriptional activity [ xref_bibr ] .",pmc3317191,1,10,8,1,18
82,akt,protein family|protein complex,,,,akt,other,go:0005730,mdm2,protein,,,uniprot,q00987,other,go:0005730,positive,i,none,,,,,,nan,nan,"these results are intriguing given that previous reports demonstrate that akt promotes the activity of the e3 ubiquitin ligase mdm2 , the important negative regulator of p53 . ++++ the migration of phospho-ser166-mdm2 was altered , suggesting that akt may promote alternative post-translational modifications of mdm2 . ++++ this was unexpected given that akt has been reported to promote the activity of the e3 ubiquitin ligase mdm2 , the important negative regulator of p53 . ++++ taken together , these results indicate that akt induces dna damage independent p53 stabilisation via arf- and pml independent nucleolar sequestration of mdm2 .",pmc3325598,1,10,8,1,18
94,akt,protein family|protein complex,,,,akt,other,go:0043226,mtorc1,protein family|protein complex,,,be,mtorc1,other,go:0043226,positive,i,none,,,,,,nan,nan,"xref_bibr , xref_bibr mtorc2 activates akt ( protein kinase b ) , while pi3k and akt primarily activates mtorc1 .",pmc4720880,1,10,8,1,18
555,mlst8,protein,,,,q9bvc4,other,go:0005856,mtor,protein,,,uniprot,p42345,other,go:0005856,positive,i,none,,,,,,nan,nan,gbetal and mlst8 interacts with the mtor kinase domain independently of raptor and potentiates mtor activity .,pmc2361102,1,10,8,1,18
545,mek,protein family|protein complex,,,,mek,nucleus,go:0005634,erk,protein family|protein complex,,,be,erk,nucleus,go:0005634,positive,i,none,,,cl:cl:0000066,,,nan,nan,"however , in our system it is unlikely that dephosphorylation of erk is upregulated in suspended cells , as erk activation mediated by active versions of either raf or mek was unaltered in suspension versus adherent conditions .",pmc2169466,1,10,8,1,18
147,atm,protein,,,,q13315,other,go:0005712,chk2,protein,,,uniprot,o96017,other,go:0005712,positive,i,none,,,cl:cl:0000021,,uberon:uberon:0000468,nan,nan,"in mice , chk2 is activated by atm in female germ cells during early meiosis and regulates cell cycle progression and spindle assembly during oocyte maturation and early embryo development .",pmc4296918,1,10,8,1,18
145,atm,protein,,,,q13315,other,go:0005657,chk2,protein,,,uniprot,o96017,other,go:0005657,positive,i,none,,cellosaurus:cvcl_0428,,,,nan,nan,"although chk1 activation is primarily dependent on ataxia telangiectasia mutated ( atm ) and rad3 related kinase ( atr ) activated by stalled replication forks and single-strand dna breaks , chk2 is mainly activated by atm induced by dna double-strand breaks ( dsbs ) [ xref_bibr ] .",pmc4159025,1,10,8,1,18
388,erk1,protein,,,,p27361,other,go:0005657,atm,protein,,,uniprot,q13315,other,go:0005657,positive,i,phosphorylation,,cellosaurus:cvcl_0022,,,,nan,nan,"consistent with erk1/2 being the major , if not the sole targets of mek [ xref_bibr ] , it was recently demonstrated that knockdown of either erk1 or erk2 significantly reduced atm activation ( atm s1981 phosphorylation and the nuclear foci of s1981 phosphorylated atm ) in response to etop , and thereby attenuated phosphorylation of the atm substrates , including the s139 of h2ax ( gammah2ax ) , s15 of p53 , and t68 of chk2 .",pmc3330700,1,10,8,1,18
267,chk2,protein,,,,o96017,other,sl-0276,p53,protein,,,uniprot,p04637,other,sl-0276,positive,i,none,,cellosaurus:cvcl_1r13,,,uberon:uberon:0000479 ++++ uberon:uberon:0001068,nan,nan,"both chk1 and chk2 can activate p53 upon dna damage and are important for cell cycle checkpoints , however , while chk1 is crucial for intra-s and g2/s transition , chk2 is more important for g1/s checkpoint . ++++ altogether , these results demonstrate that chk2 deletion attenuates induction of p53 and p21 as well as rescues proliferative defects in the skin of trf1 delta and delta k5cre mice , which in turn leads to a partial rescue of survival but also to increased tumorigenesis .",pmc4331747,1,10,8,1,18
264,chk2,protein,,,,o96017,other,go:0005819,p53,protein,,,uniprot,p04637,other,go:0005819,positive,i,none,,cellosaurus:cvcl_c111,cl:cl:0000021,,uberon:uberon:0000468,nan,nan,"chk2 can also activate p53 via the phosphorylation of other proteins , such as che-1 , strap , hdmx , as described above , and calcineurin binding protein 1 ( cabin1 ) . ++++ moreover , chk2 induces the removal of oocytes with unrepaired meiotic or induced dsbs by activating p53 and p63 .",pmc4296918,1,10,8,1,18
96,akt,protein family|protein complex,,,,akt,plasma membrane,go:0005886,mtorc1,protein family|protein complex,,,be,mtorc1,plasma membrane,go:0005886,positive,i,none,,,,,,nan,nan,mtorc1 is activated by the pi3k and akt pathway whereas tsc1-tsc2 ( tuberous sclerosis complex ) inhibits it [ xref_bibr ] .,pmc4258317,1,10,8,1,18
123,arf,protein,,,,q8n726,other,go:0005730 ++++ go:go:0005737,mdm2,protein,,,uniprot,q00987,other,go:0005730 ++++ go:go:0005737,negative,i,none,,,,,,nan,nan,"arf has been reported to promote p53 stability by sequestering mdm2 to the nucleolus [ xref_bibr , xref_bibr ] , whereas others have reported that nucleoplasmic arf suppresses mdm2 activity [ xref_bibr - xref_bibr , xref_bibr ] . ++++ although arf has long been recognized as an inhibitor of mdm2 [ xref_bibr , xref_bibr ] , debate exists regarding the cellular location and mechanism of arf mediated mdm2 inhibition . ++++ given that arf has been proposed to inhibit mdm2 in the nucleoplasm and nucleolar localization of arf protects it from degradation , a conundrum exists regarding the mechanism that allows npm to restrict arf nucleolar accumulation and thereby allow mdm2 inhibition [ xref_bibr , xref_bibr - xref_bibr ] in this article we identify that akt regulates both arf stability and localization at the nucleolus . ++++ this in turn promotes arf mediated inhibition of mdm2 in the nucleoplasm .",pmc4171619,1,10,8,1,18
242,chk1,protein,,,,o14757,other,sl-0276,p53,protein,,,uniprot,p04637,other,sl-0276,positive,i,none,,,,,uberon:uberon:0000479,nan,nan,"both chk1 and chk2 can activate p53 upon dna damage and are important for cell cycle checkpoints , however , while chk1 is crucial for intra-s and g2/s transition , chk2 is more important for g1/s checkpoint .",pmc4331747,1,10,8,1,18
395,erk2,protein,,,,p28482,other,go:0005657,atm,protein,,,uniprot,q13315,other,go:0005657,positive,i,phosphorylation,,cellosaurus:cvcl_0022,,,,nan,nan,"consistent with erk1/2 being the major , if not the sole targets of mek [ xref_bibr ] , it was recently demonstrated that knockdown of either erk1 or erk2 significantly reduced atm activation ( atm s1981 phosphorylation and the nuclear foci of s1981 phosphorylated atm ) in response to etop , and thereby attenuated phosphorylation of the atm substrates , including the s139 of h2ax ( gammah2ax ) , s15 of p53 , and t68 of chk2 .",pmc3330700,1,10,8,1,18
