index,Regulator Name,Regulator Type,Regulator Subtype,Regulator HGNC Symbol,Regulator Database,Regulator ID,Regulator Compartment,Regulator Compartment ID,Regulated Name,Regulated Type,Regulated Subtype,Regulated HGNC Symbol,Regulated Database,Regulated ID,Regulated Compartment,Regulated Compartment ID,Sign,Connection Type,Mechanism,Site,Cell Line,Cell Type,Tissue Type,Organism,Score,Source,Statements,Paper IDs,Evidence Score,Match Score,Kind Score,Epistemic Value,Total Score
7628,il-1beta,protein,,,,p01584,,,raf1,protein,,,uniprot,p04049,,,positive,i,none,,,,,,nan,nan,"dectin-1 deficiency remarkably reduced the expression of p-syk and p-raf1 in idcs treated with curdlan , whereas it did not affect the phosphorylation of syk and raf1 in idcs treated with tnf-alpha and il-1beta ( xref_fig ) , indicating that curdlan induced dectin-1-dependent activation of syk and raf1 in dcs .",pmc4980454,1,10,5,1,15
7631,il-1beta,protein,,,,p01584,,,tgf-beta1,protein,,,uniprot,p01137,,,positive,i,none,,,,,uberon:uberon:0003891,nan,nan,"il-1beta induces the expression of several pro metastatic and pro angiogenic proteins , among them vegfa , mmps , tnfalpha , and notably tgf-beta1 [ xref_bibr ] .",pmc4556693,1,10,5,1,15
7924,il-6,protein,,,,p05231,,,p-stat3,protein,,,uniprot,p40763,,,positive,i,amount,,,,,,nan,nan,"il-6 is secreted from the cells , activates the il-6 receptor and thus enhances the levels of p-stat3 .",pmc4095943,1,10,5,1,15
7586,il-1beta,protein,,,,p01584,,,apoptosis,biologicalprocess,,,go,go:0006915,,,positive,i,none,,,,,,nan,nan,"a time-course analysis of beta cell apoptosis in ins-1e cells after a 6h cpa treatment followed by exposure to il-1beta ( xref_fig ) indicated that il-1beta alone did not induce beta cell apoptosis at any time point analyzed , whereas cpa increased cell death in a time dependent manner .",pmc3730410,1,10,5,1,15
7228,igf2,protein,,,,p01344,,,ccnd1,protein,,,uniprot,p24385,,,positive,i,none,,cellosaurus:cvcl_0031,,,,nan,nan,we noted that increases in ahr protein correlated with increases in ccnd1 expression in cells treated with igf2 ( xref_bibr ) . ++++ we then knocked down ahr with specific interfering rna and found that reducing ahr levels inhibited igf2 stimulated increases in ccnd1 mrna and protein in mcf7 cells ( xref_bibr ) .,pmc4313785,1,10,5,1,15
7928,il-6,protein,,,,p05231,,,pstat3,protein,,,uniprot,p40763,,,positive,i,none,,,cl:cl:0000623,,,nan,nan,treatment of pbmcs with flll32 also eliminated basal and il-6 induced pstat3 .,pmc2902420,1,10,5,1,15
7073,ifngamma,protein,,,,p01579,,,stat1,protein,,,uniprot,p42224,,,positive,i,phosphorylation,,cellosaurus:cvcl_0546,,,,nan,nan,"this hpdodn was found in a complex with stat3 but not with stat1 using an original in-cell pull-down assay ; this hpdodn also did not inhibit ifngamma induced stat1 phosphorylation , nor did it inhibit the expression of the stat1-target irf1 .",pmc3325846,1,10,5,1,15
7226,igf1r,protein,,,,p08069.p,,,erbb2,protein,,,uniprot,p04626,,,positive,i,phosphorylation,,,,,,nan,nan,"for example , igf1 induced igf1r phosphorylation leads to ligand independent phosphorylation of erbb2 , which circumvents trastuzumab antibody inhibition and leads to an erbb2 based mechanism of resistance ( xref_bibr , xref_bibr ) .",pmc4408912,1,10,5,1,15
7221,igf1r,protein,,,,p08069,,,p53,protein,,,uniprot,p04637,,,positive,i,none,,,,,,nan,nan,"in addition to luminal tumors , igf1r actively promotes tumor growth and survival in p53 and brca1-mutant tumors , which usually emulate the basal like subtype ( xref_bibr - xref_bibr ) .",pmc4408912,1,10,5,1,15
7208,igf1,protein,,,,p05019,,,proliferation,biologicalprocess,,,go,go:0008283,,,positive,i,none,,,,,,nan,nan,exogenous addition of igf1 in ovarian cells also leads to their increased proliferation [ xref_bibr ] .,pmc3840597,1,10,5,1,15
7207,igf1,protein,,,,p05019,,,proliferation,biologicalprocess,,,go,go:0008283,,,positive,i,none,,cellosaurus:cvcl_0027 ++++ cellosaurus:cvcl_0485,,,,nan,nan,"we found that in all hcc cell lines that were examined , igf1 , added in combination with regorafenib , significantly increased the proliferation rate of about 60 % , compared to the same cells treated only with regorafenib . ++++ furthermore , the addition of igf-1 to the plc/prf/5 cell line induced increased cell proliferation in a dose dependent manner , showing that the major tumor promoting effects of igf ligands on hcc are exerted through igf-1r [ xref_bibr - xref_bibr ] .",pmc4557596,1,10,5,1,15
7203,igf1,protein,,,,p05019,,,mtor,protein,,,uniprot,p42345,,,positive,i,none,,,,,,nan,nan,"however , growth factors , e.g. , igf1 and insulin have also been shown to activate mtor signaling ( via pi3k and akt ) , and dr has been shown to reduce circulating levels of igf-1 and insulin in rodents ( dunn et al. , xref_bibr ) .",pmc3989927,1,10,5,1,15
7939,il-6,protein,,,,p05231,,,stat,protein,,,uniprot,p35610,,,positive,i,none,,,,,,nan,nan,"il-6 induces resistance to dexamethasone by activating jak and stat signaling and upregulating the antiapoptotic proteins , bcl-xl [ xref_bibr , xref_bibr ] and myeloid cell leukemia sequence-1 ( mcl1 ) [ xref_bibr , xref_bibr ] .",pmc4663284,1,10,5,1,15
7941,il-6,protein,,,,p05231,,,stat-3,protein,,,uniprot,p40763,,,positive,i,none,,,,,,nan,nan,"remarkably , expression of il-6 , il-17 , il-23 , and pghs-2 ( all of them activating stat-3 ) depends on stat-3 as co-transcription factor for nf-kappab .",pmc3342348,1,10,5,1,15
7947,il-6,protein,,,,p05231,,,stat3,protein,,,uniprot,p40763,,,positive,i,acetylation,,,,,,nan,nan,we showed earlier that il-6 induces acetylation of the stat3 nh 2 -terminus by the recruitment of the p300 coactivator .,pmc2490754,1,10,5,1,15
7187,igf-ii,protein,,,,p01344,,,akt-1,protein,,,uniprot,p31749,,,positive,i,none,,cellosaurus:cvcl_e777,,,uberon:uberon:0003891,nan,nan,"therefore , inhibition of this pathway using anti-igf-ir antibodies or expression of truncated igf-i receptors ( via recombinant adenovirus technique ) that function as a dominant negative form of igf-ir has been examined in the preclinical setting and shown to inhibit the growth of xenograft tumors by up-regulating stressor induced apoptosis , blocking igf-i and igf-ii induced activation of akt-1 , as well as sensitizing tumor cells to chemotherapy ( maloney et al. , xref_bibr ; min et al. , xref_bibr ; hezel et al. , xref_bibr ) .",pmc3939680,1,10,5,1,15
7964,il-6,protein,,,,p05231,,,stat3,protein,,,uniprot,p40763,,,positive,i,none,,,cl:cl:0000899,,,nan,nan,"this is surprising because in other settings , stat3 activation by il-6 or il-21 in tgf-beta-exposed t cells induces downregulation of foxp3 and upregulation of the transcription factor rorgammat leading to induction of il-17-producing th17 cells [ xref_bibr ] .",pmc2946577,1,10,5,1,15
7977,il-6,protein,,,,p05231,,,stat3,protein,,,uniprot,p40763,,,positive,i,phosphorylation,,,cl:cl:0000235,,,nan,nan,"additionally , stat3 has a dual role in il-6 mediated signaling ; its activation may result in increased il-6 , but also il-6 itself may lead to phosphorylation of stat3 which results in diverse biological responses ( xref_bibr , xref_bibr ) .",pmc4601860,1,10,5,1,15
7101,igf-1,protein,,,,p05019,,,bcl-2,protein,,,uniprot,p10415,,,positive,i,none,,cellosaurus:cvcl_0291,,,,nan,nan,induction of bcl-2 promoter activity by igf-1 occurs via a pkb and akt pathway involving the cyclic amp response element binding protein transcription factor .,pmc4090725,1,10,5,1,15
7121,igf-1,protein,,,,p05019,,,proliferation,biologicalprocess,,,go,go:0008283,,,positive,i,none,,,,,uberon:uberon:0000468,nan,nan,"this is particularly true for the tn breast cancer cells ( estrogen-unresponsive ) , in which igf1r is largely expressed and igf-1 stimulates proliferation and survival , making them responsive in vitro to anti-igf1r therapies [ xref_bibr , xref_bibr ] .",pmc4598970,1,10,5,1,15
7120,igf-1,protein,,,,p05019,,,proliferation,biologicalprocess,,,go,go:0008283,,,positive,i,none,,cellosaurus:cvcl_d953,cl:cl:0000138,,uaz:ua-org-92,nan,nan,"igf-1 is synthesised by the liver under the control of growth hormone and stimulates bone growth because it increases the proliferation of cartilage cells in the epiphyseal plate of long bones . ++++ in essence , obese individuals with hyperinsulinaemia and hyperglycemia will have higher concentrations of free circulating igf-1 and augmented activation of the igf dependent proliferation pathway .",pmc3747439,1,10,5,1,15
7107,igf-1,protein,,,,p05019,,,hif1alpha,protein,,,uniprot,q16665,,,positive,i,none,,,,,,nan,nan,"one of the possible mechanisms of castration resistance is the activation of alternate growth promoting pathways ( including those stimulated by igf-1 , egf and her2 ) , which can drive the growth of pc tumors independently of androgens xref_bibr .",pmc3546972,1,10,5,1,15
7181,igf-i,protein,,,,p05019,,,protein kinase b,protein,,,uniprot,p31749,,,positive,i,none,,cellosaurus:cvcl_0062,cl:cl:0000034,,,nan,nan,"overexpression of igfbp5 is known to inhibit igf-i activation of irs-1 ( ir substrate-1 ) , fkhrl-1 ( forkhead in rhabdomyosarcoma like 1 ) and protein kinase b .",pmc4690035,1,10,5,1,15
7176,igf-i,protein,,,,p05019,,,irs-1,protein,,,uniprot,p35568,,,positive,i,none,,cellosaurus:cvcl_0062,cl:cl:0000034,,,nan,nan,"overexpression of igfbp5 is known to inhibit igf-i activation of irs-1 ( ir substrate-1 ) , fkhrl-1 ( forkhead in rhabdomyosarcoma like 1 ) and protein kinase b .",pmc4690035,1,10,5,1,15
8008,il-6-,protein,,,,p05231,,,stat3,protein,,,uniprot,p40763,,,positive,i,none,,cellosaurus:cvcl_0153,,,,nan,nan,"in line with that , medica suppressed the il-6- and hgf activated phospho-stat3 ( tyr705 ) in crc ht29 or ptc bcpap cells , and the constitutively-active stat3 in a375 melanoma cells .",pmc4951321,1,10,5,1,15
7979,il-6,protein,,,,p05231,,,stat3,protein,,,uniprot,p40763,,,positive,i,transcription,,,cl:cl:0009002,,,nan,nan,"in this study , using sirna mediated akt and stat3 knockdown , our data further extended these findings by indicating that il-17 stimulated il-6 induction was attributed to the activation of the akt pathway ; il-6 in turn activated jak2 and stat3 and up-regulated the transcription of the proinvasive genes .",pmc3310750,1,10,5,1,15
7180,igf-i,protein,,,,p05019,,,proliferation,biologicalprocess,,,go,go:0008283,,,positive,i,none,,uaz:ua-cline-5317,,,uberon:uberon:0000428,nan,nan,"additionally , it has been observed that igf-i induces in vitro proliferation and cell migration in gbm [ xref_bibr ] .",pmc4092852,1,10,5,1,15
7156,igf-1r,protein,,,,p08069,,,mtor,protein,,,uniprot,p42345,,,positive,i,none,,,,,uberon:uberon:0000104,nan,nan,diet induced changes to circulating igf-1 to modulate igf-1r and egfr activation and signaling downstream of akt and mtor [ xref_bibr ] .,pmc3414727,1,10,5,1,15
17801,vegf-d,protein,,,,o43915,,,vegfr-2,protein,,,uniprot,p35968,,,positive,i,none,,,,,uberon:uberon:0007023,nan,nan,it promotes tumour metastasis via development of the lymph vessels by activating vegfr-3 and not vegfr-2 [ xref_bibr ] .,pmc3328748,1,10,3,1,13
3935,egf,protein,,,,p01133,,,egfr,protein,,,uniprot,p00533,,,positive,i,phosphorylation,,cellosaurus:cvcl_0031,cl:cl:0002327,,,nan,nan,b6h12 treatment also acutely inhibited egf induced egfr tyrosine phosphorylation .,pmc4891109,1,10,3,1,13
3936,egf,protein,,,,p01133,,,egfr,protein,,,uniprot,p00533,,,positive,i,phosphorylation,,cellosaurus:cvcl_0062,,,,nan,nan,egf stimulation for 5 min significantly increased egfr phosphorylation at y 1068 . ++++ b6h12 treatment inhibited basal and egf stimulated egfr phosphorylation in bcscs but not in differentiated cells .,pmc4891109,1,10,3,1,13
3937,egf,protein,,,,p01133,,,egfr,protein,,,uniprot,p00533,,,positive,i,phosphorylation,,cellosaurus:cvcl_0480,,,,nan,nan,"as expected , treatment with egf increased egfr phosphorylation .",pmc3377633,1,10,3,1,13
17802,vegf-d,protein,,,,o43915,,,vegfr-3,protein,,,uniprot,p35916,,,positive,i,none,,,,,uberon:uberon:0007023,nan,nan,it promotes tumour metastasis via development of the lymph vessels by activating vegfr-3 and not vegfr-2 [ xref_bibr ] .,pmc3328748,1,10,3,1,13
3938,egf,protein,,,,p01133,,,egfr,protein,,,uniprot,p00533,,,positive,i,phosphorylation,,cellosaurus:cvcl_1107,,,,nan,nan,"as shown in figure xref_fig , addition of egf to serum starved cells stimulated the phosphorylation of egfr and downstream signaling components including akt , erk , without affecting sfk phosphorylation .",pmc4480700,1,10,3,1,13
3939,egf,protein,,,,p01133,,,egfr,protein,,,uniprot,p00533,,,positive,i,phosphorylation,,cellosaurus:cvcl_1483,,,,nan,nan,"our data showed that egf ( 20 ng/ml for 30 min ) strongly stimulated the phosphorylation of egfr protein in 5 nsclc cells while wb-308 reduced egf induced egfr phosphorylation in a dose dependent manner in these nsclc cell lines . ++++ herein we employed 5 different nsclc cells , including a549 , pc-9 , nci-h1975 , nci-h1650 , and hcc-827 to test the effect of wb-308 on egf induced egfr phosphorylation by western blot analysis .",pmc4466647,1,10,3,1,13
3940,egf,protein,,,,p01133,,,egfr,protein,,,uniprot,p00533,,,positive,i,phosphorylation,,cellosaurus:cvcl_1k15,,,,nan,nan,"in addition , we found a positive correlation between brk cdna dose dependent expression and egf induced egfr phosphorylation ( xref_fig , blot for egfr-yp ) , suggesting that brk may have a direct role in regulating egfr phosphorylation and functional consequences .",pmc3326223,1,10,3,1,13
3941,egf,protein,,,,p01133,,,egfr,protein,,,uniprot,p00533,,,positive,i,phosphorylation,,cellosaurus:cvcl_4782,,,,nan,nan,"as we expected , egf significantly increased egfr and her2 phosphorylation and its downstream akt phosphorylation . ++++ as we expected , egf significantly increased egfr and her2 phosphorylation and its downstream akt phosphorylation .",pmc2957324,1,10,3,1,13
3942,egf,protein,,,,p01133,,,egfr,protein,,,uniprot,p00533,,,positive,i,phosphorylation,,cellosaurus:cvcl_e889,,,,nan,nan,"in agreement , egfr phosphorylation following egf stimulation was also prolonged .",pmc2361810,1,10,3,1,13
3944,egf,protein,,,,p01133,,,egfr,protein,,,uniprot,p00533,,,positive,i,transcription,,cellosaurus:cvcl_ax73,,,,nan,nan,"egf stimulation increased egfr , akt , src , and igf-1r phosphorylation in a549 and h460 cells but not in h522 , a low egfr expressing cell line [ xref_bibr ] .",pmc4453276,1,10,3,1,13
17804,vegf-r1,protein,,,,p17948,,,vegf,protein,,,uniprot,p15692,,,positive,i,none,,,,,uberon:uberon:0002049,nan,nan,"vegf intracellular signaling is mediated by three tyrosine kinase-receptors , namely vegf-r1 , -r2 , and -r3 , as well as co-receptors such as neuropilins .",pmc3744053,1,10,3,1,13
14295,smad2,protein,,,,q15796,,,smad4,protein,,,uniprot,q13485,,,positive,i,none,,,cl:cl:0000084,,,nan,nan,"smad2 reversed , whereas smad3 further enhanced , the inhibitory effect of smad4 on eomes-luc activity ( xref_fig b ) .",pmc3840488,1,10,3,1,13
17803,vegf-d,protein,,,,o43915,,,vegfr-3,protein,,,uniprot,p35916,,,positive,i,none,,,,,uberon:uberon:0007798,nan,nan,vegfr-3 is activated only by vegf-c and vegf-d 22 .,pmc4001841,1,10,3,1,13
3960,egf,protein,,,,p01133,,,her2,protein,,,uniprot,p04626,,,positive,i,phosphorylation,,cellosaurus:cvcl_4782,,,,nan,nan,"as we expected , egf significantly increased egfr and her2 phosphorylation and its downstream akt phosphorylation . ++++ as we expected , egf significantly increased egfr and her2 phosphorylation and its downstream akt phosphorylation .",pmc2957324,1,10,3,1,13
3933,egf,protein,,,,p01133,,,egfr,protein,,,uniprot,p00533,,,positive,i,none,,,,,uberon:uberon:0000105,nan,nan,"it also induces the dimerization and downregulation of egfr , perturbs cell cycle progression by inducing g1 arrest through an increase in the protein level of p27 , an inhibitor of cyclin dependent kinases , and inhibits tumour induced angiogenesis [ xref_bibr ] .",pmc4810111,1,10,3,1,13
8208,insulin,protein,,,,p01308,,,igf1,protein,,,uniprot,p05019,,,positive,i,none,,,,,,nan,nan,"medi-573 is a human antibody that selectively targets igf1 and igf2 , but not insulin ( xref_bibr ) .",pmc4313785,1,10,3,1,13
3961,egf,protein,,,,p01133,,,her3,protein,,,uniprot,p21860,,,positive,i,phosphorylation,,,cl:cl:0002327,,,nan,nan,"brk interacts with egfr , and brk also interacts closely with other members of the egfr family -- her2 ( xref_bibr ; xref_bibr ) and her3 ( xref_bibr ) -- to enhance her2 induced activation of cell signaling and to mediate egf stimulated her3 phosphorylation .",pmc3326223,1,10,3,1,13
13306,rela,protein,,,,q04206,,,relb,protein,,,uniprot,q01201,,,positive,i,transcription,,,,,,nan,nan,"the transcription of relb could be induced by rela activation [ xref_bibr ] , indicating that the activated rela may contribute to the latent but enhanced activation of relb .",pmc3048558,1,10,3,1,13
13305,rela,protein,,,,q04206,,,relb,protein,,,uniprot,q01201,,,positive,i,none,,,,,,nan,nan,"the transcription of relb could be induced by rela activation [ xref_bibr ] , indicating that the activated rela may contribute to the latent but enhanced activation of relb .",pmc3048558,1,10,3,1,13
17810,vegfa,protein,,,,p15692,,,vegfr2,protein,,,uniprot,p35968,,,positive,i,none,,,,,uberon:uberon:0002049,nan,nan,"vegfa is released from tissues in response to hypoxia , inflammation , or wound healing and activates vegfr2 receptor tyrosine kinase activity in endothelial cells .",pmc4284789,1,10,3,1,13
17816,vegfd,protein,,,,o43915,,,vegfr3,protein,,,uniprot,p35916,,,positive,i,none,,,,,,nan,nan,"specifically , vegfd is a ligand for the vegf receptor tyrosine kinases and activates the structurally similar type iii receptor tyrosine kinase vegfr3 xref_bibr .",pmc2754338,1,10,3,1,13
17818,vegfr-1,protein,,,,p17948,,,vegf,protein,,,uniprot,p15692,,,positive,i,none,,cellosaurus:cvcl_0320,,,,nan,nan,"pharmacologic blockade of vegfr-1 with imc-18f1 or src kinase inhibition with ap23464 or pp2 completely inhibited vegf induced migration in both cell lines ( p < 0.001 ) , again demonstrating the requirement of sfk activation through vegfr-1 in this process .",pmc2361330,1,10,3,1,13
17827,vegfr-2,protein,,,,p35968,,,vegf,protein,,,uniprot,p15692,,,positive,i,none,,,cl:cl:0000034,,,nan,nan,"of the three vegfr family members , vegfr-2 seems to mediate the major mitogenic , angiogenic , and permeability enhancing effects of vegf .",pmc4775843,1,10,3,1,13
17828,vegfr-2,protein,,,,p35968,,,vegf,protein,,,uniprot,p15692,,,positive,i,none,,,,,uberon:uberon:0003061,nan,nan,"thus , vegf signaling in angiogenesis may be mediated mainly by vegfr-2 .",pmc1993966,1,10,3,1,13
3984,egf,protein,,,,p01133,,,pegfr,protein,,,uniprot,p00533,,,positive,i,amount,,cellosaurus:cvcl_0419,,,,nan,nan,"in mda mb-468 cells , egf increased levels of pegfr and perbb3 whereas egf and hgf together increased phosphorylated met , egfr and erbb3 .",pmc4216798,1,10,3,1,13
13141,rad50,protein,,,,q92878,,,atm,protein,,,uniprot,q13315,,,positive,i,none,,cellosaurus:cvcl_0359,,,,nan,nan,"the expression of rad50 was up-regulated in this study , and rad50 might activate atm .",pmc4086286,1,10,3,1,13
3934,egf,protein,,,,p01133,,,egfr,protein,,,uniprot,p00533,,,positive,i,none,,,,,uberon:uberon:0000468,nan,nan,"egf induced activation of egfr stimulates cells to rapidly acquire an invasive or metastatic phenotype ( xref_bibr ; xref_bibr ) . ++++ to assess whether crk and nck were associated with the induction of egfr mediated carcinoma cell migration , lysates from fg cells treated with or without egf were subjected to immunoprecipitation with anti-cas followed by immunoblotting for nck1 , nck2 , crkl and crki .",pmc3711644,1,10,3,1,13
17784,vegf-b,protein,,,,p49765,,,vegfr-1,protein,,,uniprot,p17948,,,positive,i,none,,,,,,nan,nan,"ex vivo studies have also shown that vegfr-1 activation by vegf-a or vegf-b induces increased cell invasion and migration , as well as phenotypic changes associated with activation of the mapk pathway in tumor cells [ xref_bibr ] .",pmc4481026,1,10,3,1,13
17794,vegf-c,protein,,,,p49767,,,vegfr-3,protein,,,uniprot,p35916,,,positive,i,none,,,,,uberon:uberon:0007798,nan,nan,vegfr-3 is activated only by vegf-c and vegf-d 22 .,pmc4001841,1,10,3,1,13
17793,vegf-c,protein,,,,p49767,,,vegfr-3,protein,,,uniprot,p35916,,,positive,i,none,,,cl:cl:0002138,,uberon:uberon:0000105 ++++ uberon:uberon:0000479,nan,nan,our findings demonstrate that specific vegfr-3 signaling pathways are activated in lecs by vegf-c . ++++ a significant increase in vegfr-3 and phosphopi3k interactions was detected in lecs treated with vegf-c when compared to vehicle control ( xref_fig ) .,pmc3382126,1,10,3,1,13
17648,vegf,protein,,,,p15692,,,p-vegfr2,protein,,,uniprot,p35968,,,positive,i,none,,cellosaurus:cvcl_0035,,,,nan,nan,"thus , elisa based tyrosine kinase assay was conducted to further examine the effects of alpha-santalol on vegf stimulated p-vegfr2 .",pmc4221991,1,10,3,1,13
8010,il-6r,protein,,,,p40189,,,stat3,protein,,,uniprot,p40763,,,positive,i,none,,cellosaurus:cvcl_8792,cl:cl:0000134,,,nan,nan,bortezomib also triggered a dose dependent inhibition of vegf and il-6 production by and secretion from mmecs and abrogated il-6 triggered signaling cascades via caspase dependent downregulation of gp130 in mm [ xref_bibr ] ; gp130 is the signaling component of the high affinity il-6r complex that activates stat3 .,pmc2829627,1,10,3,1,13
839,atm,protein,,,,q13315,,,chk2,protein,,,uniprot,o96017,,,positive,i,phosphorylation,,,cl:cl:0000893,,,nan,nan,"interestingly , ir induced apoptosis was restored in chk2 -/- thymocytes by reintroduction of the wild-type chk2 gene , but not by a chk2 gene in which the sites phosphorylated by atm and ataxia telangiectasia and rad3 ( + ) related ( atr ) were mutated to alanine . ++++ p53 is also stabilized by atm mediated chk2 phosphorylation .",pmc3682694,1,10,3,1,13
17673,vegf,protein,,,,p15692,,,vegfr-1,protein,,,uniprot,p17948,,,positive,i,none,,,cl:cl:0000968,,,nan,nan,"the significance of aberrant expression of vegfr-1 alone on tumours of epithelial origin remains unclear , but a recently published work found a similar lack of proliferation in vegf stimulated colon cancer cells expressing vegfr-1 ( fan et al , 2005 ) .",pmc2361330,1,10,3,1,13
17676,vegf,protein,,,,p15692,,,vegfr-2,protein,,,uniprot,p35968,,,positive,i,none,,,,,,nan,nan,the contrast in the transactivation of vegfr-2 by p2y 1 r activation via the action of nm23 and ndpk versus vegf activation can be seen in the ability of pp2 to block p2y 1 r but not vegf activation of vegfr-2 [ xref_bibr ] .,pmc3214996,1,10,3,1,13
17677,vegf,protein,,,,p15692,,,vegfr-2,protein,,,uniprot,p35968,,,positive,i,none,,,,,uberon:uberon:0002042,nan,nan,"vegfr-2 is activated primarily by vegf , but proteolytically cleaved forms of vegf-c and vegf-d may also activate this receptor .",pmc4001841,1,10,3,1,13
3987,egf,protein,,,,p01133,,,phospho-egfr,protein,,,uniprot,p00533,,,positive,i,none,,cellosaurus:cvcl_0153,,,,nan,nan,"in contrast , egf- or hgf activated growth of ht29 and bcpap cells was suppressed by medica , with decrease in egf activated phospho-egfr ( tyr1068 ) , phospho-erbb2 ( tyr1248 ) , phospho-akt ( ser473 ) and phospho-erk ( tyr204 ) , as well as in hgf activated phospho-met ( tyr1234 ) .",pmc4951321,1,10,3,1,13
8011,il-6r,protein,,,,p40189,,,stat3,protein,,,uniprot,p40763,,,positive,i,none,,,cl:cl:0002328,,,nan,nan,"in this manuscript we report that aberrant activation of pi3k and akt pathway plays a critical role in the proliferation , self-renewal and tumorigenicity of nsclc tics by establishing an autocrine il-6 and il-6r signalling loop that activates stat3 . ++++ in conclusion the results presented here suggest that , among the multiple pathways that are activated in nsclc , aberrant pi3k and akt signalling contributes to promote and/or maintain nsclc tics by eliciting an autocrine il-6 and il-6r loop that activates the transcription factor stat3 .",pmc4767462,1,10,3,1,13
17679,vegf,protein,,,,p15692,,,vegfr-2,protein,,,uniprot,p35968,,,positive,i,phosphorylation,,,,,uberon:uberon:0003481 ++++ uberon:uberon:0002049,nan,nan,"in fak-kd mice , vegf increased vegfr-2 and c-src-y416 phosphorylation but not vec-y658 or fak-y397 phosphorylation ( xref_fig ) . ++++ in fak-wild-type ( wt ) mice , vegf increased vegfr-2 activation and vec-y658 , fak-y397 , and c-src-y416 phosphorylation .",pmc3897185,1,10,3,1,13
17681,vegf,protein,,,,p15692,,,vegfr1,protein,,,uniprot,p17948,,,positive,i,none,,,,,,nan,nan,"vegf secreted by normal and tumor cells induces angiogenesis by binding its specific receptors , vegfr1 and vegfr2 .",pmc4033970,1,10,3,1,13
8078,il6,protein,,,,p05231,,,stat3,protein,,,uniprot,p40763,,,positive,i,phosphorylation,,cellosaurus:cvcl_1483,,,,nan,nan,xref_bibr indicate that becn1 may also be a direct transcriptional target of stat3 because il6 treatment significantly promotes stat3 phosphorylation while reducing becn1 mrna and protein levels in ags and nci-h1650 cells .,pmc4509450,1,10,3,1,13
16545,tnfr1,protein,,,,p19438,,,traf2,protein,,,uniprot,q12933,,,positive,i,none,,,,,,nan,nan,"downstream of tnfr1 , cyld has been proposed to be phosphorylated by ikkalpha and beta in a nemo dependent manner and that this enables traf2 to be sufficiently ubiquitinated to signal optimally 112 .",pmc4737190,1,10,3,1,13
17685,vegf,protein,,,,p15692,,,vegfr2,protein,,,uniprot,p35968,,,positive,i,phosphorylation,,cellosaurus:cvcl_d965,,,uberon:uberon:0003481,nan,nan,another study reported that vegf stimulated vegfr2 tyrosine phosphorylation was more robust and sustained in cav-1 ko lung ecs .,pmc3252561,1,10,3,1,13
